companyName,description,jobName,location,require,salary,timePost
PT DayaTani Digital Indonesia,"",Senior Data Scientist,Singapore,"",SGD1-SGD100,11-01-2024
SATS Ltd,"",Data Scientist Intern (Data & Business Analytics) Jan - Jul 24,Singapore,"","SGD1,2N-SGD1,2N",18-12-2023
Rsm Singapore,"",Intern Data Science,"Orchard, Singapore","","SGD800-SGD1,5N",18-12-2023
Agora Co-learning Spaces Pte Ltd,"",Data Analyst Intern,Singapore,"","SGD800-SGD1,2N",26-12-2023
SATS Ltd,"",Data Analyst Intern (Data & Business Analytics) Jan - Jul 2024,Singapore,"","SGD1,2N-SGD1,2N",18-12-2023
Rsm Singapore,"",Intern Data Science Developer,Singapore,"","SGD900-SGD1,5N",10-01-2024
Soristic,"",Research Data Analysis cum Marketing Intern,Singapore,"",SGD799-SGD800,11-01-2024
Monstyr Pte. Ltd.,"",Data Entry - Contract Position (Admin),Singapore,"","Rp2,2Tr-Rp2,5Tr",11-01-2024
Bata Shoe Singapore Pte Ltd,"",Human Resource Intern,Singapore,"",SGD800-SGD1N,11-01-2024
Atomionics,"",Software Controls Engineering Intern (Jan 2024 or later),Singapore,"","SGD1,7N",11-01-2024
Vopak Terminals Singapore Pte Ltd,"",HR Intern,Singapore,"","SGD1N-SGD1,4N",11-01-2024
SGCM Pte Ltd,"",Product Management Intern,Singapore,"",SGD800-SGD1N,11-01-2024
ZENKO Superfoods,"",E-commerce and Livestream intern,Singapore,"",SGD800,14-01-2024
Rsm Singapore,"",Intern AI development Intern - Retrieval-Augmented Generation (R,Singapore,"","SGD900-SGD1,5N",12-01-2024
Halcyon Agri Corporation Limited,"",HR Business Analytics Intern (Available from Jan 2024),Singapore,"","SGD800-SGD1,2N",11-01-2024
ConcreteAI,"",IOT Intern (Q3 Q4 Sem 1),Singapore,"",Competitive,10-01-2024
Soristic,"",Research and Community Outreach Intern,Singapore,"",SGD799-SGD800,11-01-2024
KNO,"",Personal Assistant (Part-time) (WFH/Remote),Singapore,"",SGD10-SGD20,26-12-2023
Consulting Group - Asia Insight Pte Ltd,"",Market Research Intern,Singapore,"",SGD800-SGD1N,14-12-2023
Advisors Alliance Group,"",Management Associate (Traineeship),Singapore,"","SGD1,2N",12-01-2024
PALO IT SINGAPORE PTE. LTD.,"",Sales Operations Intern,Singapore,"","SGD1,2N-SGD1,5N",28-12-2023
Impossible Marketing Pte Ltd,"",Google Ads (PPC) Account Manager,Singapore,"","SGD3N-SGD3,3N",12-01-2024
Impossible Marketing Pte Ltd,"",Digital Marketing Support,Singapore,"",SGD2N-SGD3N,12-01-2024
Lalamove,"",Corporate Sales Associate,Singapore,"","SGD2,8N-SGD3,5N",26-12-2023
SATS Ltd,"",Operational Excellence Intern,Singapore,"","SGD850-SGD1,2N",18-12-2023
RYSE Marketing Group,"",Junior Sales Associate (ENTRY LEVEL),Singapore,"",SGD3N-SGD5N,11-01-2024
Impossible Marketing Pte Ltd,"",Performance Marketing Specialist,Singapore,"","SGD3N-SGD3,3N",12-01-2024
Motorist Pte Ltd,"",Administration Executive,Singapore,"",SGD2N-SGD3N,12-01-2024
SATS Ltd,"",Logistics & Warehouse Intern,Singapore,"","SGD1,2N",14-12-2023
Watson's Personal Care Stores Pte Ltd,"",Merchandising Intern,Singapore,"",SGD800-SGD1N,11-01-2024
Hoow Foods Pte. Ltd.,"",Creative Marketing Intern,Singapore,"",SGD1N,11-01-2024
Braverywf,"",Retail Coordinator,Singapore,"","SGD2,8N-SGD3,5N",11-01-2024
SATS Ltd,"",Talent Acquisition Intern (Jan-Jun 2024),Singapore,"","SGD1,2N",18-12-2023
PALO IT SINGAPORE PTE. LTD.,"",Social and Events Marketing Specialist,Singapore,"","SGD3,5N-SGD4,2N",11-01-2024
Rsm Singapore,"",Intern Business Consulting (NPO),Singapore,"","SGD900-SGD1,5N",14-12-2023
Lalamove,"",Corporate Sales Associate,Singapore,"","SGD2,8N-SGD3,5N",26-12-2023
SATS Ltd,"",Operational Excellence Intern,Singapore,"","SGD850-SGD1,2N",18-12-2023
Assembly Works HR Pte Ltd,"",Marketing Intern,Singapore,"",SGD800-SGD1N,11-01-2024
Metropolitan YMCA Singapore,"",Community Services Intern,Singapore,"",Competitive,18-12-2023
Big 3 Media,"",Human Resource (HR) Intern,Singapore,"","SGD600-SGD1,2N",11-01-2024
Lalamove,"",Operations Specialist (6 Months Contract),Singapore,"","SGD1,8N-SGD2,3N",11-01-2024
Source Studio Pte Ltd,"",Fashion Designer,Singapore,"",SGD700-SGD1N,11-01-2024
ANOTECH Singapore,"",UX Researcher,Singapore,"","SGD4,5N-SGD6N",11-01-2024
Metropolitan YMCA Singapore,"",Youth Intern,Singapore,"",Competitive,04-01-2024
Lalamove,"",Warehouse Associate (6 Months Contract),Singapore,"","SGD1,8N-SGD2,2N",26-12-2023
Watson's Personal Care Stores Pte Ltd,"",Merchandising Intern,Singapore,"",SGD800-SGD1N,11-01-2024
ConcreteAI,"",Civil Project Intern (Q3 Q4 Sem 1 Part time/ Full time),Singapore,"",Competitive,10-01-2024
Rsm Singapore,"",Intern Business Consulting (ESG),Singapore,"","SGD700-SGD1,5N",18-12-2023
Rohde & Schwarz Regional Headquarters Singapore Pte Ltd,"",Digital Marketing Intern,Singapore,"",Competitive,14-12-2023
Royal Org,"",Sale & Marketing,Singapore,"",SGD3N-SGD4N,14-12-2023
Viharbour (Singapore) Enterprise Pte Ltd,"",E-Commerce Specialist,Singapore,"","SGD2,8N-SGD3,5N",11-01-2024
RYSE Marketing Group,"",Marketing Associate (Fresh Grad/ORD Welcome),Singapore,"",SGD3N-SGD5N,11-01-2024
ConcreteAI,"",Civil Project Intern,Singapore,"",Competitive,10-01-2024
CocoTutors,"",Home Tutor,Singapore,"",SGD100-SGD2N,11-01-2024
Metropolitan YMCA Singapore,"",Resource Development Intern,Singapore,"",Competitive,18-12-2023
Thinkreh,"",Automation Engineer Xceptor,Singapore,"",SGD3N-SGD6N,11-01-2024
ANOTECH Singapore,"",Frontend Developer - React/Angular,Singapore,"","SGD4,5N-SGD6N",11-01-2024
ZENKO Superfoods,"",Marketing and Events intern,"Geylang, Singapore","",SGD800,11-01-2024
Aztech Technologies Pte Ltd,"",Human Resources Internship,Singapore,"",Competitive,02-01-2024
Deltafrontier Pte Ltd,"",Project Engineer,Singapore,"","SGD3,5N-SGD5N",11-01-2024
National Institute Of Education,"",Executive (Finance Department) [NIE],Singapore,"",Competitive,11-01-2024
Marymount Labs,"",Product Engineer,Singapore,"","SGD800-SGD1,2N",27-12-2023
Samtec Asia Pacific,"",Warehouse Associate,Singapore,"","SGD2N-SGD3,5N",11-01-2024
Soristic,"",Project Management cum Community Outreach Intern,Singapore,"",SGD799-SGD800,11-01-2024
Purpleforest Events,"",Events Manager Traineeship,Singapore,"","SGD3N-SGD3,4N",02-01-2024
GiftGood,"",eCommerce Business & Operations Intern (6-month Internship),Singapore,"","SGD1N-SGD1,5N",07-01-2024
RYSE Marketing Group,"",Entry Level Events Marketing Associate,Singapore,"",SGD3N-SGD5N,11-01-2024
The Swim Starter,"",Business Operations Executive,Singapore,"","SGD2,8N-SGD3,2N",20-12-2023
Bluente,"",Social Media Marketing Intern,Singapore,"",Competitive,11-01-2024
Halcyon Agri Corporation Limited,"",Human Resources Intern,Singapore,"",Competitive,12-01-2024
Kobe Global Technologies Pte Ltd,"",Content & Community Curator,Singapore,"",Competitive,05-01-2024
Aztech Technologies Pte Ltd,"",R&D Firmware Internship,Singapore,"",Competitive,02-01-2024
Aevice Health,"",Business Development Intern (Jan - Jun 2024),Singapore,"",SGD1N,07-01-2024
Aztech Technologies Pte Ltd,"",R&D Hardware Internship,Singapore,"",Competitive,02-01-2024
Bubs and Tots Swim School/MantaPlay,"",Customer Service Officer (Full-Time Role),Singapore,"","SGD2N-SGD2,5N",14-01-2024
USER,"",ICT Infrastructure Engineer - Unix Platform,Singapore,"",Competitive,11-01-2024
Aztech Technologies Pte Ltd,"",R&D Software Internship,Singapore,"",Competitive,02-01-2024
Focus Rentals,"",Administrative Executive,Singapore,"","SGD2,5N-SGD3,2N",14-12-2023
Q Retail Pte Ltd,"",Merchandiser,Singapore,"","SGD3N-SGD5,5N",28-12-2023
Aztech Technologies Pte Ltd,"",Corporate Affairs Internship,Singapore,"",Competitive,02-01-2024
KNO,"",Personal Assistant - Part Time(Work From Home) / Full Time,"Kent Ridge, Singapore","",SGD10-SGD20,26-12-2023
Atomionics,"",Hardware Controls Engineering Intern (Jan 2024 or later),Singapore,"","SGD1,7N",11-01-2024
The Swim Starter,"",Head of Customer Acquisition,Singapore,"","SGD4,5N-SGD5N",10-01-2024
Tesla Motors,"",Service Advisor,Singapore,"",Competitive,11-01-2024
The Financial Assembly,"",Business Operations Executive,Singapore,"","SGD3N-SGD3,6N",11-01-2024
Dulwich College (Singapore),"",Accounts Receivable (AR) Assistant,Singapore,"","SGD2,5N-SGD2,8N",11-01-2024
USER,"",ICT Infrastructure Engineer - Windows and Virtualisation Platfor,Singapore,"",Competitive,11-01-2024
National Institute Of Education,"",Manager (AFA) (Academic & Faculty Affairs) [NIE],Singapore,"",Competitive,14-12-2023
RYSE Marketing Group,"",Entry Level Marketing Professionals,Singapore,"",SGD3N-SGD5N,11-01-2024
PT Webuy Social Indonesia,"",Talent Acquisition (Singapore),Singapore,"","SGD2,8N-SGD3N",11-01-2024
