companyName,description,jobName,location,require,salary,timePost
BayOne,"Senior Data engineers with 10+ years of experience. This is a 100% remote role, PST hours (Target West Coast candidates but don't limit your search). Bill rate: $120, PR: $85W2, or $95-$100 C2C. We only need stellar candidates. 3-4 rounds of Interviews (tech screening, including real-time coding). Skill Set: Big Data: Scala, Databricks, Spark SQL, Spark Streaming, Python, Pyspark Cloud : Azure, ADF System Design : API Design, GraphQL, Event-driven architecture, Design Patterns Microservice : Core Java 8 or above, SpringBoot, Azure Functions. Front end ( Nice to Have ) : JavaScripting, React",Senior Data Engineer,"Remote in San Francisco, CA","Senior Data engineers with 10+ years of experience. This is a 100% remote role, PST hours (Target West Coast candidates but don't limit your search). Bill rate: $120, PR: $85W2, or $95-$100 C2C. We only need stellar candidates. 3-4 rounds of Interviews (tech screening, including real-time coding). Skill Set: Big Data: Scala, Databricks, Spark SQL, Spark Streaming, Python, Pyspark Cloud : Azure, ADF System Design : API Design, GraphQL, Event-driven architecture, Design Patterns Microservice : Core Java 8 or above, SpringBoot, Azure Functions. Front end ( Nice to Have ) : JavaScripting, React",$120 an hour,2024-01-14
Samsung Electronics,"Position Summary Contribute to software development and business management by effectively solving business-related software problems through data modeling/analysis/prediction. Role and Responsibilities Contribute to software development and business management by effectively solving business-related software problems through data modeling/analysis/prediction. Establish/support software and infrastructure that continuously grows to strategically analyze big data. Understand and implement software data analysis strategies that meet business strategy. Establish and operate software and infrastructure that can collect/analyze/predict big data (structured/unstructured). Design and operate software structure that can maintain data integrity. Proceed with software data model for business-related decision-making and evaluate data model's consistency. Establish a software security system for data and protect from unauthorized person. Minimum Education & Experience Requirements: Master’s degree in Computer Science, Computer Engineering, Information Technology, a related field, or a foreign equivalent plus 6 months post-baccalaureate experience in job offered or any engineering/IT related job titles. Applicants must have 6 months of experience in the following: (1) statistical analysis and predictive modeling using tools including R, STATA, SAS, and Python; (2) Quantitative Marketing or Operations Research; (3) Web Analytics using Adobe Analytics; (4) data manipulation using SQL; (5) design, execution, and measurement of A/B and multivariate tests; (6) eCommerce and Digital Marketing; (7) building reports and visualizations using Tableau; and (8) software tools including Jira and Confluence. Compensation for this role between $184,662 – $204,662/Year Regular full-time employees (salaried or hourly) have access to benefits including Medical, Dental, Vision, Life Insurance, 401(k), Employee Purchase Program, Tuition Assistance (after 6 months), Paid Time Off, Student Loan Program (after 6 months), Wellness Incentives, and many more. Life @ Samsung - https://www.samsung.com/us/careers/life-at-samsung/ Benefits @ Samsung - https://www.samsung.com/us/careers/benefits/ #LI-DNP Skills and Qualifications At Samsung, we believe that innovation and growth are driven by an inclusive culture and a diverse workforce. We aim to create a global team where everyone belongs and has equal opportunities, inspiring our talent to be their true selves. Together, we are building a better tomorrow for our customers, partners, and communities. Samsung Electronics America, Inc. and its subsidiaries are committed to employing a diverse workforce, and provide Equal Employment Opportunity for all individuals regardless of race, color, religion, gender, age, national origin, marital status, sexual orientation, gender identity, status as a protected veteran, genetic information, status as a qualified individual with a disability, or any other characteristic protected by law. Reasonable Accommodations for Qualified Individuals with Disabilities During the Application Process Samsung Electronics America is committed to providing reasonable accommodations for qualified individuals with disabilities in our job application process. If you have a disability and require a reasonable accommodation in order to participate in the application process, please contact our Reasonable Accommodation Team (855-557-3247) or SEA_Accommodations_Ext@sea.samsung.com for assistance. This number is for accommodation requests only and is not intended for general employment inquiries.","Engineer I, Data Engineering","Mountain View, CA 94043","Position Summary Contribute to software development and business management by effectively solving business-related software problems through data modeling/analysis/prediction. Role and Responsibilities Contribute to software development and business management by effectively solving business-related software problems through data modeling/analysis/prediction. Establish/support software and infrastructure that continuously grows to strategically analyze big data. Understand and implement software data analysis strategies that meet business strategy. Establish and operate software and infrastructure that can collect/analyze/predict big data (structured/unstructured). Design and operate software structure that can maintain data integrity. Proceed with software data model for business-related decision-making and evaluate data model's consistency. Establish a software security system for data and protect from unauthorized person. Minimum Education & Experience Requirements: Master’s degree in Computer Science, Computer Engineering, Information Technology, a related field, or a foreign equivalent plus 6 months post-baccalaureate experience in job offered or any engineering/IT related job titles. Applicants must have 6 months of experience in the following: (1) statistical analysis and predictive modeling using tools including R, STATA, SAS, and Python; (2) Quantitative Marketing or Operations Research; (3) Web Analytics using Adobe Analytics; (4) data manipulation using SQL; (5) design, execution, and measurement of A/B and multivariate tests; (6) eCommerce and Digital Marketing; (7) building reports and visualizations using Tableau; and (8) software tools including Jira and Confluence. Compensation for this role between $184,662 – $204,662/Year Regular full-time employees (salaried or hourly) have access to benefits including Medical, Dental, Vision, Life Insurance, 401(k), Employee Purchase Program, Tuition Assistance (after 6 months), Paid Time Off, Student Loan Program (after 6 months), Wellness Incentives, and many more. Life @ Samsung - https://www.samsung.com/us/careers/life-at-samsung/ Benefits @ Samsung - https://www.samsung.com/us/careers/benefits/ #LI-DNP Skills and Qualifications At Samsung, we believe that innovation and growth are driven by an inclusive culture and a diverse workforce. We aim to create a global team where everyone belongs and has equal opportunities, inspiring our talent to be their true selves. Together, we are building a better tomorrow for our customers, partners, and communities. Samsung Electronics America, Inc. and its subsidiaries are committed to employing a diverse workforce, and provide Equal Employment Opportunity for all individuals regardless of race, color, religion, gender, age, national origin, marital status, sexual orientation, gender identity, status as a protected veteran, genetic information, status as a qualified individual with a disability, or any other characteristic protected by law. Reasonable Accommodations for Qualified Individuals with Disabilities During the Application Process Samsung Electronics America is committed to providing reasonable accommodations for qualified individuals with disabilities in our job application process. If you have a disability and require a reasonable accommodation in order to participate in the application process, please contact our Reasonable Accommodation Team (855-557-3247) or SEA_Accommodations_Ext@sea.samsung.com for assistance. This number is for accommodation requests only and is not intended for general employment inquiries.","$184,662 - $204,662 a year",2024-01-14
BayOne,"Responsibilities Lead and participate in design discussions and meetings Mentor data engineers and analysts Design, automate, build, and launch scalable, efficient and reliable data pipelines into production using Python Perform root cause analysis and resolve production and data issues MINIMUM QUALIFICATIONS: 7+ years experience in data engineering 7+ years experience in custom ETL design, implementation and maintenance Experience building real-time data solutions and processes Advanced skills with Python/Java and SQL are a must Strong computer science fundamentals including data structures and algorithms Experienced in working collaboratively across different teams and departments Strong technical and business communication",Data Engineer/Analyst,"Santa Clara, CA","Responsibilities Lead and participate in design discussions and meetings Mentor data engineers and analysts Design, automate, build, and launch scalable, efficient and reliable data pipelines into production using Python Perform root cause analysis and resolve production and data issues MINIMUM QUALIFICATIONS: 7+ years experience in data engineering 7+ years experience in custom ETL design, implementation and maintenance Experience building real-time data solutions and processes Advanced skills with Python/Java and SQL are a must Strong computer science fundamentals including data structures and algorithms Experienced in working collaboratively across different teams and departments Strong technical and business communication",Competitive,2024-01-14
JLG Industries Inc,"About JLG, an Oshkosh company JLG began in 1969, when our founder, John L. Grove set out to resolve growing safety concerns in the construction industry. Since then we have been committed to understanding the challenges and delivering innovative solutions to the access market. We partner with customers to provide quality equipment, training opportunities and trusted support within the access industry. We are a global company, and our products—including mobile elevating work platforms, telehandlers, utility vehicles and accessories—can be found all over the world. JOB SUMMARY: As a key member in the Data Science team, the Data Engineer will work with a cross functional team to develop and execute the data analytics strategy and apply to Oshkosh Corporation products. Advanced Data Analytics work encompasses the acquisition, processing and machine learning of engineering or service data and application to preventive maintenance and intelligent control of on or off-road vehicles. ESSENTIAL DUTIES AND RESPONSIBILITIES: These duties are not meant to be all-inclusive and other duties may be assigned. Design and develop scalable ETL solutions to deliver data from source systems to analytics platforms (structured and unstructured; batch and streaming). Responsible for testing and validation in order to support the accuracy of data transformations and data verification used with enterprise-wide analytics. Assist in ensuring proper data governance (quality, security, etc.) within the data lake and enterprise data warehouse systems across all business segments. Assist with performance-tuning data processes as well as troubleshooting data processing issues. Collaborate, coordinate, and communicate across disciplines, departments and segments. Develop rapid prototyping and design processes for fast solution delivery to the business. Maintain reference architecture and documentation for the purposes of architectural governance and application roadmap. Assist in educating others on best practices surrounding data work (i.e. data modeling, database design, ETL design, job scheduling and monitoring, etc.). Assist or direct feasibility studies and project estimates (manpower, budget development, and timelines, etc.) on proposed research and development projects. Follow the directions efficiently and provide feedback on the technical hurdles and progresses with clarity and assess the priorities based on business needs. Complete the tasks under the guidance on mutually agreed schedule between the candidate and the supervisor/program manager with minimum mentoring. MINIMUM QUALIFICATIONS: Bachelor’s degree in computer science, data science or a related field with five (5) or more years of working as a data engineer, ETL developer and/or data warehouse DBA. PREFERRED QUALIFICATIONS: Experience with big data tools and architectures, such as Cloudera Hadoop, HDFS, Hive, and Spark. Experience with Azure Dev Ops Experience with Azure cloud services, Databricks, Synapse or similar technologies Experience with developing highly responsive data structures, metadata capture strategies, ontologies, and data dictionaries. Experience with Git (version control) Working knowledge of telematics interfaces and streaming solutions (MQTT, NiFi, Kafka, etc.). Automotive or heavy duty on or off-road vehicle, digital data bus, including Ethernet or Controller Area Network (CAN) experience. Highly organized and detail-oriented, with strong critical thinking, analytical, and problem-solving skills. Ability to handle multiple tasks in a fast-paced environment, both independently and as part of a team. Display excellent interpersonal skills as well as the ability to effectively present information and respond to question from leadership and peers. Strong proficiency with SQL, Bash, and Python (and experience with the Anaconda distribution). Oshkosh is committed to working with and offering reasonable accommodations to job applicants with disabilities. If you need assistance or an accommodation due to a disability for any part of the recruitment process, please contact our reception desk by phone at +1 (920) 502.3009 or our talent acquisition team by email corporatetalentacquisition@oshkoshcorp.com . Oshkosh Corporation is an Equal Opportunity and Affirmative Action Employer. This company will provide equal opportunity to all individuals without regard to race, color, religion, sex, sexual orientation, gender identity, national origin, disability, or veteran status. Information collected regarding categories as provided by law will in no way affect the decision regarding an employment application. Oshkosh Corporation will not discharge or in any manner discriminate against employees or applicants because they have inquired about, discussed, or disclosed their own pay or the pay of another employee or applicant. However, employees who have access to the compensation information of other employees or applicants as a part of their essential job functions cannot disclose the pay of other employees or applicants to individuals who do not otherwise have access to compensation information, unless the disclosure is (a) in response to a formal complaint or charge, (b) in furtherance of an investigation, proceeding, hearing, or action, including an investigation conducted by the employer, or (c) consistent with Oshkosh Corporation's legal duty to furnish information. Certain positions with Oshkosh Corporation require access to controlled goods and technologies subject to the International Traffic in Arms Regulations or the Export Administration Regulations. Applicants for these positions may need to be \"U.S. Persons,\" as defined in these regulations. Generally, a \"U.S. Person\" is a U.S. citizen, lawful permanent resident, or an individual who has been admitted as a refugee or granted asylum.",Senior Data Engineer,"Hagerstown, MD","About JLG, an Oshkosh company JLG began in 1969, when our founder, John L. Grove set out to resolve growing safety concerns in the construction industry. Since then we have been committed to understanding the challenges and delivering innovative solutions to the access market. We partner with customers to provide quality equipment, training opportunities and trusted support within the access industry. We are a global company, and our products—including mobile elevating work platforms, telehandlers, utility vehicles and accessories—can be found all over the world. JOB SUMMARY: As a key member in the Data Science team, the Data Engineer will work with a cross functional team to develop and execute the data analytics strategy and apply to Oshkosh Corporation products. Advanced Data Analytics work encompasses the acquisition, processing and machine learning of engineering or service data and application to preventive maintenance and intelligent control of on or off-road vehicles. ESSENTIAL DUTIES AND RESPONSIBILITIES: These duties are not meant to be all-inclusive and other duties may be assigned. Design and develop scalable ETL solutions to deliver data from source systems to analytics platforms (structured and unstructured; batch and streaming). Responsible for testing and validation in order to support the accuracy of data transformations and data verification used with enterprise-wide analytics. Assist in ensuring proper data governance (quality, security, etc.) within the data lake and enterprise data warehouse systems across all business segments. Assist with performance-tuning data processes as well as troubleshooting data processing issues. Collaborate, coordinate, and communicate across disciplines, departments and segments. Develop rapid prototyping and design processes for fast solution delivery to the business. Maintain reference architecture and documentation for the purposes of architectural governance and application roadmap. Assist in educating others on best practices surrounding data work (i.e. data modeling, database design, ETL design, job scheduling and monitoring, etc.). Assist or direct feasibility studies and project estimates (manpower, budget development, and timelines, etc.) on proposed research and development projects. Follow the directions efficiently and provide feedback on the technical hurdles and progresses with clarity and assess the priorities based on business needs. Complete the tasks under the guidance on mutually agreed schedule between the candidate and the supervisor/program manager with minimum mentoring. MINIMUM QUALIFICATIONS: Bachelor’s degree in computer science, data science or a related field with five (5) or more years of working as a data engineer, ETL developer and/or data warehouse DBA. PREFERRED QUALIFICATIONS: Experience with big data tools and architectures, such as Cloudera Hadoop, HDFS, Hive, and Spark. Experience with Azure Dev Ops Experience with Azure cloud services, Databricks, Synapse or similar technologies Experience with developing highly responsive data structures, metadata capture strategies, ontologies, and data dictionaries. Experience with Git (version control) Working knowledge of telematics interfaces and streaming solutions (MQTT, NiFi, Kafka, etc.). Automotive or heavy duty on or off-road vehicle, digital data bus, including Ethernet or Controller Area Network (CAN) experience. Highly organized and detail-oriented, with strong critical thinking, analytical, and problem-solving skills. Ability to handle multiple tasks in a fast-paced environment, both independently and as part of a team. Display excellent interpersonal skills as well as the ability to effectively present information and respond to question from leadership and peers. Strong proficiency with SQL, Bash, and Python (and experience with the Anaconda distribution). Oshkosh is committed to working with and offering reasonable accommodations to job applicants with disabilities. If you need assistance or an accommodation due to a disability for any part of the recruitment process, please contact our reception desk by phone at +1 (920) 502.3009 or our talent acquisition team by email corporatetalentacquisition@oshkoshcorp.com . Oshkosh Corporation is an Equal Opportunity and Affirmative Action Employer. This company will provide equal opportunity to all individuals without regard to race, color, religion, sex, sexual orientation, gender identity, national origin, disability, or veteran status. Information collected regarding categories as provided by law will in no way affect the decision regarding an employment application. Oshkosh Corporation will not discharge or in any manner discriminate against employees or applicants because they have inquired about, discussed, or disclosed their own pay or the pay of another employee or applicant. However, employees who have access to the compensation information of other employees or applicants as a part of their essential job functions cannot disclose the pay of other employees or applicants to individuals who do not otherwise have access to compensation information, unless the disclosure is (a) in response to a formal complaint or charge, (b) in furtherance of an investigation, proceeding, hearing, or action, including an investigation conducted by the employer, or (c) consistent with Oshkosh Corporation's legal duty to furnish information. Certain positions with Oshkosh Corporation require access to controlled goods and technologies subject to the International Traffic in Arms Regulations or the Export Administration Regulations. Applicants for these positions may need to be \"U.S. Persons,\" as defined in these regulations. Generally, a \"U.S. Person\" is a U.S. citizen, lawful permanent resident, or an individual who has been admitted as a refugee or granted asylum.",Competitive,2024-01-14
