companyName,description,jobName,location,require,salary,timePost
"ADS, Inc.","ADS, Inc. began more than 20 years ago by outfitting Navy SEALS with quality dive equipment, and today we're proud to manage 3,000 supplier partnerships and over 50,000 products. Please watch this video to learn more about ADS Inc! http://bit.ly/ADS_Mission Job Title: Frontend Developer Location: Austin, TX At ADS Inc. we actively seek our customers’ equipment and logistical challenges and deliver innovative and cost-effective solutions. As we focus on growing our business, leveraging technology, and growing our internal technical capabilities is critical for success. As a Frontend Developer you will play a pivotal role in keeping ADS technology stack at the cutting edge. You will be primarily responsible for the User Interface development for web and mobile applications in concert with the various users. We are looking for a programmer with experience in designing and implementing efficient user interfaces that are simple and elegant. Responsibilities: Coding, Testing, Debugging, Proof-of-Concepts, Prototyping, Code Optimization and Bug Fixes Collaborating with users to discover user experience and interface requirements Determining the structure and design of web pages and mobile apps Producing, maintaining, and enhancing user interfaces Incorporating a variety of content on user interfaces like audio, video clips Maintaining brand consistency throughout the design Striking a balance between functional and aesthetic design Ensuring web design is also optimized for mobile applications Building reusable components for future use Optimizing web pages for ease of use, speed, and scalability Ensure continuous learning and skill development Minimum Requirements: 5+ years of experience as a Frontend Developer Bachelor's degree, preferably in Computer Science, Information Systems, or Mathematics Understanding of design principles and skills In-depth understanding of the web development process (design, development and deployment) Experience with design applications like Adobe Illustrator Proficient in HTML, CSS, Python, JavaScript, SQL Understanding of server-side CSS Advanced problem-solving skills Excellent verbal and written communication skills Preferred Qualifications: MS in Computer Science Knowledge of SEO principles Experience with Next.js and React.js Please note: ADS may be subject to mandatory employment-related COVID-19 vaccination requirements. Therefore, to the extent any such mandates apply, covered employees may be required to provide adequate documentation of full vaccination against COVID-19, unless otherwise qualified for legal medical or religious accommodation. ADS believes that a diverse work environment leads to bigger thinking and more creative solutions to our customers' problems and we are proud to be an Equal Opportunity Employer. All qualified applicants will receive consideration for employment without regard to race, color, religion, sex, sexual orientation or gender identification, national origin, or any other legally protected characteristic. We strive to represent our community with a workforce diverse in gender and ethnicity. We actively seek out veterans and the disabled for opportunities at ADS. Education Required Bachelors or better Skills Preferred Strategic Planning Organization IT-Specific Technical Skills Business/Financial Analysis Behaviors Preferred Thought Provoking: Capable of making others think deeply on a subject Team Player: Works well as a member of a group Loyal: Shows firm and constant support to a cause Innovative: Consistently introduces new ideas and demonstrates original thinking Functional Expert: Considered a thought leader on a subject Enthusiastic: Shows intense and eager enjoyment and interest Detail Oriented: Capable of carrying out a given task with all details necessary to get the task done well Dedicated: Devoted to a task or purpose with loyalty or integrity Motivations Preferred Growth Opportunities: Inspired to perform well by the chance to take on more responsibility Self-Starter: Inspired to perform without outside help Goal Completion: Inspired to perform well by the completion of tasks Ability to Make an Impact: Inspired to perform well by the ability to contribute to the success of a project or the organization Equal Opportunity Employer/Protected Veterans/Individuals with Disabilities The contractor will not discharge or in any other manner discriminate against employees or applicants because they have inquired about, discussed, or disclosed their own pay or the pay of another employee or applicant. However, employees who have access to the compensation information of other employees or applicants as a part of their essential job functions cannot disclose the pay of other employees or applicants to individuals who do not otherwise have access to compensation information, unless the disclosure is (a) in response to a formal complaint or charge, (b) in furtherance of an investigation, proceeding, hearing, or action, including an investigation conducted by the employer, or (c) consistent with the contractor’s legal duty to furnish information. 41 CFR 60-1.35(c)",Frontend Developer,"Austin, TX","ADS, Inc. began more than 20 years ago by outfitting Navy SEALS with quality dive equipment, and today we're proud to manage 3,000 supplier partnerships and over 50,000 products. Please watch this video to learn more about ADS Inc! http://bit.ly/ADS_Mission Job Title: Frontend Developer Location: Austin, TX At ADS Inc. we actively seek our customers’ equipment and logistical challenges and deliver innovative and cost-effective solutions. As we focus on growing our business, leveraging technology, and growing our internal technical capabilities is critical for success. As a Frontend Developer you will play a pivotal role in keeping ADS technology stack at the cutting edge. You will be primarily responsible for the User Interface development for web and mobile applications in concert with the various users. We are looking for a programmer with experience in designing and implementing efficient user interfaces that are simple and elegant. Responsibilities: Coding, Testing, Debugging, Proof-of-Concepts, Prototyping, Code Optimization and Bug Fixes Collaborating with users to discover user experience and interface requirements Determining the structure and design of web pages and mobile apps Producing, maintaining, and enhancing user interfaces Incorporating a variety of content on user interfaces like audio, video clips Maintaining brand consistency throughout the design Striking a balance between functional and aesthetic design Ensuring web design is also optimized for mobile applications Building reusable components for future use Optimizing web pages for ease of use, speed, and scalability Ensure continuous learning and skill development Minimum Requirements: 5+ years of experience as a Frontend Developer Bachelor's degree, preferably in Computer Science, Information Systems, or Mathematics Understanding of design principles and skills In-depth understanding of the web development process (design, development and deployment) Experience with design applications like Adobe Illustrator Proficient in HTML, CSS, Python, JavaScript, SQL Understanding of server-side CSS Advanced problem-solving skills Excellent verbal and written communication skills Preferred Qualifications: MS in Computer Science Knowledge of SEO principles Experience with Next.js and React.js Please note: ADS may be subject to mandatory employment-related COVID-19 vaccination requirements. Therefore, to the extent any such mandates apply, covered employees may be required to provide adequate documentation of full vaccination against COVID-19, unless otherwise qualified for legal medical or religious accommodation. ADS believes that a diverse work environment leads to bigger thinking and more creative solutions to our customers' problems and we are proud to be an Equal Opportunity Employer. All qualified applicants will receive consideration for employment without regard to race, color, religion, sex, sexual orientation or gender identification, national origin, or any other legally protected characteristic. We strive to represent our community with a workforce diverse in gender and ethnicity. We actively seek out veterans and the disabled for opportunities at ADS. Education Required Bachelors or better Skills Preferred Strategic Planning Organization IT-Specific Technical Skills Business/Financial Analysis Behaviors Preferred Thought Provoking: Capable of making others think deeply on a subject Team Player: Works well as a member of a group Loyal: Shows firm and constant support to a cause Innovative: Consistently introduces new ideas and demonstrates original thinking Functional Expert: Considered a thought leader on a subject Enthusiastic: Shows intense and eager enjoyment and interest Detail Oriented: Capable of carrying out a given task with all details necessary to get the task done well Dedicated: Devoted to a task or purpose with loyalty or integrity Motivations Preferred Growth Opportunities: Inspired to perform well by the chance to take on more responsibility Self-Starter: Inspired to perform without outside help Goal Completion: Inspired to perform well by the completion of tasks Ability to Make an Impact: Inspired to perform well by the ability to contribute to the success of a project or the organization Equal Opportunity Employer/Protected Veterans/Individuals with Disabilities The contractor will not discharge or in any other manner discriminate against employees or applicants because they have inquired about, discussed, or disclosed their own pay or the pay of another employee or applicant. However, employees who have access to the compensation information of other employees or applicants as a part of their essential job functions cannot disclose the pay of other employees or applicants to individuals who do not otherwise have access to compensation information, unless the disclosure is (a) in response to a formal complaint or charge, (b) in furtherance of an investigation, proceeding, hearing, or action, including an investigation conducted by the employer, or (c) consistent with the contractor’s legal duty to furnish information. 41 CFR 60-1.35(c)",Competitive,2024-01-14
Fraud.net,"Published January 9, 2024 Location Remote, United States of America Category Computer & IT Science & Engineering Job Type Full-time Tags Developer Description Fraud.net is an emerging technology company supporting some of the world’s most prominent companies across multiple continents. We are seeking an experienced Frontend Developer to join our growing team. We are committed to building easy-to-use, innovative tools to empower all businesses to prevent fraud. We are an experienced team with diverse backgrounds in analytics, corporate security, data science, engineering, and e-commerce. We are looking for someone who can help advance the company’s technology, who can contribute to where we take the product and how we build out the team. What you’ll do We are looking for a Frontend Developer to join our growing team. You will be responsible for managing the frontend code working with our primary Frontend Developer; developing new features for current products as well and building out new products. Your code will be fast and create user friendly experiences on top of various APIs. You will be working with a distributed team including additional backend developers, data scientists, QA and a project manager. You’ll be using Angular, SCSS, Rest APIs, Typescript and writing Karma tests. You are great at communicating with the backend and the product side. You are focused and clearly follow priorities. Who are you: 5+ years’ experience as a developer building, testing and deploying software Well versed in Angular 7+ coding and architecture best practices Experience with custom solutions based Bootstrap v4 and v5 Experience with custom solutions based on Angular Material v17 ES14+ (ECMA 2023) and TypeScript Knowledge of CSS/SCSS/SASS & HTML Ng lint and ESLint Understanding of Observables Worked extensively with REST APIs Experience with Git and git flow Disciplined code practices (code review, automated testing) Understand the principles of Agile development including Scrum, Kanban, SUs, etc. Bonus points for: Exposure to and experience with DynamoDB, Redis, Elasticsearch, Lambda, S3, CDN, Cognito, SSO, Okta Experience with Angular migration up to v17 on existed projects Experience with Bootstrap migration from v4 to v5 on existed projects Postman experience Sentry error debugging Used Gulp and Jenkins Experience with D3 and or vue.js Location: This is a remote role, ideally suited for candidates based in NY, NJ, NC, WA, CO, FL, SC states Please note that all applicants must be authorized to work in the United States. Disclaimer: The advertised pay scale reflects the good faith minimum and maximum salary range for this role. The advertised pay scale is not a promise of a particular wage for any specific employee. The specific compensation offered to a candidate may be dependent on a variety of factors including, but not limited to, the candidate's experience, education, special licensing or qualifications, and other factors. Company Description Fraud.net is a leader in AI-powered enterprise risk intelligence. Its award-winning fraud detection platform helps digital businesses to quickly identify transactional anomalies and pinpoint fraud using artificial intelligence, big data and live-streaming visualizations. Fraud.net’s platform was designed to combat hard-to-detect fraud at digital enterprises in the e-commerce, travel and financial services sectors. Its unified algorithmic architecture combines: 1) cognitive computing/deep learning, 2) collective intelligence, 3) rules-based decision engines, and 4) streaming analytics to detect fraud in real-time, at scale.",Frontend Developer,Remote,"Published January 9, 2024 Location Remote, United States of America Category Computer & IT Science & Engineering Job Type Full-time Tags Developer Description Fraud.net is an emerging technology company supporting some of the world’s most prominent companies across multiple continents. We are seeking an experienced Frontend Developer to join our growing team. We are committed to building easy-to-use, innovative tools to empower all businesses to prevent fraud. We are an experienced team with diverse backgrounds in analytics, corporate security, data science, engineering, and e-commerce. We are looking for someone who can help advance the company’s technology, who can contribute to where we take the product and how we build out the team. What you’ll do We are looking for a Frontend Developer to join our growing team. You will be responsible for managing the frontend code working with our primary Frontend Developer; developing new features for current products as well and building out new products. Your code will be fast and create user friendly experiences on top of various APIs. You will be working with a distributed team including additional backend developers, data scientists, QA and a project manager. You’ll be using Angular, SCSS, Rest APIs, Typescript and writing Karma tests. You are great at communicating with the backend and the product side. You are focused and clearly follow priorities. Who are you: 5+ years’ experience as a developer building, testing and deploying software Well versed in Angular 7+ coding and architecture best practices Experience with custom solutions based Bootstrap v4 and v5 Experience with custom solutions based on Angular Material v17 ES14+ (ECMA 2023) and TypeScript Knowledge of CSS/SCSS/SASS & HTML Ng lint and ESLint Understanding of Observables Worked extensively with REST APIs Experience with Git and git flow Disciplined code practices (code review, automated testing) Understand the principles of Agile development including Scrum, Kanban, SUs, etc. Bonus points for: Exposure to and experience with DynamoDB, Redis, Elasticsearch, Lambda, S3, CDN, Cognito, SSO, Okta Experience with Angular migration up to v17 on existed projects Experience with Bootstrap migration from v4 to v5 on existed projects Postman experience Sentry error debugging Used Gulp and Jenkins Experience with D3 and or vue.js Location: This is a remote role, ideally suited for candidates based in NY, NJ, NC, WA, CO, FL, SC states Please note that all applicants must be authorized to work in the United States. Disclaimer: The advertised pay scale reflects the good faith minimum and maximum salary range for this role. The advertised pay scale is not a promise of a particular wage for any specific employee. The specific compensation offered to a candidate may be dependent on a variety of factors including, but not limited to, the candidate's experience, education, special licensing or qualifications, and other factors. Company Description Fraud.net is a leader in AI-powered enterprise risk intelligence. Its award-winning fraud detection platform helps digital businesses to quickly identify transactional anomalies and pinpoint fraud using artificial intelligence, big data and live-streaming visualizations. Fraud.net’s platform was designed to combat hard-to-detect fraud at digital enterprises in the e-commerce, travel and financial services sectors. Its unified algorithmic architecture combines: 1) cognitive computing/deep learning, 2) collective intelligence, 3) rules-based decision engines, and 4) streaming analytics to detect fraud in real-time, at scale.",Competitive,2024-01-14
INTERVOKE,"THIS IS A REMOTE FREELANCE POSITION: JOB DESCRIPTION: We are looking for a remote freelance contractor to work with our Creative Services department as a Front-End Web Developer. You will work alongside colleagues to help expand our website and other products. This includes website maintenance for our current and other business domains using both custom code and the integrated code in our HTML, CSS and JavaScript website templates. We are looking for a self-starter that can excel in a remote work environment. A successful candidate will have effective communication skills, a focus on meeting client expectations and attention to detail. We are seeking an individual who has a positive attitude and who is looking to be a part of our team. SKILLS & REQUIREMENTS At least 5 years of front-end web site development experience using HTML, CSS and JavaScript. Experience with responsive frameworks, cross-browser and multi-platform. Familiarity with version control systems such as Git. Detail-oriented with a commitment to producing quality work. Excellent verbal and written communication. Not afraid to work hard, be humble, ask questions, and learn new things. ADDITIONAL SKILLS: Applied understanding of web analytics and SEO. A good eye for user interface design, typography and user experience. Experience with the Adobe Creative Suite, including Illustrator and Photoshop a plus.",HTML/CSS Developer,Remote,"THIS IS A REMOTE FREELANCE POSITION: JOB DESCRIPTION: We are looking for a remote freelance contractor to work with our Creative Services department as a Front-End Web Developer. You will work alongside colleagues to help expand our website and other products. This includes website maintenance for our current and other business domains using both custom code and the integrated code in our HTML, CSS and JavaScript website templates. We are looking for a self-starter that can excel in a remote work environment. A successful candidate will have effective communication skills, a focus on meeting client expectations and attention to detail. We are seeking an individual who has a positive attitude and who is looking to be a part of our team. SKILLS & REQUIREMENTS At least 5 years of front-end web site development experience using HTML, CSS and JavaScript. Experience with responsive frameworks, cross-browser and multi-platform. Familiarity with version control systems such as Git. Detail-oriented with a commitment to producing quality work. Excellent verbal and written communication. Not afraid to work hard, be humble, ask questions, and learn new things. ADDITIONAL SKILLS: Applied understanding of web analytics and SEO. A good eye for user interface design, typography and user experience. Experience with the Adobe Creative Suite, including Illustrator and Photoshop a plus.",Competitive,2024-01-14
Wise Equation Solutions,"Create visually appealing and responsive user interfaces using HTML, CSS, and JavaScript. Transform design mockups or wireframes into functional and interactive web pages. Work with frontend frameworks and libraries such as Angular, React to build complex user interfaces efficiently and maintainable. Collaborate closely with UI/UX designers to understand design requirements, provide technical feasibility insights, and translate design concepts into code. Ensure that the UI is compatible with various web browsers and devices to provide a consistent user experience across different platforms. Contribute to the frontend architecture and design decisions. Optimize the performance and scalability of the frontend codebase. Create responsive layouts that adapt to different screen sizes and resolutions, ensuring a seamless user experience across desktop, tablet, and mobile devices. Collaborate with backend developers to integrate frontend components with server-side APIs, ensuring smooth data flow and efficient communication between the frontend and backend systems. Conduct thorough testing of the frontend code to ensure functionality, identify and fix bugs, and implement error handling to improve the overall quality of the user interface. Optimize the frontend code for speed and efficiency, including minimizing file sizes, reducing network requests, and implementing caching techniques. Maintain and update existing frontend codebases, refactor code as needed, and use version control systems (e.g., Git) to manage code changes and collaborate effectively with a development team. Ensure that the user interface meets accessibility standards, making it usable for individuals with disabilities and conforming to WCAG (Web Content Accessibility Guidelines). Participate in code reviews to ensure code quality, adherence to coding standards, and to provide constructive feedback to team members. Minimum Education Requirement:- Bachelor’s degree in computer science, computer information systems, information technology, or a combination of education and experience equating to the U.S. equivalent of a Bachelor’s degree in one of the aforementioned subjects.",Frontend Developer,"Phoenix, AZ 85027 (Deer Valley area)","Create visually appealing and responsive user interfaces using HTML, CSS, and JavaScript. Transform design mockups or wireframes into functional and interactive web pages. Work with frontend frameworks and libraries such as Angular, React to build complex user interfaces efficiently and maintainable. Collaborate closely with UI/UX designers to understand design requirements, provide technical feasibility insights, and translate design concepts into code. Ensure that the UI is compatible with various web browsers and devices to provide a consistent user experience across different platforms. Contribute to the frontend architecture and design decisions. Optimize the performance and scalability of the frontend codebase. Create responsive layouts that adapt to different screen sizes and resolutions, ensuring a seamless user experience across desktop, tablet, and mobile devices. Collaborate with backend developers to integrate frontend components with server-side APIs, ensuring smooth data flow and efficient communication between the frontend and backend systems. Conduct thorough testing of the frontend code to ensure functionality, identify and fix bugs, and implement error handling to improve the overall quality of the user interface. Optimize the frontend code for speed and efficiency, including minimizing file sizes, reducing network requests, and implementing caching techniques. Maintain and update existing frontend codebases, refactor code as needed, and use version control systems (e.g., Git) to manage code changes and collaborate effectively with a development team. Ensure that the user interface meets accessibility standards, making it usable for individuals with disabilities and conforming to WCAG (Web Content Accessibility Guidelines). Participate in code reviews to ensure code quality, adherence to coding standards, and to provide constructive feedback to team members. Minimum Education Requirement:- Bachelor’s degree in computer science, computer information systems, information technology, or a combination of education and experience equating to the U.S. equivalent of a Bachelor’s degree in one of the aforementioned subjects.",Competitive,2024-01-14
