companyName,description,jobName,location,require,salary,timePost
"Perficient, Inc","We currently have a career opportunity for a Healthcare Data Analyst to join our team. While Perficient's headquarters are in St. Louis, MO, this role is remote and candidates can be located anywhere in the continental US. As a Healthcare Data Analyst, working in a team environment you will take direction from solution architects and Leads on client data activities. Perficient is always looking for the best and brightest talent and we need you! We’re a quickly-growing, global digital consulting leader, and we’re transforming the world’s largest enterprises and biggest brands. You’ll work with the latest technologies, expand your skills, and become a part of our global community of talented, diverse, and knowledgeable colleagues.",Healthcare Data Analyst - REMOTE,Remote in United States,"We currently have a career opportunity for a Healthcare Data Analyst to join our team. While Perficient's headquarters are in St. Louis, MO, this role is remote and candidates can be located anywhere in the continental US. As a Healthcare Data Analyst, working in a team environment you will take direction from solution architects and Leads on client data activities. Perficient is always looking for the best and brightest talent and we need you! We’re a quickly-growing, global digital consulting leader, and we’re transforming the world’s largest enterprises and biggest brands. You’ll work with the latest technologies, expand your skills, and become a part of our global community of talented, diverse, and knowledgeable colleagues.",Competitive,2023-12-11
Exadel,"Job ID : 4955197004 United States - Any location We are looking for an SAS Data Analyst to support clients in our Consulting practice at Exadel. This role will work directly with our clients to deliver products and services in a growing consulting environment with people who truly care about you and your ideas. Who we are at Exadel: Exadel is a global software consulting and development company that partners with organizations to help them become digital leaders in their industries. We look beyond the code to understand the impact our clients want to make and help them get from ideation to development and outcomes. We accelerate the results of digital transformations through an open, collaborative approach combined with our deep experience across industries, business processes, and technologies. Location: United States Working Environment: Remote, PST working hours required Reporting Manager: Matt Palmgren Direct Reports: N/A Key Interfaces: Consulting Delivery, Senior Management, Delivery Management, Account Management KPIs: Client Delivery Performance. Exadel Contributions to growing our business and enhancing our culture. Qualifications: Experience in the healthcare industry 5+ years as a Data Analyst, Engineer, or similar role 5+ years of experience with SQL 3+ years of experience with SAS Experience with R Deep data analysis and scription experience Experience with SQL on-prem Experience with ETL & data migration Experience with AWS Preferred Qualifications: Experience in a technical consulting environment Experience with SAS Main Frame Experience with Continuous Integration/Continuous Delivery (CI/CD) Prior Health & Life Sciences experience Prior system administration experience Responsibilities: Work directly with client and consulting teams to analyze large data sets and provide insights and value to customers Modernize data scripts and help migrate data to modern systems Stay up to date on latest data technologies, trends, and methodologies Compensation: For WA Residents: The base compensation range for this position is $70 to $85 per hour depending on experience. Employees are also eligible for an annual discretionary bonus. Benefits: Exadel offers benefits for Medical, Dental, Long-Term Disability (LTD), Life Insurance, Pharmaceutical, and Vision coverage. 4 weeks of Paid Time Off (PTO) and 8 paid holidays. 401(k) plan. Legal Disclaimers: Exadel is an Equal Opportunity Employer – Minority / Women / Disability / Veteran / Gender Identity / Sexual Orientation / Age. Reasonable accommodations may be made to enable individuals with disabilities to perform the essential functions. Please note this job description is not designed to cover or contain a comprehensive listing of activities, duties, or responsibilities that are required of the employee for this job. Duties, responsibilities, and activities may change at any time with or without notice.",SAS Data Analyst,United States,"Job ID : 4955197004 United States - Any location We are looking for an SAS Data Analyst to support clients in our Consulting practice at Exadel. This role will work directly with our clients to deliver products and services in a growing consulting environment with people who truly care about you and your ideas. Who we are at Exadel: Exadel is a global software consulting and development company that partners with organizations to help them become digital leaders in their industries. We look beyond the code to understand the impact our clients want to make and help them get from ideation to development and outcomes. We accelerate the results of digital transformations through an open, collaborative approach combined with our deep experience across industries, business processes, and technologies. Location: United States Working Environment: Remote, PST working hours required Reporting Manager: Matt Palmgren Direct Reports: N/A Key Interfaces: Consulting Delivery, Senior Management, Delivery Management, Account Management KPIs: Client Delivery Performance. Exadel Contributions to growing our business and enhancing our culture. Qualifications: Experience in the healthcare industry 5+ years as a Data Analyst, Engineer, or similar role 5+ years of experience with SQL 3+ years of experience with SAS Experience with R Deep data analysis and scription experience Experience with SQL on-prem Experience with ETL & data migration Experience with AWS Preferred Qualifications: Experience in a technical consulting environment Experience with SAS Main Frame Experience with Continuous Integration/Continuous Delivery (CI/CD) Prior Health & Life Sciences experience Prior system administration experience Responsibilities: Work directly with client and consulting teams to analyze large data sets and provide insights and value to customers Modernize data scripts and help migrate data to modern systems Stay up to date on latest data technologies, trends, and methodologies Compensation: For WA Residents: The base compensation range for this position is $70 to $85 per hour depending on experience. Employees are also eligible for an annual discretionary bonus. Benefits: Exadel offers benefits for Medical, Dental, Long-Term Disability (LTD), Life Insurance, Pharmaceutical, and Vision coverage. 4 weeks of Paid Time Off (PTO) and 8 paid holidays. 401(k) plan. Legal Disclaimers: Exadel is an Equal Opportunity Employer – Minority / Women / Disability / Veteran / Gender Identity / Sexual Orientation / Age. Reasonable accommodations may be made to enable individuals with disabilities to perform the essential functions. Please note this job description is not designed to cover or contain a comprehensive listing of activities, duties, or responsibilities that are required of the employee for this job. Duties, responsibilities, and activities may change at any time with or without notice.",$70 - $85 an hour,2023-12-11
VC3,"Leveraging our standard technologies and process, coupled with our people and corporate structure, we deliver a unique end result for our clients. Our clients will experience increased employee productivity, predictability in capital and operating expenditures, reduced downtime and risk, improved employee morale, less lost revenue and enhanced business agility. The Data Analyst is responsible for transforming raw data into meaningful and actionable insight through compelling visual representation. This role will help stakeholders understand complex information more easily and help VC3 and its clients gain deeper understanding of performance and trends as well as create better decision intelligence. The Data Analyst will work closely with the Service Portfolio Executive and the VC3 Application Development Team to continually drive better uses of data and proactively identify opportunities and make recommendations for the business to consider. Culture is an integral part of working at VC3. Our company values represent the ones we live by: Serve as One “Serve as One” is the belief that together we are greater than the sum of our individuals, and that teamwork is essential to success. Passionately Curious “Passionately Curious” is about challenging the status quo, continual improvement, and constantly learning. Own It “Own IT” is about having the courage to do what’s right, resolve to take responsibility, and grit to cross the finish line. Go Beyond “Go Beyond” is taking that extra step to create moments that are unexpected but appreciated. Our Core Focus - “Developing Growth-Minded People” - is about creating excitement and opportunity for those we work with to nurture their growth-mindset. Key Responsibilities Data Analysis and Visualization (50%): Collaborate with Client Strategy, Application Development, and other departments to collect, clean, process and transform data to make it suitable for visualization. Work with the client to gather requirements about their report needs. Investigate data stores to ensure the necessary data can be accessed reliably. Look for opportunities to automate and simplify complex or manual processes as it pertains to data governance and data integrity. Develop and maintain documentation on data definitions, data flow diagrams, etc. Make recommendations for better ways to handle data where appropriate. Collect, process, analyze and explore data and data sets to identify patterns and formulate insights. Design charts, graphs, dashboards, and other visual elements that effectively communicate the key insights from the data. Determine appropriate visualization elements based on the data and the stakeholders needs Select appropriate visuals to support interpretation of data Work with internal stakeholders to determine KPI success metrics and facilitate regular reporting to support decision making Design and implement interactivity into reporting and visualization to facilitate further understanding of the data and stakeholder self-service (eg. Drilldowns, filters, tooltips) Create presentations and reports that combine multiple visualizations to tell a compelling narrative, using visualizations to support arguments, convey insights, and guide the audience through the data. Data Management and Maintenance (35%): Continually solicit stakeholder feedback to make recommendations on additional data points that should be captured to support new insights or sharpen existing discussions. Review, update, improve, or rebuild database queries to: Enable holistic extraction, aggregation, and organization of data for analysis and visualization Optimize data transit, transformation, and presentation Practice Maturity (15%): Stay informed and up to date on emerging trends, best practices, and new technologies in data analysis and visualization Support quarterly/annual planning for continual service improvement of the data analysis and visualization practices and roadmap Support other departments with the data necessary to set maturity and improvement targets within their teams and workflows Develop process and procedure documentation for data analysis and visualization; facilitate cross training and future growth of this business unit Assist with initiative planning, tracking progress, and ensuring timely delivery Responsible for quality assurance as it pertains to data: accuracy, reliability, and continual improvement) Support change management efforts by assisting through collecting and presenting relevant information to stakeholders Additional: Maintain accurate and real-time timesheets in support of client billables Receive mentoring and feedback from peers and others Escalate when appropriate to a more senior resources or other appropriate teams Actively participate in huddles, L10 Meetings, 1x1 Meetings, any other team meetings Client usage and insights across all offerings, incidents, customer support to optimize service deliver Identify trends, issues, opportunities to improve/enhance services, improve customer satisfaction and retention Capacity planning Billing/usage analysis, accurate billing, identify cross/up sell opportunity Demonstrate value of offerings Skills, Knowledge & Expertise Completion of an accredited 2-year post-secondary diploma in Computer Science, Data Science, or Business 3-5 years of relevant experience with hands on experience in data visualization; experience in MSP or Insurance industry an asset Strong proficiency with using SQL, Microsoft Office, Microsoft Power BI. Other visualization tool knowledge and experience an asset Experience with data storage/warehousing, mining, cleaning, processing, and ETL Strong communication skills and ability to explain complex data concepts to non-technical stakeholders Responsible and ethical mindfulness when handling sensitive and confidential data Strong collaboration skills, flexibility to deal with many different stakeholders and manage/prioritize competing needs Openness to feedback and willingness to iterate and improve Self-motivated, detail orientated, highly organized and able to handle a variety of tasks and responsibilities in an efficient manner with a high level of quality Thank you for your interest in VC3. We appreciate all applications; however, only those candidates selected for an interview will be contacted. About VC3 VC3 offers Managed IT Services, Private Cloud Services, Hosted VoIP, Custom Web Applications, SharePoint Consulting, and Website Design & Hosting. VC3 has more than 25 years of experience providing a full range of Information Technology Solutions and Services to hundreds of municipalities and organizations throughout the United States and Canada. The technologies needed by our customers have changed many times over the years, but our focus has always stayed the same: connect the best technologies with our experienced and talented engineers, programmers, web designers and support specialists to deliver solutions that take our customers to the next level of productivity and results. We pride ourselves on making IT personal, making IT easy, and getting IT right. And it all starts with our talented team that is committed to raising the bar.",Data Analyst,Remote,"Leveraging our standard technologies and process, coupled with our people and corporate structure, we deliver a unique end result for our clients. Our clients will experience increased employee productivity, predictability in capital and operating expenditures, reduced downtime and risk, improved employee morale, less lost revenue and enhanced business agility. The Data Analyst is responsible for transforming raw data into meaningful and actionable insight through compelling visual representation. This role will help stakeholders understand complex information more easily and help VC3 and its clients gain deeper understanding of performance and trends as well as create better decision intelligence. The Data Analyst will work closely with the Service Portfolio Executive and the VC3 Application Development Team to continually drive better uses of data and proactively identify opportunities and make recommendations for the business to consider. Culture is an integral part of working at VC3. Our company values represent the ones we live by: Serve as One “Serve as One” is the belief that together we are greater than the sum of our individuals, and that teamwork is essential to success. Passionately Curious “Passionately Curious” is about challenging the status quo, continual improvement, and constantly learning. Own It “Own IT” is about having the courage to do what’s right, resolve to take responsibility, and grit to cross the finish line. Go Beyond “Go Beyond” is taking that extra step to create moments that are unexpected but appreciated. Our Core Focus - “Developing Growth-Minded People” - is about creating excitement and opportunity for those we work with to nurture their growth-mindset. Key Responsibilities Data Analysis and Visualization (50%): Collaborate with Client Strategy, Application Development, and other departments to collect, clean, process and transform data to make it suitable for visualization. Work with the client to gather requirements about their report needs. Investigate data stores to ensure the necessary data can be accessed reliably. Look for opportunities to automate and simplify complex or manual processes as it pertains to data governance and data integrity. Develop and maintain documentation on data definitions, data flow diagrams, etc. Make recommendations for better ways to handle data where appropriate. Collect, process, analyze and explore data and data sets to identify patterns and formulate insights. Design charts, graphs, dashboards, and other visual elements that effectively communicate the key insights from the data. Determine appropriate visualization elements based on the data and the stakeholders needs Select appropriate visuals to support interpretation of data Work with internal stakeholders to determine KPI success metrics and facilitate regular reporting to support decision making Design and implement interactivity into reporting and visualization to facilitate further understanding of the data and stakeholder self-service (eg. Drilldowns, filters, tooltips) Create presentations and reports that combine multiple visualizations to tell a compelling narrative, using visualizations to support arguments, convey insights, and guide the audience through the data. Data Management and Maintenance (35%): Continually solicit stakeholder feedback to make recommendations on additional data points that should be captured to support new insights or sharpen existing discussions. Review, update, improve, or rebuild database queries to: Enable holistic extraction, aggregation, and organization of data for analysis and visualization Optimize data transit, transformation, and presentation Practice Maturity (15%): Stay informed and up to date on emerging trends, best practices, and new technologies in data analysis and visualization Support quarterly/annual planning for continual service improvement of the data analysis and visualization practices and roadmap Support other departments with the data necessary to set maturity and improvement targets within their teams and workflows Develop process and procedure documentation for data analysis and visualization; facilitate cross training and future growth of this business unit Assist with initiative planning, tracking progress, and ensuring timely delivery Responsible for quality assurance as it pertains to data: accuracy, reliability, and continual improvement) Support change management efforts by assisting through collecting and presenting relevant information to stakeholders Additional: Maintain accurate and real-time timesheets in support of client billables Receive mentoring and feedback from peers and others Escalate when appropriate to a more senior resources or other appropriate teams Actively participate in huddles, L10 Meetings, 1x1 Meetings, any other team meetings Client usage and insights across all offerings, incidents, customer support to optimize service deliver Identify trends, issues, opportunities to improve/enhance services, improve customer satisfaction and retention Capacity planning Billing/usage analysis, accurate billing, identify cross/up sell opportunity Demonstrate value of offerings Skills, Knowledge & Expertise Completion of an accredited 2-year post-secondary diploma in Computer Science, Data Science, or Business 3-5 years of relevant experience with hands on experience in data visualization; experience in MSP or Insurance industry an asset Strong proficiency with using SQL, Microsoft Office, Microsoft Power BI. Other visualization tool knowledge and experience an asset Experience with data storage/warehousing, mining, cleaning, processing, and ETL Strong communication skills and ability to explain complex data concepts to non-technical stakeholders Responsible and ethical mindfulness when handling sensitive and confidential data Strong collaboration skills, flexibility to deal with many different stakeholders and manage/prioritize competing needs Openness to feedback and willingness to iterate and improve Self-motivated, detail orientated, highly organized and able to handle a variety of tasks and responsibilities in an efficient manner with a high level of quality Thank you for your interest in VC3. We appreciate all applications; however, only those candidates selected for an interview will be contacted. About VC3 VC3 offers Managed IT Services, Private Cloud Services, Hosted VoIP, Custom Web Applications, SharePoint Consulting, and Website Design & Hosting. VC3 has more than 25 years of experience providing a full range of Information Technology Solutions and Services to hundreds of municipalities and organizations throughout the United States and Canada. The technologies needed by our customers have changed many times over the years, but our focus has always stayed the same: connect the best technologies with our experienced and talented engineers, programmers, web designers and support specialists to deliver solutions that take our customers to the next level of productivity and results. We pride ourselves on making IT personal, making IT easy, and getting IT right. And it all starts with our talented team that is committed to raising the bar.",Competitive,2023-12-11
