companyName,description,jobName,location,require,salary,timePost
WEX Inc.,"The WEX SQL Server Database Administrator will be responsible for the maintenance, performance, monitoring, and recoverability of the SQL database environments. This role will be part of a team which is responsible for the health and stability of the entire SQL Server Database platform. Responsibilities include: Provide support for production databases including performance monitoring, daily management to prevent data loss, unplanned downtime or performance degradation. Install, administer, and maintain schema and data to ensure maximum availability. Analyzes and resolves problems associated with server hardware and application software Monitor and optimize data lake ingestion processes High level knowledge with SQL Server internals, database design, T-SQL, backup/restore, SSIS, security and understanding of performance tuning and troubleshooting. Participates in a 24x7x365 OnCall Rotation Participate in Disaster Recovery planning and testing exercises Required Qualifications: 5+ years of overall IT experience working with SaaS or web development 5+ years of hands on SQL Server Database administration 3-5 years experience with SQL Server Extended Events Proficient using Powershell 3+ years of managing SQL Server Database in Azure 3+ years of hands-on experience with a data ingestion tool (ELT or ETL tools) Experience with Azure DevOps Experience with AWS Core Services (Amazon CloudWatch, Amazon Security Hub) Desired Additional Qualifications: Experience of SQL system DMVs to identify and troubleshoot performance problems Tuning or refactoring stored procedures to improve performance Knowledge of supporting SQL Server Availability Groups Experience with SQL 2016+ Knowledge with ETL tools and management Knowledge of SSDT projects and experience with Source Control especially TFS and GitHub in Azure DevOps Knowledge and experience with industry standard change and incident management procedures Self-starter capable of working independently or in groups The base pay range represents the anticipated low and high end of the pay range for this position. Actual pay rates will vary and will be based on various factors, such as your qualifications, skills, competencies, and proficiency for the role. Base pay is one component of WEX's total compensation package. Most sales positions are eligible for commission under the terms of an applicable plan. Non-sales roles are typically eligible for a quarterly or annual bonus based on their role and applicable plan. WEX's comprehensive and market competitive benefits are designed to support your personal and professional well-being. Benefits include health, dental and vision insurances, retirement savings plan, paid time off, health savings account, flexible spending accounts, life insurance, disability insurance, tuition reimbursement, and more. For more information, check out the \"About Us\" section. Salary Pay Range: $101,000.00 - $134,000.00",Database Administrator 4 (Remote),Remote,"The WEX SQL Server Database Administrator will be responsible for the maintenance, performance, monitoring, and recoverability of the SQL database environments. This role will be part of a team which is responsible for the health and stability of the entire SQL Server Database platform. Responsibilities include: Provide support for production databases including performance monitoring, daily management to prevent data loss, unplanned downtime or performance degradation. Install, administer, and maintain schema and data to ensure maximum availability. Analyzes and resolves problems associated with server hardware and application software Monitor and optimize data lake ingestion processes High level knowledge with SQL Server internals, database design, T-SQL, backup/restore, SSIS, security and understanding of performance tuning and troubleshooting. Participates in a 24x7x365 OnCall Rotation Participate in Disaster Recovery planning and testing exercises Required Qualifications: 5+ years of overall IT experience working with SaaS or web development 5+ years of hands on SQL Server Database administration 3-5 years experience with SQL Server Extended Events Proficient using Powershell 3+ years of managing SQL Server Database in Azure 3+ years of hands-on experience with a data ingestion tool (ELT or ETL tools) Experience with Azure DevOps Experience with AWS Core Services (Amazon CloudWatch, Amazon Security Hub) Desired Additional Qualifications: Experience of SQL system DMVs to identify and troubleshoot performance problems Tuning or refactoring stored procedures to improve performance Knowledge of supporting SQL Server Availability Groups Experience with SQL 2016+ Knowledge with ETL tools and management Knowledge of SSDT projects and experience with Source Control especially TFS and GitHub in Azure DevOps Knowledge and experience with industry standard change and incident management procedures Self-starter capable of working independently or in groups The base pay range represents the anticipated low and high end of the pay range for this position. Actual pay rates will vary and will be based on various factors, such as your qualifications, skills, competencies, and proficiency for the role. Base pay is one component of WEX's total compensation package. Most sales positions are eligible for commission under the terms of an applicable plan. Non-sales roles are typically eligible for a quarterly or annual bonus based on their role and applicable plan. WEX's comprehensive and market competitive benefits are designed to support your personal and professional well-being. Benefits include health, dental and vision insurances, retirement savings plan, paid time off, health savings account, flexible spending accounts, life insurance, disability insurance, tuition reimbursement, and more. For more information, check out the \"About Us\" section. Salary Pay Range: $101,000.00 - $134,000.00",Competitive,2023-12-11
Penguin Random House LLC,"We are seeking an Oracle Database Administrator to join our team. This person will be at the forefront of managing and optimizing the backbone of a large portion of our application base – the Oracle database. Your role is crucial in ensuring the reliability, performance, and security of our Oracle databases. You will oversee database installation, configuration, maintenance, and backups, while proactively identifying and resolving performance bottlenecks and issues. Collaborating closely with SAP and infrastructure teams, you'll implement best practices and maintain data integrity, all while staying up-to-date with the latest technologies and security measures. Your expertise will be instrumental in guaranteeing the seamless operation of critical business processes and safeguarding our organization's data assets. Application Deadline: December 3, 2023 at 11:59 PM EST Responsibilities: With a focus on best practices, assists with establishing standards and procedures for monitoring, maintenance, and troubleshooting of database systems Monitor, restart, and maintainence of database servers Execute database backup/restore and troubleshoot database related issues Compose scripts to provide critical information to stakeholders and management Monitor server, application, and security error logs for any abnormalities Design, develop, test, and maintain database solutions using server and related applications Design and deploy Integration Service packages Search out and implement new technologies to continually simplify the environment while improving security, scalability, availability, and performance Optimize database accessibility by developing load balancing/high availability architectures and processes to eliminate downtime Develop scripts for database monitoring and to automate routine tasks Perform data management tasks as required, such as loading, restoring, and moving data to support our technical and project implementation teams Share on-call responsibilities with other database administrators Work with application developers in providing tuning and database performance recommendations Qualifications: Experience working with databases in Unix/Linux environments Experience with SAP Basis database support Experience with SAP database installations and maintenance patching Experience with SAP Oracle installations and maintenance patching Experience with disaster recovery planning/implementation Experience with backup and recovery for databases Experience with implementing patches and version upgrades Database server performance tuning Ability to work in cloud environments to develop scalable data pipelines with cloud infrastructure Knowledge of GitLab a plus Experience with database and application security protocols Strong analytical reasoning and problem-solving skills Strong team working skills and ability to work as member of a global team To learn more about our IT Department and their initiatives, visit our Tech Talent site. The salary range for this position is $105,000-$115,000. All positions are currently eligible for annual profit award or bonus, subject to Company results. Please apply using our online application process, and please include your resume with salary requirements. Penguin Random House job postings include a good faith compensation range for each open position. The salary range listed is specific to each particular open position and takes into account various factors including the specifics of the individual role, and candidate's relevant experience and qualifications. Full-time employees are eligible for our comprehensive benefits program. Our range of benefits include, but are not limited to, Medical/Prescription drug insurance, Dental, Vision, Health Care/Dependent Care Flexible Spending Account, Health Savings Account, Pre-Tax and Roth 401(k), Short and Long-Term Disability Insurance, Life/AD&D Insurance, Commuter Benefits, Student Loan Repayment Program, Educational Assistance & generous paid time off. Penguin Random House is the leading adult and children's publishing house in North America, the United Kingdom and many other regions around the world. In publishing the best books in every genre and subject for all ages, we are committed to quality, excellence in execution, and innovation throughout the entire publishing process: editorial, design, marketing, publicity, sales, production, and distribution. Our vibrant and diverse international community of nearly 300 publishing brands and imprints include Ballantine Bantam Dell, Berkley, Clarkson Potter, Crown, DK, Doubleday, Dutton, Grosset & Dunlap, Little Golden Books, Knopf, Modern Library, Pantheon, Penguin Books, Penguin Press, Penguin Random House Audio, Penguin Young Readers, Portfolio, Puffin, Putnam, Random House, Random House Children's Books, Riverhead, Ten Speed Press, Viking, and Vintage, among others. More information can be found at http://www.penguinrandomhouse.com/.<http://www.penguinrandomhouse.com/> Penguin Random House values the array of talents and perspectives that a diverse workforce brings. All qualified applicants will receive consideration for employment without regard to race, national origin, religion, age, color, sex, sexual orientation, gender identity, disability, or protected veteran status. Company: Penguin Random House LLC Country: United States of America State/Region: New York City: New York Postal Code: 10019 Job ID: 265537",Database Administrator (Open to Remote),"Remote in New York, NY 10019","We are seeking an Oracle Database Administrator to join our team. This person will be at the forefront of managing and optimizing the backbone of a large portion of our application base – the Oracle database. Your role is crucial in ensuring the reliability, performance, and security of our Oracle databases. You will oversee database installation, configuration, maintenance, and backups, while proactively identifying and resolving performance bottlenecks and issues. Collaborating closely with SAP and infrastructure teams, you'll implement best practices and maintain data integrity, all while staying up-to-date with the latest technologies and security measures. Your expertise will be instrumental in guaranteeing the seamless operation of critical business processes and safeguarding our organization's data assets. Application Deadline: December 3, 2023 at 11:59 PM EST Responsibilities: With a focus on best practices, assists with establishing standards and procedures for monitoring, maintenance, and troubleshooting of database systems Monitor, restart, and maintainence of database servers Execute database backup/restore and troubleshoot database related issues Compose scripts to provide critical information to stakeholders and management Monitor server, application, and security error logs for any abnormalities Design, develop, test, and maintain database solutions using server and related applications Design and deploy Integration Service packages Search out and implement new technologies to continually simplify the environment while improving security, scalability, availability, and performance Optimize database accessibility by developing load balancing/high availability architectures and processes to eliminate downtime Develop scripts for database monitoring and to automate routine tasks Perform data management tasks as required, such as loading, restoring, and moving data to support our technical and project implementation teams Share on-call responsibilities with other database administrators Work with application developers in providing tuning and database performance recommendations Qualifications: Experience working with databases in Unix/Linux environments Experience with SAP Basis database support Experience with SAP database installations and maintenance patching Experience with SAP Oracle installations and maintenance patching Experience with disaster recovery planning/implementation Experience with backup and recovery for databases Experience with implementing patches and version upgrades Database server performance tuning Ability to work in cloud environments to develop scalable data pipelines with cloud infrastructure Knowledge of GitLab a plus Experience with database and application security protocols Strong analytical reasoning and problem-solving skills Strong team working skills and ability to work as member of a global team To learn more about our IT Department and their initiatives, visit our Tech Talent site. The salary range for this position is $105,000-$115,000. All positions are currently eligible for annual profit award or bonus, subject to Company results. Please apply using our online application process, and please include your resume with salary requirements. Penguin Random House job postings include a good faith compensation range for each open position. The salary range listed is specific to each particular open position and takes into account various factors including the specifics of the individual role, and candidate's relevant experience and qualifications. Full-time employees are eligible for our comprehensive benefits program. Our range of benefits include, but are not limited to, Medical/Prescription drug insurance, Dental, Vision, Health Care/Dependent Care Flexible Spending Account, Health Savings Account, Pre-Tax and Roth 401(k), Short and Long-Term Disability Insurance, Life/AD&D Insurance, Commuter Benefits, Student Loan Repayment Program, Educational Assistance & generous paid time off. Penguin Random House is the leading adult and children's publishing house in North America, the United Kingdom and many other regions around the world. In publishing the best books in every genre and subject for all ages, we are committed to quality, excellence in execution, and innovation throughout the entire publishing process: editorial, design, marketing, publicity, sales, production, and distribution. Our vibrant and diverse international community of nearly 300 publishing brands and imprints include Ballantine Bantam Dell, Berkley, Clarkson Potter, Crown, DK, Doubleday, Dutton, Grosset & Dunlap, Little Golden Books, Knopf, Modern Library, Pantheon, Penguin Books, Penguin Press, Penguin Random House Audio, Penguin Young Readers, Portfolio, Puffin, Putnam, Random House, Random House Children's Books, Riverhead, Ten Speed Press, Viking, and Vintage, among others. More information can be found at http://www.penguinrandomhouse.com/.<http://www.penguinrandomhouse.com/> Penguin Random House values the array of talents and perspectives that a diverse workforce brings. All qualified applicants will receive consideration for employment without regard to race, national origin, religion, age, color, sex, sexual orientation, gender identity, disability, or protected veteran status. Company: Penguin Random House LLC Country: United States of America State/Region: New York City: New York Postal Code: 10019 Job ID: 265537",Competitive,2023-12-11
Orbis,"Location: New York (Hybrid) Salary: $200,000/yr - $250,000/yr Permanent SQL DBA – Electronic Trading – $200-250k A highly reputable technology company that provides a suite of real-time electronic trading solutions is seeking a SQL Database Administrator for their growing engineering team in NYC. The role will focus on designing and developing scalable database infrastructure and automation to analyze real-time financial data. SQL DBA Responsibilities Work in a greenfield environment, focused on building and supporting SQL database solutions for trading activity and portfolio analytics Own database maintenance, optimization and performance monitoring Participate in automation and DevOps initiatives SQL DBA Requirements 5+ years of SQL Server database administration and monitoring experience (2016 or higher) Experience programming with either Javascript or Python Experience working closely with DevOps and be able to participate in related DevOps tasks like infrastructure automation Knowledge of technologies such as Powershell, RedGate suite and Azure DevOps The organization operates on a hybrid working model and has a fantastic suite of benefits, including a bonus, as well as a very strong engineering culture that is world-renowned. If you are a SQL DBA who wants to participate in an innovative, greenfield environment where you can design and build solutions from scratch, please don’t hesitate to apply! Recruiter: Matt Herselman",SQL Database Administrator,"New York, NY 10018 (Garment District area)","Location: New York (Hybrid) Salary: $200,000/yr - $250,000/yr Permanent SQL DBA – Electronic Trading – $200-250k A highly reputable technology company that provides a suite of real-time electronic trading solutions is seeking a SQL Database Administrator for their growing engineering team in NYC. The role will focus on designing and developing scalable database infrastructure and automation to analyze real-time financial data. SQL DBA Responsibilities Work in a greenfield environment, focused on building and supporting SQL database solutions for trading activity and portfolio analytics Own database maintenance, optimization and performance monitoring Participate in automation and DevOps initiatives SQL DBA Requirements 5+ years of SQL Server database administration and monitoring experience (2016 or higher) Experience programming with either Javascript or Python Experience working closely with DevOps and be able to participate in related DevOps tasks like infrastructure automation Knowledge of technologies such as Powershell, RedGate suite and Azure DevOps The organization operates on a hybrid working model and has a fantastic suite of benefits, including a bonus, as well as a very strong engineering culture that is world-renowned. If you are a SQL DBA who wants to participate in an innovative, greenfield environment where you can design and build solutions from scratch, please don’t hesitate to apply! Recruiter: Matt Herselman",Competitive,2023-12-11
