companyName,description,jobName,location,require,salary,timePost
AppLovin,"About AppLovin AppLovin makes technologies that help businesses of every size connect to their ideal customers. The company provides end-to-end software and AI solutions for businesses to reach, monetize and grow their global audiences. For more information about AppLovin, visit: www.applovin.com. To deliver on this mission, our global team is composed of team members with life experiences, backgrounds, and perspectives that mirror our developers and customers around the world. At AppLovin, we are intentional about the team and culture we are building, seeking candidates who are outstanding in their own right and also demonstrate their support of others. Fortune recognized AppLovin as one of the Best Workplaces in the Bay Area 2022, and is a Certified Great Place to Work in 2021, 2022 and 2023. Introduction: AppLovin’s in-house creative team, SparkLabs, is looking for a Junior Game Developer. You would be joining a team that is responsible for building a variety of 'mini-games' designed for mobile devices. The genres will vary from match 3 games to far more complex resource management and mid-core games. These games will be used to allow end users the ability to preview some of the largest mobile gaming apps in the marketplace. If you are passionate about working on thoughtful and polished mini-games that have potential to reach millions of mobile users, join our team! This position will serve as a critical member of an impactful team that wears many hats and moves fast. This role requires someone who thrives in a diverse, fast paced environment where grit and resilience is valued as highly as operational excellence. To be considered for this position, you must include your resume and samples of games you developed. If you have non-game related software development projects you’d like to share please feel free to do so as well. Responsibilities: Create high quality mini-games representing top mobile apps in the marketplace Collaborate with design and business teams to understand partner objectives and achieve business needs Basic Qualifications: BA/BS degree in computer science, game development or related fields; or an equivalent combination of education and experience Proficiency with at least one popular game engine (e.g. Unity 3D, Unreal, CRYENGINE, GameMaker Studio) Motivation to maintain and improve game development standards Strong work ethic, flexibility, and ability to execute high quality work within deadlines with little supervision Ability to grasp multiple project requirements with high attention to detail Preferred Qualifications: 1-2 years of professional experience in game development Mobile experience and knowledge of the mobile advertising landscape Proficiency in Photoshop for basic image editing Passionate about the gaming / mobile app industry! Proficiency in a foreign language Comfortable working in a fast environment that is constantly changing AppLovin provides a competitive total compensation package with a pay for performance rewards approach. Total compensation at AppLovin is based on a number of factors including market location and may vary depending on job-related knowledge, skills, and experience. Depending on the position offered, equity, and other forms of incentive compensation (as applicable) may be provided as part of a total compensation package, in addition to dental, vision, and other benefits. Bay Area base pay range; Total compensation package commensurate with experience $88,000—$134,000 USD AppLovin is proud to be an equal opportunity employer that is committed to inclusion and diversity. All applicants will be considered for employment without attention to race, color, religion, sex, sexual orientation, gender identity, national origin, veteran or disability status, or other legally protected characteristics. If you need assistance and/or a reasonable accommodation due to a disability during the application or recruiting process, please send us a request at accommodations@applovin.com. AppLovin will consider for employment all qualified applicants with criminal histories in a manner consistent with applicable law.",Junior Game Developer,Remote,"About AppLovin AppLovin makes technologies that help businesses of every size connect to their ideal customers. The company provides end-to-end software and AI solutions for businesses to reach, monetize and grow their global audiences. For more information about AppLovin, visit: www.applovin.com. To deliver on this mission, our global team is composed of team members with life experiences, backgrounds, and perspectives that mirror our developers and customers around the world. At AppLovin, we are intentional about the team and culture we are building, seeking candidates who are outstanding in their own right and also demonstrate their support of others. Fortune recognized AppLovin as one of the Best Workplaces in the Bay Area 2022, and is a Certified Great Place to Work in 2021, 2022 and 2023. Introduction: AppLovin’s in-house creative team, SparkLabs, is looking for a Junior Game Developer. You would be joining a team that is responsible for building a variety of 'mini-games' designed for mobile devices. The genres will vary from match 3 games to far more complex resource management and mid-core games. These games will be used to allow end users the ability to preview some of the largest mobile gaming apps in the marketplace. If you are passionate about working on thoughtful and polished mini-games that have potential to reach millions of mobile users, join our team! This position will serve as a critical member of an impactful team that wears many hats and moves fast. This role requires someone who thrives in a diverse, fast paced environment where grit and resilience is valued as highly as operational excellence. To be considered for this position, you must include your resume and samples of games you developed. If you have non-game related software development projects you’d like to share please feel free to do so as well. Responsibilities: Create high quality mini-games representing top mobile apps in the marketplace Collaborate with design and business teams to understand partner objectives and achieve business needs Basic Qualifications: BA/BS degree in computer science, game development or related fields; or an equivalent combination of education and experience Proficiency with at least one popular game engine (e.g. Unity 3D, Unreal, CRYENGINE, GameMaker Studio) Motivation to maintain and improve game development standards Strong work ethic, flexibility, and ability to execute high quality work within deadlines with little supervision Ability to grasp multiple project requirements with high attention to detail Preferred Qualifications: 1-2 years of professional experience in game development Mobile experience and knowledge of the mobile advertising landscape Proficiency in Photoshop for basic image editing Passionate about the gaming / mobile app industry! Proficiency in a foreign language Comfortable working in a fast environment that is constantly changing AppLovin provides a competitive total compensation package with a pay for performance rewards approach. Total compensation at AppLovin is based on a number of factors including market location and may vary depending on job-related knowledge, skills, and experience. Depending on the position offered, equity, and other forms of incentive compensation (as applicable) may be provided as part of a total compensation package, in addition to dental, vision, and other benefits. Bay Area base pay range; Total compensation package commensurate with experience $88,000—$134,000 USD AppLovin is proud to be an equal opportunity employer that is committed to inclusion and diversity. All applicants will be considered for employment without attention to race, color, religion, sex, sexual orientation, gender identity, national origin, veteran or disability status, or other legally protected characteristics. If you need assistance and/or a reasonable accommodation due to a disability during the application or recruiting process, please send us a request at accommodations@applovin.com. AppLovin will consider for employment all qualified applicants with criminal histories in a manner consistent with applicable law.",Competitive,2023-12-11
Bad Robot Games,"Founded by Bad Robot (Lost, Cloverfield, Westworld, Star Wars, Star Trek), we at Bad Robot Games are on a mission to continually reinvent how stories are played. We are a remote-first games company represented by a diverse team, which empowers us to make the kinds of games in which all players can see themselves. Working closely with our colleagues at Bad Robot Productions, our projects unite our extensive network of games, TV, and film industry talent to create original IPs, expansive worlds and tell new stories across all media platforms which are as fun to watch as they are to play. Bad Robot Games is seeking a tester to execute test cases and scenarios with attention to detail to help ensure the quality of the product. KEY RESPONSIBILITIES Perform both functional and subjective testing and separate the two properly Test via End-to-end product testing (black box) Identify defects and write clear and concise steps to reproduce in bug reports Work alongside a small QA team to playtest the game, execute test passes, write bugs, investigate defects, and verify fixes Collaborate effectively with various teams, including but not limited to QA, Production, Engineering, Art, etc, to help track down defects and perform investigations KEY QUALIFICATIONS Minimum 2 years experience testing games or equivalent experience Experience shipping at least 1 game title, working on a live product, or equivalent experience as a QA Game Tester Excellent written and verbal communication skills Skilled troubleshooter Experience testing on multiple platforms Strong communication skills for a fully remote environment A general understanding of game development life cycles Experience with Jira or equivalent bug tracking software (DevTrack, etc.) Experience with black box testing All of our roles require up to 10% air travel. Examples include Studio/Team Offsites, Team/Studio Events, etc. BONUSES Experience working with Game Engines (Unreal Preferred) Passion for Games and/or movies Hourly Rate Range: $18.26 - $30.05 Our ranges are based on California market rate regardless of work location in the US. Find out more about our benefits and team on our careers page! Bad Robot Games recruiters will never ask you for money or to provide financial information during our recruiting process. Scammers often request money transfers for Visa processing fees or travel expenses, as well as personal information including passport info, social security numbers, credit card or bank account information.Bad Robot Games recruiters will never use personal email (including @gmail) accounts when contacting candidates. We also do NOT interview or screen candidates over messenger or text-based chat. All communication will be tied to badrobotgames.com Bad Robot Games is an Equal Opportunity Employer. All persons will receive consideration for employment without regard to gender (including gender identity, gender expression and gender reassignment), race (including colour, nationality, ethnic or national origin), religion or belief, marital or civil partnership status, disability, age, sexual orientation, pregnancy or maternity, trade union membership or membership in any other legally protected category.",QA Tester,Remote,"Founded by Bad Robot (Lost, Cloverfield, Westworld, Star Wars, Star Trek), we at Bad Robot Games are on a mission to continually reinvent how stories are played. We are a remote-first games company represented by a diverse team, which empowers us to make the kinds of games in which all players can see themselves. Working closely with our colleagues at Bad Robot Productions, our projects unite our extensive network of games, TV, and film industry talent to create original IPs, expansive worlds and tell new stories across all media platforms which are as fun to watch as they are to play. Bad Robot Games is seeking a tester to execute test cases and scenarios with attention to detail to help ensure the quality of the product. KEY RESPONSIBILITIES Perform both functional and subjective testing and separate the two properly Test via End-to-end product testing (black box) Identify defects and write clear and concise steps to reproduce in bug reports Work alongside a small QA team to playtest the game, execute test passes, write bugs, investigate defects, and verify fixes Collaborate effectively with various teams, including but not limited to QA, Production, Engineering, Art, etc, to help track down defects and perform investigations KEY QUALIFICATIONS Minimum 2 years experience testing games or equivalent experience Experience shipping at least 1 game title, working on a live product, or equivalent experience as a QA Game Tester Excellent written and verbal communication skills Skilled troubleshooter Experience testing on multiple platforms Strong communication skills for a fully remote environment A general understanding of game development life cycles Experience with Jira or equivalent bug tracking software (DevTrack, etc.) Experience with black box testing All of our roles require up to 10% air travel. Examples include Studio/Team Offsites, Team/Studio Events, etc. BONUSES Experience working with Game Engines (Unreal Preferred) Passion for Games and/or movies Hourly Rate Range: $18.26 - $30.05 Our ranges are based on California market rate regardless of work location in the US. Find out more about our benefits and team on our careers page! Bad Robot Games recruiters will never ask you for money or to provide financial information during our recruiting process. Scammers often request money transfers for Visa processing fees or travel expenses, as well as personal information including passport info, social security numbers, credit card or bank account information.Bad Robot Games recruiters will never use personal email (including @gmail) accounts when contacting candidates. We also do NOT interview or screen candidates over messenger or text-based chat. All communication will be tied to badrobotgames.com Bad Robot Games is an Equal Opportunity Employer. All persons will receive consideration for employment without regard to gender (including gender identity, gender expression and gender reassignment), race (including colour, nationality, ethnic or national origin), religion or belief, marital or civil partnership status, disability, age, sexual orientation, pregnancy or maternity, trade union membership or membership in any other legally protected category.",Competitive,2023-12-11
Electronic Arts,"EA Sports is looking for a Script Writer in its new Orlando studio to focus on in-game commentary and narrative writing for its Madden franchise. We've come a long way from just telling John Madden to \"ad lib something about an interception.\" We now typically record multiple sessions per week with our talent, creating tens of thousands of new lines every year - all of which need to fit in and work in concert with our existing library of somewhere north of 100,000 lines. We're looking for someone who really understands the nature of sports broadcasting, and can compose lines for our commentators that reflect how the game sounds on television, to achieve a true broadcast feel in the game. We need someone who can get into the mind of a broadcaster and capture not just what to say, but how to say it. This is less a position about creating yearbook or blog entries about stats and facts, and more about creative writing and being able to create lines that sound natural when they trigger in the game. Responsibilities: Design, write and prepare scripts for play-by-play announcers, color analysts, studio analysts, and other speaking roles across all game modes. Attend recording sessions in-studio (as working conditions allow) and work with voice-over talent, producers, directors and audio support staff to ensure that what's recorded meets our high-quality bar. Work with implementers and audio staff to ensure that new lines are playing accurately in-game. Participate in weekly design meetings and review sessions. Play the game to: analyze and critique current builds for quality and accuracy. Identify areas for added depth and improvements to commentary. Identify opportunities in commentary due to differences in how users PLAY the game of Madden, as compared to a typical NFL game. Requirements: Strong football and NFL knowledge required! Candidate should have deep knowledge of players, teams, recent news, offensive and defensive formations, history, terminology, etc. Creative or sports writing background/experience. Familiarity with the Madden NFL product line highly desirable. In depth knowledge of real world sports broadcast play-by-play and analyst commentary. (Actual on-air work in, say, college radio or internet simulcasting welcomed but not required.) Knowledge and ability to work in Microsoft Excel and Google Sheets. Any experience on game development teams in narrative design, system design, career progression, writing and/or other aspects of design is desired, but not required. Experience as a collaborative team player who understands good story ideas can come from anywhere on the team. Ability to hit writing deadlines, so that ample review can be given to content/rewrites to happen prior to sessions with commentary talent. Strong communication skills/ability to solicit feedback from the team on your writing prior to deadlines. \"US COMPENSATION AND BENEFITS The base salary ranges listed below are for the defined geographic market pay zones in these states. If you reside outside of these locations, a recruiter will advise on the base salary range and benefits for your specific location. EA has listed the base salary ranges it in good faith expects to pay applicants for this role in the locations listed, as of the time of this posting. Salary offered will be determined based on numerous relevant business and candidate factors including, for example, education, qualifications, certifications, experience, skills, geographic location, and business or organizational needs. BASE SALARY RANGES California (depending on location e.g. Los Angeles vs. Sacramento): º $78,500 - $119,650 New York (depending on location e.g. Manhattan vs. Buffalo): º $73,150 - $119,650 Jersey City, NJ : º $84,750 - $119,650 Colorado (depending on location e.g. Denver vs. Colorado Springs): º $73,150 - $97,500 Washington (depending on location e.g. Seattle vs. Spokane): º $73,150 - $105,250 Base salary is just one part of the overall compensation at EA. We also offer a package of benefits including paid time off (3 weeks per year to start), 80 hours per year of sick time, 16 paid company holidays per year, medical/dental/vision insurance, life insurance, disability insurance, and 401(k) to temporary full-time employees scheduled to work full time. We are a global team of creators, storytellers, technologists, experience originators, innovators and so much more. We believe amazing games and experiences start with teams as diverse as the players and communities we serve. At Electronic Arts, the only limit is your imagination.",Script Writer (Madden),"Orlando, FL 32810","EA Sports is looking for a Script Writer in its new Orlando studio to focus on in-game commentary and narrative writing for its Madden franchise. We've come a long way from just telling John Madden to \"ad lib something about an interception.\" We now typically record multiple sessions per week with our talent, creating tens of thousands of new lines every year - all of which need to fit in and work in concert with our existing library of somewhere north of 100,000 lines. We're looking for someone who really understands the nature of sports broadcasting, and can compose lines for our commentators that reflect how the game sounds on television, to achieve a true broadcast feel in the game. We need someone who can get into the mind of a broadcaster and capture not just what to say, but how to say it. This is less a position about creating yearbook or blog entries about stats and facts, and more about creative writing and being able to create lines that sound natural when they trigger in the game. Responsibilities: Design, write and prepare scripts for play-by-play announcers, color analysts, studio analysts, and other speaking roles across all game modes. Attend recording sessions in-studio (as working conditions allow) and work with voice-over talent, producers, directors and audio support staff to ensure that what's recorded meets our high-quality bar. Work with implementers and audio staff to ensure that new lines are playing accurately in-game. Participate in weekly design meetings and review sessions. Play the game to: analyze and critique current builds for quality and accuracy. Identify areas for added depth and improvements to commentary. Identify opportunities in commentary due to differences in how users PLAY the game of Madden, as compared to a typical NFL game. Requirements: Strong football and NFL knowledge required! Candidate should have deep knowledge of players, teams, recent news, offensive and defensive formations, history, terminology, etc. Creative or sports writing background/experience. Familiarity with the Madden NFL product line highly desirable. In depth knowledge of real world sports broadcast play-by-play and analyst commentary. (Actual on-air work in, say, college radio or internet simulcasting welcomed but not required.) Knowledge and ability to work in Microsoft Excel and Google Sheets. Any experience on game development teams in narrative design, system design, career progression, writing and/or other aspects of design is desired, but not required. Experience as a collaborative team player who understands good story ideas can come from anywhere on the team. Ability to hit writing deadlines, so that ample review can be given to content/rewrites to happen prior to sessions with commentary talent. Strong communication skills/ability to solicit feedback from the team on your writing prior to deadlines. \"US COMPENSATION AND BENEFITS The base salary ranges listed below are for the defined geographic market pay zones in these states. If you reside outside of these locations, a recruiter will advise on the base salary range and benefits for your specific location. EA has listed the base salary ranges it in good faith expects to pay applicants for this role in the locations listed, as of the time of this posting. Salary offered will be determined based on numerous relevant business and candidate factors including, for example, education, qualifications, certifications, experience, skills, geographic location, and business or organizational needs. BASE SALARY RANGES California (depending on location e.g. Los Angeles vs. Sacramento): º $78,500 - $119,650 New York (depending on location e.g. Manhattan vs. Buffalo): º $73,150 - $119,650 Jersey City, NJ : º $84,750 - $119,650 Colorado (depending on location e.g. Denver vs. Colorado Springs): º $73,150 - $97,500 Washington (depending on location e.g. Seattle vs. Spokane): º $73,150 - $105,250 Base salary is just one part of the overall compensation at EA. We also offer a package of benefits including paid time off (3 weeks per year to start), 80 hours per year of sick time, 16 paid company holidays per year, medical/dental/vision insurance, life insurance, disability insurance, and 401(k) to temporary full-time employees scheduled to work full time. We are a global team of creators, storytellers, technologists, experience originators, innovators and so much more. We believe amazing games and experiences start with teams as diverse as the players and communities we serve. At Electronic Arts, the only limit is your imagination.",Competitive,2023-12-11
