companyName,description,jobName,location,require,salary,timePost
Pinterest,"About Pinterest: Millions of people across the world come to Pinterest to find new ideas every day. It's where they get inspiration, dream about new possibilities and plan for what matters most. Our mission is to help those people find their inspiration and create a life they love. In your role, you'll be challenged to take on work that upholds this mission and pushes Pinterest forward. You'll grow as a person and leader in your field, all the while helping Pinners make their lives better in the positive corner of the internet. Creating a life you love also means finding a career that celebrates the unique perspectives and experiences that you bring. As you read through the expectations of the position, consider how your skills and experiences may complement the responsibilities of the role. We encourage you to think through your relevant and transferable skills from prior experiences. Our new progressive work model is called PinFlex, a term that's uniquely Pinterest to describe our flexible approach to living and working. Visit our PinFlex landing page to learn more. We are looking for a Data Analyst II in our Data and Analytics team within the Trust & Safety Organization to support us to work on Transparency Reports and Proactive Analytical projects. The Data and Analytics team mission is to provide accurate, timely and insightful operational data that empowers partner teams to make informed decisions that keep Pinterest safe and loved. The team focuses on reporting, visualizations, proactive analytical insights, statistical insights and supports XFN teams to make better decisions, monitor how effectively we're solving issues for Pinners, and identify ways to do better. What you'll do: Conduct analyses and provide technical guidance to support Business Integrity and Trust & Safety teams Develop metrics, reporting structures and dashboards that help measure and improve operational performance Partner with other technical team members to standardize and improve existing data sources and reporting processes Identify operational pain points and areas of opportunity and leverage analytics to generate solutions and recommendations Collaborate with cross-functional teams such as engineering, product, and policy, to improve user experience, drive operational improvements and create as well as automate Transparency Reporting What we're looking for: Experience using quantitative analysis to identify areas of improvement and influence business decisions Demonstrated experience extracting, manipulating and analyzing complex data using SQL or comparable languages Knowledge of business intelligence tools like Tableau Creativity in developing new processes, conducting analyses and providing recommendations At Least 4+ years of relevant experience in the field of Data and Analytics Relocation Statement: This position is not eligible for relocation assistance. Visit our PinFlex page to learn more about our working model. #LI-REMOTE #LI-RT1 At Pinterest we believe the workplace should be equitable, inclusive, and inspiring for every employee. In an effort to provide greater transparency, we are sharing the base salary range for this position. The position is also eligible for equity. Final salary is based on a number of factors including location, travel, relevant prior experience, or particular skills and expertise. Information regarding the culture at Pinterest and benefits available for this position can be found here. US based applicants only $96,900—$200,000 USD Our Commitment to Diversity: Pinterest is an equal opportunity employer and makes employment decisions on the basis of merit. We want to have the best qualified people in every job. All qualified applicants will receive consideration for employment without regard to race, color, religion, sex, sexual orientation, gender identity, national origin, disability, protected veteran status, or any other characteristic under federal, state, or local law. We also consider qualified applicants regardless of criminal histories, consistent with legal requirements. If you require an accommodation during the job application process, please notify accessibility@pinterest.com for support.",Data Analyst II - Trust & Safety,"Remote in San Francisco, CA","About Pinterest: Millions of people across the world come to Pinterest to find new ideas every day. It's where they get inspiration, dream about new possibilities and plan for what matters most. Our mission is to help those people find their inspiration and create a life they love. In your role, you'll be challenged to take on work that upholds this mission and pushes Pinterest forward. You'll grow as a person and leader in your field, all the while helping Pinners make their lives better in the positive corner of the internet. Creating a life you love also means finding a career that celebrates the unique perspectives and experiences that you bring. As you read through the expectations of the position, consider how your skills and experiences may complement the responsibilities of the role. We encourage you to think through your relevant and transferable skills from prior experiences. Our new progressive work model is called PinFlex, a term that's uniquely Pinterest to describe our flexible approach to living and working. Visit our PinFlex landing page to learn more. We are looking for a Data Analyst II in our Data and Analytics team within the Trust & Safety Organization to support us to work on Transparency Reports and Proactive Analytical projects. The Data and Analytics team mission is to provide accurate, timely and insightful operational data that empowers partner teams to make informed decisions that keep Pinterest safe and loved. The team focuses on reporting, visualizations, proactive analytical insights, statistical insights and supports XFN teams to make better decisions, monitor how effectively we're solving issues for Pinners, and identify ways to do better. What you'll do: Conduct analyses and provide technical guidance to support Business Integrity and Trust & Safety teams Develop metrics, reporting structures and dashboards that help measure and improve operational performance Partner with other technical team members to standardize and improve existing data sources and reporting processes Identify operational pain points and areas of opportunity and leverage analytics to generate solutions and recommendations Collaborate with cross-functional teams such as engineering, product, and policy, to improve user experience, drive operational improvements and create as well as automate Transparency Reporting What we're looking for: Experience using quantitative analysis to identify areas of improvement and influence business decisions Demonstrated experience extracting, manipulating and analyzing complex data using SQL or comparable languages Knowledge of business intelligence tools like Tableau Creativity in developing new processes, conducting analyses and providing recommendations At Least 4+ years of relevant experience in the field of Data and Analytics Relocation Statement: This position is not eligible for relocation assistance. Visit our PinFlex page to learn more about our working model. #LI-REMOTE #LI-RT1 At Pinterest we believe the workplace should be equitable, inclusive, and inspiring for every employee. In an effort to provide greater transparency, we are sharing the base salary range for this position. The position is also eligible for equity. Final salary is based on a number of factors including location, travel, relevant prior experience, or particular skills and expertise. Information regarding the culture at Pinterest and benefits available for this position can be found here. US based applicants only $96,900—$200,000 USD Our Commitment to Diversity: Pinterest is an equal opportunity employer and makes employment decisions on the basis of merit. We want to have the best qualified people in every job. All qualified applicants will receive consideration for employment without regard to race, color, religion, sex, sexual orientation, gender identity, national origin, disability, protected veteran status, or any other characteristic under federal, state, or local law. We also consider qualified applicants regardless of criminal histories, consistent with legal requirements. If you require an accommodation during the job application process, please notify accessibility@pinterest.com for support.",Competitive,2024-01-14
Booz Allen Hamilton,"Job Description Location: Washington,DC,US Remote Work: Yes Job Number: R0188698 Data Analyst, Junior Key Role: Serve as a data analyst supporting a client’s department. Provide data analysis and data visualization services as a member of a client-site team providing real property and infrastructure analytical support. Apply advanced understanding of both quantitative and qualitative analysis and recommendations to improve organizational data reporting, data management, and data analytics processes. Assist in building data analysis and visualization capability across various projects. Identify opportunities for improvement of analytical services provided to the client. Analyze large data sets using Python, Structured Query Language (SQL), Tableau, Power BI, and other analytical tools. Develop tools and prepare briefings and reports on analysis methodologies and results. Contribute to the development of innovative principles and ideas. Basic Qualifications: Experience in consulting or client facing environment Experience with project or program management Experience in data analysis and data visualization Experience with using Microsoft Excel, VBA, Python, SQL, or R Ability to understand client needs and translate them into deliverables Ability to produce reports, dashboards, and decks with various analytical tools Ability to take initiative and think creatively Bachelor’s degree Additional Qualifications: Experience developing Tableau or Power BI dashboards Experience with Microsoft PowerApps and Power Automate Experience working in a client facing environment Ability to display interest in infrastructure and facilities management Possession of excellent verbal and written communication skills, including using presentation expertise to convey complex ideas to client and internal staff Create Your Career: Grow With Us Your growth matters to us—that’s why we offer a variety of ways for you to develop your career. With professional and leadership development opportunities like upskilling programs, tuition reimbursement, mentoring, and firm-sponsored networking, you can chart a unique and fulfilling career path on your own terms. A Place Where You Belong Diverse perspectives cultivate collective ingenuity. Booz Allen’s culture of respect, equity, and opportunity means that, here, you are free to bring your whole self to work. With an array of business resource groups and other opportunities for connection, you’ll build your community in no time. Support Your Well-Being Our comprehensive benefits package includes wellness programs with HSA contributions, paid holidays, paid parental leave, a generous 401(k) match, and more. With these benefits, plus the option for flexible schedules and remote and hybrid locations, we’ll support you as you pursue a balanced, fulfilling life—at work and at home. Your Candidate Journey At Booz Allen, we know our people are what propel us forward, and we value relationships most of all. Here, we’ve compiled a list of resources so you’ll know what to expect as we forge a connection with you during your journey as a candidate with us. Compensation At Booz Allen, we celebrate your contributions, provide you with opportunities and choices, and support your total well-being. Our offerings include health, life, disability, financial, and retirement benefits, as well as paid leave, professional development, tuition assistance, work-life programs, and dependent care. Our recognition awards program acknowledges employees for exceptional performance and superior demonstration of our values. Full-time and part-time employees working at least 20 hours a week on a regular basis are eligible to participate in Booz Allen’s benefit programs. Individuals that do not meet the threshold are only eligible for select offerings, not inclusive of health benefits. We encourage you to learn more about our total benefits by visiting the Resource page on our Careers site and reviewing Our Employee Benefits page. Salary at Booz Allen is determined by various factors, including but not limited to location, the individual’s particular combination of education, knowledge, skills, competencies, and experience, as well as contract-specific affordability and organizational requirements. The projected compensation range for this position is $45,400.00 to $93,000.00 (annualized USD). The estimate displayed represents the typical salary range for this position and is just one component of Booz Allen’s total compensation package for employees. This posting will close within 90 days from the Posting Date. Work Model Our people-first culture prioritizes the benefits of flexibility and collaboration, whether that happens in person or remotely. If this position is listed as remote or hybrid, you’ll periodically work from a Booz Allen or client site facility. If this position is listed as onsite, you’ll work with colleagues and clients in person, as needed for the specific role. EEO Commitment We’re an equal employment opportunity/affirmative action employer that empowers our people to fearlessly drive change – no matter their race, color, ethnicity, religion, sex (including pregnancy, childbirth, lactation, or related medical conditions), national origin, ancestry, age, marital status, sexual orientation, gender identity and expression, disability, veteran status, military or uniformed service member status, genetic information, or any other status protected by applicable federal, state, local, or international law.","Data Analyst, Junior","Remote in Washington, DC","Job Description Location: Washington,DC,US Remote Work: Yes Job Number: R0188698 Data Analyst, Junior Key Role: Serve as a data analyst supporting a client’s department. Provide data analysis and data visualization services as a member of a client-site team providing real property and infrastructure analytical support. Apply advanced understanding of both quantitative and qualitative analysis and recommendations to improve organizational data reporting, data management, and data analytics processes. Assist in building data analysis and visualization capability across various projects. Identify opportunities for improvement of analytical services provided to the client. Analyze large data sets using Python, Structured Query Language (SQL), Tableau, Power BI, and other analytical tools. Develop tools and prepare briefings and reports on analysis methodologies and results. Contribute to the development of innovative principles and ideas. Basic Qualifications: Experience in consulting or client facing environment Experience with project or program management Experience in data analysis and data visualization Experience with using Microsoft Excel, VBA, Python, SQL, or R Ability to understand client needs and translate them into deliverables Ability to produce reports, dashboards, and decks with various analytical tools Ability to take initiative and think creatively Bachelor’s degree Additional Qualifications: Experience developing Tableau or Power BI dashboards Experience with Microsoft PowerApps and Power Automate Experience working in a client facing environment Ability to display interest in infrastructure and facilities management Possession of excellent verbal and written communication skills, including using presentation expertise to convey complex ideas to client and internal staff Create Your Career: Grow With Us Your growth matters to us—that’s why we offer a variety of ways for you to develop your career. With professional and leadership development opportunities like upskilling programs, tuition reimbursement, mentoring, and firm-sponsored networking, you can chart a unique and fulfilling career path on your own terms. A Place Where You Belong Diverse perspectives cultivate collective ingenuity. Booz Allen’s culture of respect, equity, and opportunity means that, here, you are free to bring your whole self to work. With an array of business resource groups and other opportunities for connection, you’ll build your community in no time. Support Your Well-Being Our comprehensive benefits package includes wellness programs with HSA contributions, paid holidays, paid parental leave, a generous 401(k) match, and more. With these benefits, plus the option for flexible schedules and remote and hybrid locations, we’ll support you as you pursue a balanced, fulfilling life—at work and at home. Your Candidate Journey At Booz Allen, we know our people are what propel us forward, and we value relationships most of all. Here, we’ve compiled a list of resources so you’ll know what to expect as we forge a connection with you during your journey as a candidate with us. Compensation At Booz Allen, we celebrate your contributions, provide you with opportunities and choices, and support your total well-being. Our offerings include health, life, disability, financial, and retirement benefits, as well as paid leave, professional development, tuition assistance, work-life programs, and dependent care. Our recognition awards program acknowledges employees for exceptional performance and superior demonstration of our values. Full-time and part-time employees working at least 20 hours a week on a regular basis are eligible to participate in Booz Allen’s benefit programs. Individuals that do not meet the threshold are only eligible for select offerings, not inclusive of health benefits. We encourage you to learn more about our total benefits by visiting the Resource page on our Careers site and reviewing Our Employee Benefits page. Salary at Booz Allen is determined by various factors, including but not limited to location, the individual’s particular combination of education, knowledge, skills, competencies, and experience, as well as contract-specific affordability and organizational requirements. The projected compensation range for this position is $45,400.00 to $93,000.00 (annualized USD). The estimate displayed represents the typical salary range for this position and is just one component of Booz Allen’s total compensation package for employees. This posting will close within 90 days from the Posting Date. Work Model Our people-first culture prioritizes the benefits of flexibility and collaboration, whether that happens in person or remotely. If this position is listed as remote or hybrid, you’ll periodically work from a Booz Allen or client site facility. If this position is listed as onsite, you’ll work with colleagues and clients in person, as needed for the specific role. EEO Commitment We’re an equal employment opportunity/affirmative action employer that empowers our people to fearlessly drive change – no matter their race, color, ethnicity, religion, sex (including pregnancy, childbirth, lactation, or related medical conditions), national origin, ancestry, age, marital status, sexual orientation, gender identity and expression, disability, veteran status, military or uniformed service member status, genetic information, or any other status protected by applicable federal, state, local, or international law.",Competitive,2024-01-14
BayOne,Looking for a BA/PM candidate The teams are working on trong and medium projects multiple Talk to business group and work on documenting business process Process analysis - interview business groups and build swim lane chart on the process and also a future process We need to keep the project moving once the team is done finding the right solutions Create a work flow then help in documenting Discuss the project with groups and provide status updates and keep the ball rolling,BA/PM,"San Francisco, CA",Looking for a BA/PM candidate The teams are working on trong and medium projects multiple Talk to business group and work on documenting business process Process analysis - interview business groups and build swim lane chart on the process and also a future process We need to keep the project moving once the team is done finding the right solutions Create a work flow then help in documenting Discuss the project with groups and provide status updates and keep the ball rolling,Competitive,2024-01-14
"Perficient, Inc","We currently have a career opportunity for a Healthcare Data Analyst to join our team. While Perficient's headquarters are in St. Louis, MO, this role is remote and candidates can be located anywhere in the continental US. As a Healthcare Data Analyst, working in a team environment you will take direction from solution architects and Leads on client data activities. Perficient is always looking for the best and brightest talent and we need you! We’re a quickly-growing, global digital consulting leader, and we’re transforming the world’s largest enterprises and biggest brands. You’ll work with the latest technologies, expand your skills, and become a part of our global community of talented, diverse, and knowledgeable colleagues.",Healthcare Data Analyst - REMOTE,Remote in United States,"We currently have a career opportunity for a Healthcare Data Analyst to join our team. While Perficient's headquarters are in St. Louis, MO, this role is remote and candidates can be located anywhere in the continental US. As a Healthcare Data Analyst, working in a team environment you will take direction from solution architects and Leads on client data activities. Perficient is always looking for the best and brightest talent and we need you! We’re a quickly-growing, global digital consulting leader, and we’re transforming the world’s largest enterprises and biggest brands. You’ll work with the latest technologies, expand your skills, and become a part of our global community of talented, diverse, and knowledgeable colleagues.",Competitive,2024-01-14
TRA'BIAN ENTERPRISES,"Location: 100% Remote Position Type: Contract Position Term: 6 Months to 1 Year Skills: For initial chatbot development – Experience analyzing call logs, online-chat transcripts, Experience with web and mobile usage to determine a prioritized list of suggested intents to create. Once the chatbot is created – will uses analytics data from Watson Assistant to provide insights into overall Bot performance and areas of improvement.",(5) Data Analyst / Data Scientist,Remote,"Location: 100% Remote Position Type: Contract Position Term: 6 Months to 1 Year Skills: For initial chatbot development – Experience analyzing call logs, online-chat transcripts, Experience with web and mobile usage to determine a prioritized list of suggested intents to create. Once the chatbot is created – will uses analytics data from Watson Assistant to provide insights into overall Bot performance and areas of improvement.",Competitive,2024-01-14
