companyName,description,jobName,location,require,salary,timePost
Treehouse Finance,"Chi tiết công việc Ops & Admin Intern tại Treehouse We are looking for a proactive, and resourceful candidate with excellent organisational ability and people skills to join us as an Ops & Admin Intern. In this role, you will work within our Corporate team to provide reliable operational and administrative support at the company level. This includes implementation and enforcement of internal processes, strengthening of internal communication, and managing of office activities and logistics. Roles & Responsibilities Cross-departmental administrative and operational support. Liaising with vendors and external partners for company needs. Provide support for recruitment efforts (job posting, resumes screening and managing applications/correspondences, scheduling interviews, candidate screening and tracking). Assist with the on-boarding and off-boarding employees. Updating and organising company information and data. Procurement and tracking of office equipment and supplies. Assist with planning, preparation, and execution of company activities and events. Assist with claims processing. Skills & Requirements Able to commit to an full-time internship from January 2024 - June 2024. Student pursuing a diploma in business or any related field. A proactive and problem-solving posture. Meticulousness, with a sharp eye for detail. Service-orientedness with a warm disposition. Resourcefulness and good time-management, even while under pressure. Systematic, organised, and disciplined. Ability to thrive in a fast-paced and dynamic environment. Proficiency in Microsoft Office (especially Excel) and Google Workspace. Company Description Treehouse provides DeFi users with live analytics and risk metrics of their digital assets. We are building a unified and user-friendly interface to help users successfully manage their portfolio in the ever-changing world of DeFi. We aim to be the gateway for all traders to effectively manage their DeFi risk across chains, and are backed by some of the world’s top VCs. We strive to provide a people-centred culture with a focus on personal development and professional growth.",Ops & Admin Intern,Singapore,"Chi tiết công việc Ops & Admin Intern tại Treehouse We are looking for a proactive, and resourceful candidate with excellent organisational ability and people skills to join us as an Ops & Admin Intern. In this role, you will work within our Corporate team to provide reliable operational and administrative support at the company level. This includes implementation and enforcement of internal processes, strengthening of internal communication, and managing of office activities and logistics. Roles & Responsibilities Cross-departmental administrative and operational support. Liaising with vendors and external partners for company needs. Provide support for recruitment efforts (job posting, resumes screening and managing applications/correspondences, scheduling interviews, candidate screening and tracking). Assist with the on-boarding and off-boarding employees. Updating and organising company information and data. Procurement and tracking of office equipment and supplies. Assist with planning, preparation, and execution of company activities and events. Assist with claims processing. Skills & Requirements Able to commit to an full-time internship from January 2024 - June 2024. Student pursuing a diploma in business or any related field. A proactive and problem-solving posture. Meticulousness, with a sharp eye for detail. Service-orientedness with a warm disposition. Resourcefulness and good time-management, even while under pressure. Systematic, organised, and disciplined. Ability to thrive in a fast-paced and dynamic environment. Proficiency in Microsoft Office (especially Excel) and Google Workspace. Company Description Treehouse provides DeFi users with live analytics and risk metrics of their digital assets. We are building a unified and user-friendly interface to help users successfully manage their portfolio in the ever-changing world of DeFi. We aim to be the gateway for all traders to effectively manage their DeFi risk across chains, and are backed by some of the world’s top VCs. We strive to provide a people-centred culture with a focus on personal development and professional growth.",Competitive,24-11-2023
Youyi Technology Pte Ltd,"Chi tiết công việc IT Engineer (Server / Microsoft Exchange) tại Youyi Technology Pte Ltd Responsibilities: User administration, including administration of user accounts Manage and maintain systems utilities and scripts System configuration management including modifying BIOS, systems settings, system registries, drive mappings Manage batch jobs and scheduled tasks Server patch management Troubleshoot performance issues System security administration such as: Monitor and perform SSL/TLS certificate renewal for the systems in a timely manner before expiry Manage encryption/decryption keys for the servers; Escalate hardware faults and software errors to the appointed Supplier or third party vendors Management of system logs Backup and restore/recovery jobs Review of alerts, system logs, event logs, error logs and security logs Performance and fault management for monitoring server health eg. CPU, memory, disk space utilisation and other relevant monitoring parameters Server availability and performance related reporting Document and maintain server administration guides and SOPs Requirements: At least 3 years of experience in Microsoft server administration and operations Microsoft Certified Solutions Associate (MCSA) eg. MCSA:2012, MCSA:2016 Possessing some Linux and VMWare administration experience is desirable",IT Engineer (Server / Microsoft Exchange),Singapore,"Chi tiết công việc IT Engineer (Server / Microsoft Exchange) tại Youyi Technology Pte Ltd Responsibilities: User administration, including administration of user accounts Manage and maintain systems utilities and scripts System configuration management including modifying BIOS, systems settings, system registries, drive mappings Manage batch jobs and scheduled tasks Server patch management Troubleshoot performance issues System security administration such as: Monitor and perform SSL/TLS certificate renewal for the systems in a timely manner before expiry Manage encryption/decryption keys for the servers; Escalate hardware faults and software errors to the appointed Supplier or third party vendors Management of system logs Backup and restore/recovery jobs Review of alerts, system logs, event logs, error logs and security logs Performance and fault management for monitoring server health eg. CPU, memory, disk space utilisation and other relevant monitoring parameters Server availability and performance related reporting Document and maintain server administration guides and SOPs Requirements: At least 3 years of experience in Microsoft server administration and operations Microsoft Certified Solutions Associate (MCSA) eg. MCSA:2012, MCSA:2016 Possessing some Linux and VMWare administration experience is desirable","SGD3,5N-SGD4,5N",28-11-2023
Joy Waltz Academy,"Chi tiết công việc Studio Operations Executive tại Joy Waltz Academy Join our vibrant, nurturing team and work with kids learning to play the piano! Requirements: - Enthusiastic, passionate and outspoken - Love for children - Able to work with students & communicate with parents - Proficient in using Macbooks, Microsoft Office, CRM systems and Whatsapp Web - Good command of English - Some knowledge of Piano music, preferably - Able to work retail hours on both weekends (Saturday & Sunday), 6 Day Work Week. Responsibilities: - Handle registrations, Updating the scheduling of lessons - Checking in and bringing children into their classes - Ensuring classrooms are in good condition & preparing materials - Explaining our programme in detail to parents to boost student enrolment - Able to work in a fast-paced environment, think and act under pressure - Manage overall well-being of the piano studio Benefits: - Training & Onboarding provided *Additional training may be provided if necessary - Vibrant and nurturing work environment - Potential performance commissions & bonuses are available Email your resume to: hr @ joywaltzstudio.com We will contact you for an interview if you are shortlisted. (Only apply if you are able to commit to the time schedules above, able to commit for a year, and have relevant work experience.)",Studio Operations Executive,Singapore,"Chi tiết công việc Studio Operations Executive tại Joy Waltz Academy Join our vibrant, nurturing team and work with kids learning to play the piano! Requirements: - Enthusiastic, passionate and outspoken - Love for children - Able to work with students & communicate with parents - Proficient in using Macbooks, Microsoft Office, CRM systems and Whatsapp Web - Good command of English - Some knowledge of Piano music, preferably - Able to work retail hours on both weekends (Saturday & Sunday), 6 Day Work Week. Responsibilities: - Handle registrations, Updating the scheduling of lessons - Checking in and bringing children into their classes - Ensuring classrooms are in good condition & preparing materials - Explaining our programme in detail to parents to boost student enrolment - Able to work in a fast-paced environment, think and act under pressure - Manage overall well-being of the piano studio Benefits: - Training & Onboarding provided *Additional training may be provided if necessary - Vibrant and nurturing work environment - Potential performance commissions & bonuses are available Email your resume to: hr @ joywaltzstudio.com We will contact you for an interview if you are shortlisted. (Only apply if you are able to commit to the time schedules above, able to commit for a year, and have relevant work experience.)",Competitive,20-11-2023
Globaleye Pte Ltd,"Chi tiết công việc Client Service Relationship Executive tại Globaleye Pte Ltd The Client Service Relationship Executive is responsible for providing high quality administrative support to the Wealth Managers while ensuring compliance with regulatory requirement and industry best practices. The Client Service Relationship Executive is required to: Ability to multitask, excellent organizational skills and the ability to work collaboratively with others. Display a high level of problem-solving skills, attention to detail, initiative, and organisational skills. Job Description Provide high quality administrative support to the Wealth Managers Implement business processes in a controlled and consistent manner in accordance with regulatory and company guidelines. Process and vet all new business application including but not limited to top up, trades and servicing request such as withdrawal, surrender, reinstatement change of details etc while ensuring compliance with regulatory and the company’s requirement to reduce risks and error Prepare servicing forms, such as payment forms, surrender and withdrawal forms, and dealing instructions for the Wealth Managers Follow up with Wealth Managers and relevant team member for any outstanding requirement for both new business and servicing promptly Maintain and update accurate record of client files. Maintain and update accurate client record in the CRM. Respond to client inquiries and reassigning them to the relevant team members promptly. Respond to administrative inquires such as account-related details, policy servicing from Wealth Manager or other members promptly. Coordinate with Wealth Managers and Wealth Structuring Consultants to ensure clients need are met and all transactions are processed accurately. Circulate relevant marketing materials or memorandums from financial providers to the relevant team members promptly Assist Compliance Manager to ensure all client interactions and transaction complies with regulatory requirements and to raise any high risk transactions promptly Prepare weekly/monthly/quarterly or yearly reporting in a timely manner. Provide data analysis and other information to Management to support decision making. To undertake such additional duties as required Job Description Tertiary education in business admin or equivalent Meticulous and detailed oriented Proficient with Microsoft Office – Outlook, Word, Excel and Powerpoint, Experience working in a financial advisory organisation will be an added advantage Strong team player with a positive attitude and a strong sense of responsibility Able to work independently Must be fully vaccinated for Covid",Client Service Relationship Executive,Singapore,"Chi tiết công việc Client Service Relationship Executive tại Globaleye Pte Ltd The Client Service Relationship Executive is responsible for providing high quality administrative support to the Wealth Managers while ensuring compliance with regulatory requirement and industry best practices. The Client Service Relationship Executive is required to: Ability to multitask, excellent organizational skills and the ability to work collaboratively with others. Display a high level of problem-solving skills, attention to detail, initiative, and organisational skills. Job Description Provide high quality administrative support to the Wealth Managers Implement business processes in a controlled and consistent manner in accordance with regulatory and company guidelines. Process and vet all new business application including but not limited to top up, trades and servicing request such as withdrawal, surrender, reinstatement change of details etc while ensuring compliance with regulatory and the company’s requirement to reduce risks and error Prepare servicing forms, such as payment forms, surrender and withdrawal forms, and dealing instructions for the Wealth Managers Follow up with Wealth Managers and relevant team member for any outstanding requirement for both new business and servicing promptly Maintain and update accurate record of client files. Maintain and update accurate client record in the CRM. Respond to client inquiries and reassigning them to the relevant team members promptly. Respond to administrative inquires such as account-related details, policy servicing from Wealth Manager or other members promptly. Coordinate with Wealth Managers and Wealth Structuring Consultants to ensure clients need are met and all transactions are processed accurately. Circulate relevant marketing materials or memorandums from financial providers to the relevant team members promptly Assist Compliance Manager to ensure all client interactions and transaction complies with regulatory requirements and to raise any high risk transactions promptly Prepare weekly/monthly/quarterly or yearly reporting in a timely manner. Provide data analysis and other information to Management to support decision making. To undertake such additional duties as required Job Description Tertiary education in business admin or equivalent Meticulous and detailed oriented Proficient with Microsoft Office – Outlook, Word, Excel and Powerpoint, Experience working in a financial advisory organisation will be an added advantage Strong team player with a positive attitude and a strong sense of responsibility Able to work independently Must be fully vaccinated for Covid","SGD3,5N-SGD4,5N",13-11-2023
Youyi Technology Pte Ltd,"Chi tiết công việc Program Coordinator tại Youyi Technology Pte Ltd Role The APAC Program Coordinator shall assist Program Managers on the day-to-day activities in executing the delivery of contractual obligations from contract award to full execution and support. Responsibilities The APAC Program Coordinator shall be responsible to:  Track the invoicing milestones for multiple Programs and work closely with local and global Finance teams  Assist in the procurement processes (e.g. RFQ, PR/PO, etc.)  Track the delivery and manage the logistics arrangement for equipment and software procurement for APAC, in close collaboration with local and global Procurement teams.  Perform Goods receipt for all the items received and services rendered by our vendors  Prepare program related documentations for execution, quality audits and certifications  Plan and facilitate events for presentation and demo to customers  Coordinate external and internal visits to client managed sites and premises  Maintain program repository for proper document storage and knowledge management",Program Coordinator,Singapore,"Chi tiết công việc Program Coordinator tại Youyi Technology Pte Ltd Role The APAC Program Coordinator shall assist Program Managers on the day-to-day activities in executing the delivery of contractual obligations from contract award to full execution and support. Responsibilities The APAC Program Coordinator shall be responsible to:  Track the invoicing milestones for multiple Programs and work closely with local and global Finance teams  Assist in the procurement processes (e.g. RFQ, PR/PO, etc.)  Track the delivery and manage the logistics arrangement for equipment and software procurement for APAC, in close collaboration with local and global Procurement teams.  Perform Goods receipt for all the items received and services rendered by our vendors  Prepare program related documentations for execution, quality audits and certifications  Plan and facilitate events for presentation and demo to customers  Coordinate external and internal visits to client managed sites and premises  Maintain program repository for proper document storage and knowledge management","SGD3N-SGD3,5N",28-11-2023
Rohde & Schwarz Regional Headquarters Singapore Pte Ltd,"Chi tiết công việc Digital Marketing Intern tại Rohde & Schwarz Regional Headquarters Singapore Pte Ltd Job Description: You will be supporting the regional marketing team in digital marketing, social media, and marketing operations. This is a 6 months internship commencing from January 2024/February 2024 to July 2024/August 2024. Work location at Changi Business Park. Responsibilities: Digital marketing and social media Processing marketing leads Marketing database cleansing, validation and maintenance Generate analytics reports for social ads and marketing activity Assist the team in producing marketing collateral and content such as digital banners, brochures, and infographics Marketing operations Keep up to date with competitor intelligence (activity, promos, etc.) Update content for communication to internal stakeholders Consolidate and publish regional marketing activity in APAC Support APAC Marketing Hub team members in their campaigns and projects Support the online and virtual local marketing events Requirements: Graduating students from the School of Business and Media, Arts & Media School Major in Marketing, Business or related fields Adobe Suite (Premier Pro for video-editing, InDesign / Illustrator for graphic design) skills preferred Good interpersonal and communication skills (i.e. oral and written) Proactive, self-motivated and willingness to learn",Digital Marketing Intern,Singapore,"Chi tiết công việc Digital Marketing Intern tại Rohde & Schwarz Regional Headquarters Singapore Pte Ltd Job Description: You will be supporting the regional marketing team in digital marketing, social media, and marketing operations. This is a 6 months internship commencing from January 2024/February 2024 to July 2024/August 2024. Work location at Changi Business Park. Responsibilities: Digital marketing and social media Processing marketing leads Marketing database cleansing, validation and maintenance Generate analytics reports for social ads and marketing activity Assist the team in producing marketing collateral and content such as digital banners, brochures, and infographics Marketing operations Keep up to date with competitor intelligence (activity, promos, etc.) Update content for communication to internal stakeholders Consolidate and publish regional marketing activity in APAC Support APAC Marketing Hub team members in their campaigns and projects Support the online and virtual local marketing events Requirements: Graduating students from the School of Business and Media, Arts & Media School Major in Marketing, Business or related fields Adobe Suite (Premier Pro for video-editing, InDesign / Illustrator for graphic design) skills preferred Good interpersonal and communication skills (i.e. oral and written) Proactive, self-motivated and willingness to learn",Competitive,21-11-2023
Rohde & Schwarz Regional Headquarters Singapore Pte Ltd,"Chi tiết công việc Order Processing Intern tại Rohde & Schwarz Regional Headquarters Singapore Pte Ltd Responsibilities: Raise order for service spare parts and follow-up on the delivery schedule, raise escalation when necessary Perform goods receipt of spare part purchases and issue them to Service Engineers Return, scrap, replenish and review of spare parts stock level regularly Place order for laboratory assets and consumables Liaise with Service and Calibration Engineers for any issue on spare parts / consumables order Filing and archiving of calibration documents, Purchase Order (PO), DN, etc Other ad-hoc assignments as assigned by the Supervisor Requirements: Diploma in Logistics / Supply Chain Management / Business Administration Proficient in Microsoft Office applications (MS Word, MS Excel) Good interpersonal and communication skills (oral and written) Exhibit independence as well as being a team player when required Self-motivated and well organized - able to time manage independently on multiple tasks This is a 6-month internship commencing from January 2024 - July 2024. Work location at Loyang Way.",Order Processing Intern,Singapore,"Chi tiết công việc Order Processing Intern tại Rohde & Schwarz Regional Headquarters Singapore Pte Ltd Responsibilities: Raise order for service spare parts and follow-up on the delivery schedule, raise escalation when necessary Perform goods receipt of spare part purchases and issue them to Service Engineers Return, scrap, replenish and review of spare parts stock level regularly Place order for laboratory assets and consumables Liaise with Service and Calibration Engineers for any issue on spare parts / consumables order Filing and archiving of calibration documents, Purchase Order (PO), DN, etc Other ad-hoc assignments as assigned by the Supervisor Requirements: Diploma in Logistics / Supply Chain Management / Business Administration Proficient in Microsoft Office applications (MS Word, MS Excel) Good interpersonal and communication skills (oral and written) Exhibit independence as well as being a team player when required Self-motivated and well organized - able to time manage independently on multiple tasks This is a 6-month internship commencing from January 2024 - July 2024. Work location at Loyang Way.",Competitive,21-11-2023
Recruit Express Pte Ltd,"Chi tiết công việc Human Resources Specialist & Assistant tại Recruit Express Pte Ltd What You’ll Do: • Manage end-to-end recruitment, from pre-screening candidates and managing referrals, to facilitating onboarding and exit interviews • Maintain recruitment pipelines and review existing sourcing solutions to ensure the merit-based selection of candidates • Work with business units to plan and execute corporate events and campaigns, as well as other ad-hoc projects How You’ll Grow: • Gain experience in a variety of corporate functions through interactions with representatives from different departments including payroll, e-advertising, claims and more • Learn to engage senior decision-makers with composure and tact as you meet with line managers across all levels to discuss their business needs What You’ll Need: • Minimum GCE 'A' Levels/ Diploma / Bachelor’s Degree in Business Administration, Arts and Social Sciences or equivalent from a recognised institution • A keen interest in getting to know new people and learn about different industries • Confidence to communicate with professionals across different managerial levels On-the-job training will be provided! We regret that only shortlisted candidates will be notified.",Human Resources Specialist & Assistant,Singapore,"Chi tiết công việc Human Resources Specialist & Assistant tại Recruit Express Pte Ltd What You’ll Do: • Manage end-to-end recruitment, from pre-screening candidates and managing referrals, to facilitating onboarding and exit interviews • Maintain recruitment pipelines and review existing sourcing solutions to ensure the merit-based selection of candidates • Work with business units to plan and execute corporate events and campaigns, as well as other ad-hoc projects How You’ll Grow: • Gain experience in a variety of corporate functions through interactions with representatives from different departments including payroll, e-advertising, claims and more • Learn to engage senior decision-makers with composure and tact as you meet with line managers across all levels to discuss their business needs What You’ll Need: • Minimum GCE 'A' Levels/ Diploma / Bachelor’s Degree in Business Administration, Arts and Social Sciences or equivalent from a recognised institution • A keen interest in getting to know new people and learn about different industries • Confidence to communicate with professionals across different managerial levels On-the-job training will be provided! We regret that only shortlisted candidates will be notified.","SGD1,8N-SGD2,5N",15-11-2023
