companyName,description,jobName,location,require,salary,timePost
Hypotenuse AI,"Chi tiết công việc Senior Software Engineer tại Hypotenuse AI About Us Hypotenuse AI is an AI content marketing platform that manages and automates content writing for companies, including product descriptions, advertising text, and blog posts. We're reshaping what takes weeks to do, and turning it into days. Our mission is to power the world's content creation—making it easy, relevant and personal. We’re building the state-of-the-art in machine learning, with an experienced team from FAANG/AI research and top startups, and are backed by top global investors such as Y Combinator. We have global ambitions and are expanding our team in Singapore. If you're looking for a fast-paced start-up with the opportunity to reshape an industry, come join us! Job Description Joining a fast growing start-up isn't like taking a 9 to 5 role in a big company — the impact, learnings and growth here are magnitudes higher, but so is the pace. In this role, you will: Build entirely new features, applications and designs, sometimes from scratch, while also scaling up our existing platforms — our tech stack includes {React, Typescript, Python, FastAPI, AWS...} Thread across frontend and backend, system architecture design, databases, algorithms & data science, and DevOps Balance speed and scale, while keeping in mind the sensibilities to create a high quality user experience Work extremely closely with the founding team and our customers (often cross functionally, and at times putting on a product manager hat) to iterate quickly and build new features. We move quickly and deploy frequently (every few days). We thrive on speed, coupled with a whole lot of new technology—no one comes in with all the answers, and that's ok. But it means that you need to have a constant hunger for learning and growing—very quickly. Here, your rate of growth matters a lot more than your credentials. Requirements We’re looking for people with a constant hunger. People who place learning, growth and impact at the center of their lives. People who obsess over their code; who can't stop thinking about solving challenging problems, and people who just won't give up. Not all these are strict requirements, but experience and a strong foundation will help a long way: At least 4+ years of software engineering experience or equivalent You've designed and built backend architectures (i.e. experience with AWS or GCP, designing APIs, components, databases etc..) You're familiar with software engineering best practices — testing, deployments, agile & sprints, OOP etc.. — and have worked with large codebases before Understanding of algorithms/data structures and computer science fundamentals Experience with web frameworks — both on the client-side (e.g. React, Angular, Vue, ..) and server side (e.g. Flask / FastAPI / Django) Strong written and verbal communication skills High adaptability, strong problem-solving skills and ability to handle ambiguity UX design sensibility and a drive to build great products for users Note: only open to candidates in Singapore or willing to relocate.",Senior Software Engineer,Singapore,"Chi tiết công việc Senior Software Engineer tại Hypotenuse AI About Us Hypotenuse AI is an AI content marketing platform that manages and automates content writing for companies, including product descriptions, advertising text, and blog posts. We're reshaping what takes weeks to do, and turning it into days. Our mission is to power the world's content creation—making it easy, relevant and personal. We’re building the state-of-the-art in machine learning, with an experienced team from FAANG/AI research and top startups, and are backed by top global investors such as Y Combinator. We have global ambitions and are expanding our team in Singapore. If you're looking for a fast-paced start-up with the opportunity to reshape an industry, come join us! Job Description Joining a fast growing start-up isn't like taking a 9 to 5 role in a big company — the impact, learnings and growth here are magnitudes higher, but so is the pace. In this role, you will: Build entirely new features, applications and designs, sometimes from scratch, while also scaling up our existing platforms — our tech stack includes {React, Typescript, Python, FastAPI, AWS...} Thread across frontend and backend, system architecture design, databases, algorithms & data science, and DevOps Balance speed and scale, while keeping in mind the sensibilities to create a high quality user experience Work extremely closely with the founding team and our customers (often cross functionally, and at times putting on a product manager hat) to iterate quickly and build new features. We move quickly and deploy frequently (every few days). We thrive on speed, coupled with a whole lot of new technology—no one comes in with all the answers, and that's ok. But it means that you need to have a constant hunger for learning and growing—very quickly. Here, your rate of growth matters a lot more than your credentials. Requirements We’re looking for people with a constant hunger. People who place learning, growth and impact at the center of their lives. People who obsess over their code; who can't stop thinking about solving challenging problems, and people who just won't give up. Not all these are strict requirements, but experience and a strong foundation will help a long way: At least 4+ years of software engineering experience or equivalent You've designed and built backend architectures (i.e. experience with AWS or GCP, designing APIs, components, databases etc..) You're familiar with software engineering best practices — testing, deployments, agile & sprints, OOP etc.. — and have worked with large codebases before Understanding of algorithms/data structures and computer science fundamentals Experience with web frameworks — both on the client-side (e.g. React, Angular, Vue, ..) and server side (e.g. Flask / FastAPI / Django) Strong written and verbal communication skills High adaptability, strong problem-solving skills and ability to handle ambiguity UX design sensibility and a drive to build great products for users Note: only open to candidates in Singapore or willing to relocate.",Competitive,11-11-2023
Transcelestial Technologies,"Chi tiết công việc Senior Manufacturing Software Engineer tại Transcelestial Technologies Transcelestial’s vision is to improve the connectivity experience for the next billion people. We believe that connectivity is a human right and Transcelestial is on a mission to solve the problem of internet distribution and provide affordable, high-speed internet to everyone. Transcelestial’s next-generation wireless laser communication technology is one of the most effective solutions in the distribution of high-quality, high-speed internet connectivity, making it well-poised to solve civilization’s long-term communication needs - and ultimately improve connectivity for 1 billion users globally. Highly reliable and secure, its light-weight, shoe-box sized CENTAURI device leverages its proprietary laser technology to create a wireless distribution network and can be quickly, easily and cost-effectively installed on any standard telecom pole or tower at a faster time-to-market than standard fiber-optic cable. Over the longer-term, Transcelestial aims to develop a constellation of small satellites positioned in Low Earth Orbit, allowing their laser network to not only beam across cities but upwards to connect continents across the world too. OUR VALUES Lean & Simple. Our products are simple to use, we focus on what matters, we solve issues one by one and we spend smart. Approachable. Whoever you are, wherever you come from, don’t be shy! The best ideas can come from anywhere in the organisation. Supportive. We are a bunch of smart individuals delivering at their best working in teams. If you face an issue, you can be sure someone will jump in and help you. End user obsessed. Customers and end users are at the core of everything we do. Relentless innovators. Our technology is at the forefront of innovation. We are curious, we question everything, we love research and are passionate about the next big thing. Join our team if you want to define the rules of how our civilisation communicates! Senior Manufacturing Software Engineer The Software Team is responsible for working across the technology stack to develop and maintain the software architecture of Transcelestial’s products. This position reports to the Head of Software Engineering and takes ownership of software elements running on the manufacturing line. As Senior Manufacturing Software Engineer, you will: Implement new features and maintain existing software with a focus on quality and automation Interface with the hardware, mechanical, optics, electronics and software R&D teams to co-ordinate the validation and commissioning of new manufacturing software Drive the improvement of manufacturing software based on user input, feedback, and data analytics Respond to urgent manufacturing issues in a timely manner Improve manufacturing data collection for better analytics Create test documentation and build software prototypes Prepare reports of results and conclusions for management What you will bring: Degree in Computer Science, Electrical Engineering or equivalent work experience in the field Work Experience: 5+ years in technical programming roles It is a bonus if you have: Strong problem-solving and debugging skills, especially in unfamiliar and time-sensitive situations with limited resources. Solid working knowledge of Git and Linux (Debian). Proficiency in programming in Go. Strong ability to make engineering trade-offs and assess risks with respect to business objectives. Strong verbal, written communication, and presentation skills (ability to communicate ideas and designs to your peers). Ability to thrive working with a team of people from different backgrounds in a highly collaborative, time sensitive environment. Demonstrated past experience working with the command line. Good working knowledge of the integration of test platforms and industrial automation. Prior experience developing tests (unit tests, integration tests, etc.) and/or working with hardware testing. Prior experience working with Docker. Prior experience working with REST or gRPC APIs. Prior experience working databases including NoSQL and/or RDBMS. Prior exposure building web UIs (React). Our Hiring Process and what to expect: 30-60 min video call with one of our Talent Acquisition Partners, so we can get to know each other better 60 min video/in-person interview with the Hiring Manager of the role, so you can understand the role, the team, your future manager better 60min in-person Team Fit interviews with at least 2 members of the Software team to get to know your future team mates. 60 min video/in-person interview with CTO to understand overall company objectives and business trajectory. What’s in it for you: Being part of a high-performing team working on groundbreaking technology A competitive salary and stock options package Personal Macbook laptop Unlimited Annual Leave Comprehensive and top-tier health plans Daily lunch allowance in office A monthly “Nerd” fund for professional development Join Us: You should include in your application Your CV, and/or LinkedIn page Links to projects or other work which will definitely impress everyone Thank you for your interest in joining Transcelestial. We cannot wait to meet you! Transcelestial has won numerous industry and global awards including the SPIFFY San Andreas Award for Most Disruptive Technology by Telecom Council, Forbes 30 Under 30 and Prestige 40 under 40 for our CTO Dr. Mohammad Danesh, Edge 35 Under 35 to our CEO Rohit Jha, The Most Ambitious Start-Up in Photonics Award by The Optical Society (OSA), etc. Founded in Dec 2016, the Transcelestial team is located in Singapore and is backed by major investors such as Wavemaker Partners, EDBI, Airbus Ventures, Kickstart Ventures, Cap Vista, SEEDS Capital (Enterprise SG), Entrepreneur First, Partech Ventures, 500 Startups, AirTree Ventures, Tekton Ventures, SGInnovate, SparkLabs Global Ventures, Michael Seibel (CEO of Y-Combinator, Founder of Twitch.tv), Charles Songhurst (Microsoft’s former Head of Corporate Strategy) and others.",Senior Manufacturing Software Engineer,Singapore,"Chi tiết công việc Senior Manufacturing Software Engineer tại Transcelestial Technologies Transcelestial’s vision is to improve the connectivity experience for the next billion people. We believe that connectivity is a human right and Transcelestial is on a mission to solve the problem of internet distribution and provide affordable, high-speed internet to everyone. Transcelestial’s next-generation wireless laser communication technology is one of the most effective solutions in the distribution of high-quality, high-speed internet connectivity, making it well-poised to solve civilization’s long-term communication needs - and ultimately improve connectivity for 1 billion users globally. Highly reliable and secure, its light-weight, shoe-box sized CENTAURI device leverages its proprietary laser technology to create a wireless distribution network and can be quickly, easily and cost-effectively installed on any standard telecom pole or tower at a faster time-to-market than standard fiber-optic cable. Over the longer-term, Transcelestial aims to develop a constellation of small satellites positioned in Low Earth Orbit, allowing their laser network to not only beam across cities but upwards to connect continents across the world too. OUR VALUES Lean & Simple. Our products are simple to use, we focus on what matters, we solve issues one by one and we spend smart. Approachable. Whoever you are, wherever you come from, don’t be shy! The best ideas can come from anywhere in the organisation. Supportive. We are a bunch of smart individuals delivering at their best working in teams. If you face an issue, you can be sure someone will jump in and help you. End user obsessed. Customers and end users are at the core of everything we do. Relentless innovators. Our technology is at the forefront of innovation. We are curious, we question everything, we love research and are passionate about the next big thing. Join our team if you want to define the rules of how our civilisation communicates! Senior Manufacturing Software Engineer The Software Team is responsible for working across the technology stack to develop and maintain the software architecture of Transcelestial’s products. This position reports to the Head of Software Engineering and takes ownership of software elements running on the manufacturing line. As Senior Manufacturing Software Engineer, you will: Implement new features and maintain existing software with a focus on quality and automation Interface with the hardware, mechanical, optics, electronics and software R&D teams to co-ordinate the validation and commissioning of new manufacturing software Drive the improvement of manufacturing software based on user input, feedback, and data analytics Respond to urgent manufacturing issues in a timely manner Improve manufacturing data collection for better analytics Create test documentation and build software prototypes Prepare reports of results and conclusions for management What you will bring: Degree in Computer Science, Electrical Engineering or equivalent work experience in the field Work Experience: 5+ years in technical programming roles It is a bonus if you have: Strong problem-solving and debugging skills, especially in unfamiliar and time-sensitive situations with limited resources. Solid working knowledge of Git and Linux (Debian). Proficiency in programming in Go. Strong ability to make engineering trade-offs and assess risks with respect to business objectives. Strong verbal, written communication, and presentation skills (ability to communicate ideas and designs to your peers). Ability to thrive working with a team of people from different backgrounds in a highly collaborative, time sensitive environment. Demonstrated past experience working with the command line. Good working knowledge of the integration of test platforms and industrial automation. Prior experience developing tests (unit tests, integration tests, etc.) and/or working with hardware testing. Prior experience working with Docker. Prior experience working with REST or gRPC APIs. Prior experience working databases including NoSQL and/or RDBMS. Prior exposure building web UIs (React). Our Hiring Process and what to expect: 30-60 min video call with one of our Talent Acquisition Partners, so we can get to know each other better 60 min video/in-person interview with the Hiring Manager of the role, so you can understand the role, the team, your future manager better 60min in-person Team Fit interviews with at least 2 members of the Software team to get to know your future team mates. 60 min video/in-person interview with CTO to understand overall company objectives and business trajectory. What’s in it for you: Being part of a high-performing team working on groundbreaking technology A competitive salary and stock options package Personal Macbook laptop Unlimited Annual Leave Comprehensive and top-tier health plans Daily lunch allowance in office A monthly “Nerd” fund for professional development Join Us: You should include in your application Your CV, and/or LinkedIn page Links to projects or other work which will definitely impress everyone Thank you for your interest in joining Transcelestial. We cannot wait to meet you! Transcelestial has won numerous industry and global awards including the SPIFFY San Andreas Award for Most Disruptive Technology by Telecom Council, Forbes 30 Under 30 and Prestige 40 under 40 for our CTO Dr. Mohammad Danesh, Edge 35 Under 35 to our CEO Rohit Jha, The Most Ambitious Start-Up in Photonics Award by The Optical Society (OSA), etc. Founded in Dec 2016, the Transcelestial team is located in Singapore and is backed by major investors such as Wavemaker Partners, EDBI, Airbus Ventures, Kickstart Ventures, Cap Vista, SEEDS Capital (Enterprise SG), Entrepreneur First, Partech Ventures, 500 Startups, AirTree Ventures, Tekton Ventures, SGInnovate, SparkLabs Global Ventures, Michael Seibel (CEO of Y-Combinator, Founder of Twitch.tv), Charles Songhurst (Microsoft’s former Head of Corporate Strategy) and others.",Competitive,07-12-2023
Assemblyclan,"Chi tiết công việc Videographer and Video Editor tại Assemblyclan Assemblyclan is a creative agency in Singapore specializing in content production and influencer marketing. Founded by Walter Tan, the agency is well-established with its works well-known for fashion, beauty, luxury and celebrities clientele. Some of Assemblyclan’s celebrity clientele includes Desmond Tan, Carrie Wong, Rui En, Jeanette Aw. The wide portfolio has gained Assemblyclan the trust of many international brands such as Louis Vuitton, Dior Beauty, Sephora, amongst many others. Some of the regional and global campaigns includes: Dior Addict Stellar Shine launch in Seoul with the presence of Cara Delevingne and many other international celebrities Paris and Milan Fashion Week 2023 with Desmond Tan Dior Riviera Summer Party with Cha Eun Woo at Tanjong Beach Club Dior Christmas Masterpiece Light-up at Ion Orchard Burberry Monogram Takeover with Bright, Winmetawin JD International Women’s Day 2021 for Singapore, Malaysia and Thailand. We are looking for diverse, passionate people who display a high level of taste for fashion, art, design and culture writ large. Candidates should display excellence and passion in their portfolio with a strong work ethic and ambition to work with multiple disciplines. Creative transitions, bold ideas, inspiring narratives; if you have it, we want you. Duties: Produce digital content - from ideation to storyboarding to production to post/editing Run a digital content shoot Create engaging video content for themed campaigns across digital and retail platforms for fashion, lifestyle and beauty brands Follow through video projects from pre to post production including prop sourcing, casting, location scouting, storyboarding, filming and video editing General office tasks (ie. filing, database, paperwork, take meeting notes, running errands, etc.) Assist in research and development for creative shoots Qualifications: Open to Polytechnic, Design Schools and University Students with film or communications or marketing background Adobe Premiere Pro, Adobe Photoshop, After Effects (Bonus) Want to work in production or produce content Creative and innovative with a passion for creating commercial and beautiful imagery Must have social media profiles on Instagram and Tiktok Have an understanding of video platforms like Youtube, Twitter, Facebook, Instagram, etc. Proficient in basic filming Working knowledge of MS Word, Xcel, Powerpoint (or their equivalent) Ability to work quickly and deliver on time - great at multi-tasking Solid problem-solving abilities; detail-oriented and resourceful Strong interest in beauty and fashion retail business Ability to work collaboratively as well as independently Sense of fun both at work and in your work - an eye for the arresting photo, the clever placement and the memorable image Photography is a bonus *3 months probation. Internships available.",Videographer and Video Editor,Singapore,"Chi tiết công việc Videographer and Video Editor tại Assemblyclan Assemblyclan is a creative agency in Singapore specializing in content production and influencer marketing. Founded by Walter Tan, the agency is well-established with its works well-known for fashion, beauty, luxury and celebrities clientele. Some of Assemblyclan’s celebrity clientele includes Desmond Tan, Carrie Wong, Rui En, Jeanette Aw. The wide portfolio has gained Assemblyclan the trust of many international brands such as Louis Vuitton, Dior Beauty, Sephora, amongst many others. Some of the regional and global campaigns includes: Dior Addict Stellar Shine launch in Seoul with the presence of Cara Delevingne and many other international celebrities Paris and Milan Fashion Week 2023 with Desmond Tan Dior Riviera Summer Party with Cha Eun Woo at Tanjong Beach Club Dior Christmas Masterpiece Light-up at Ion Orchard Burberry Monogram Takeover with Bright, Winmetawin JD International Women’s Day 2021 for Singapore, Malaysia and Thailand. We are looking for diverse, passionate people who display a high level of taste for fashion, art, design and culture writ large. Candidates should display excellence and passion in their portfolio with a strong work ethic and ambition to work with multiple disciplines. Creative transitions, bold ideas, inspiring narratives; if you have it, we want you. Duties: Produce digital content - from ideation to storyboarding to production to post/editing Run a digital content shoot Create engaging video content for themed campaigns across digital and retail platforms for fashion, lifestyle and beauty brands Follow through video projects from pre to post production including prop sourcing, casting, location scouting, storyboarding, filming and video editing General office tasks (ie. filing, database, paperwork, take meeting notes, running errands, etc.) Assist in research and development for creative shoots Qualifications: Open to Polytechnic, Design Schools and University Students with film or communications or marketing background Adobe Premiere Pro, Adobe Photoshop, After Effects (Bonus) Want to work in production or produce content Creative and innovative with a passion for creating commercial and beautiful imagery Must have social media profiles on Instagram and Tiktok Have an understanding of video platforms like Youtube, Twitter, Facebook, Instagram, etc. Proficient in basic filming Working knowledge of MS Word, Xcel, Powerpoint (or their equivalent) Ability to work quickly and deliver on time - great at multi-tasking Solid problem-solving abilities; detail-oriented and resourceful Strong interest in beauty and fashion retail business Ability to work collaboratively as well as independently Sense of fun both at work and in your work - an eye for the arresting photo, the clever placement and the memorable image Photography is a bonus *3 months probation. Internships available.","SGD3,8N-SGD4,2N",14-11-2023
