companyName,description,jobName,location,require,salary,timePost
Coca-Cola Beverages Vietnam,"Mô tả Công việc 1) Job summary: - Take a leading role in the development CDE activities, ensure compliance with CDE policy, continuous improvement for operational processes; and implement. - Prepare the reports, executive summaries and insights on CDE strategic; and present the recommendations to management and other stakeholders. - Implementing an effective Internal verification and third-party audit Program for CDE assets. - Planning Capex/Opex for CDE and deploy in market. 2) Responsibilities - Control process and cross check with regions to ensure all Cold Drink Operation follow CDE policy - Provide specific plans and action to improve CDE productivity - Routine reporting and tracking CDE verification - Cooperate with Finance to do 3rd party audit asset - Planning for CDE placement - Presentation. - Provide accurate data with specific action plans to Sales team, guidance and progress tracking until goal completion. - Review weekly/monthly/quarterly and update progress for CDE deployment in market vs planning. - Tracking CDE productivity monthly - Monthly & quarterly review Budget with commercial and Finance","Strategy Specialist - Cold Drink (Background in Finance, Planning, Data Analytics are preferred) (Mới)",Hồ Chí Minh,"Yêu Cầu Công Việc 2 years of experience University/ Bachelor’s Degree Financial & planning background Good on Microsoft offices: word, especial excel, presentation. Proven experience as same role Organized with the ability to prioritize and multi-task. ***Please note that by submitting an application to us, you consent to our processing of personal data about you that is provided by you and otherwise lawfully collected by us (which may include sensitive data) for our company's recruitment purpose. Where you provide us personal data of others, you further undertake that we are permitted to receive and process such data for the purpose for which you provided it. You may send your queries or request for support concerning our personal data processing activities to hrvn(at)coca-cola.com.vn. To better understand our personal data processing practices, please visit www.swirecocacola.com/en/Others/Privacy-Policies.html to the full Privacy Policy of Coca-Cola Beverages Viet Nam Limited.",Lương: Cạnh tranh,11-12-2023
Huhtamaki (Vietnam) Ltd.,"Mô tả Công việc Role Description We are seeking a full-time the Management Accounting Supervisor to join our team in VSIP1, Thuan An, Binh Duong province (shuttle bus to Binh Duong). In this role, you will be responsible for managing financial accounts and analyzing accounting records to ensure compliance with Huhtamaki's accounting policies and procedures. You will also prepare financial reports and provide guidance to the management team on finance-related matters: Be responsible for monthly reporting activities. Processes and analyzes various monthly reporting information in close contact with the business group and its units. Participates in Group statutory reporting tasks during monthly/quarterly/year-end closings. To focus on controlling the production data. Besides, this position also has to supervise monthly actual cost calculation, prepare the management reports, verify the saving projects, and control inventory. To execute all supporting activities of job requirements toward “safely producing the high-quality products and complying with legal requirements”.",Management Accounting Supervisor,Bình Dương,"Yêu Cầu Công Việc Bachelor's or Master's degree in Finance, Accounting or related field Progressive experience in finance, accounting Proficiency in Microsoft Office, particularly Excel Good experience in costing, data analysis, data processing Excellent communication and interpersonal skills Result-oriented mind with excellent teamwork and organizational abilities Experience with the accounting systems and procedures of a large organization preferred (Dynamic Axapta preferred)",Lương: Cạnh tranh,06-12-2023
Carlsberg Group,"Mô tả Công việc A. Warehouse management: 1. Finish goods and empty crate return: Checking quanlity outbound right with invoice Supervise loading and unloading at warehouse Daily warehouse report about of capacity and control warehouse capacity, FIFO compliance (opening stock – ending stock - goods on the way, DOD, Block/hold…) Daily report of actual stock/inventory count vs NAV Input date empty crate return in Nav Internal transfer empty crate . 2. Provide outbound documents / Receive the documents inbound to submit to Finance: Print Delivery note and e-invoce follow to Delivery truck Receive inbound documents right truck/ right trip/ right vendor Reconcine detail the goods in the system and invoice, DN and actual receipted. Follow and feedback the information to Planning/ Procurement team as P1 processing Save all docs, invoice, GRN send to Finance team 1 time/week Need confirmed by sign or email confirm about quantity from MKT team Follow good will be hold/ block and transaction in Nav 3. Oversee the warehouse’s storage & other relevant tasks Checking temperature, humidity as request in line with COM Stock count daily/ monthly report,… H&S report, Gemba report,… Store Goods delivery Note for audit up to 5 years Contract and annex updated of warehouse and transport/distribution cost in line with new service and fluctuated diesel price 4. Supporting POSM/ Fix asset, equipment of Draught beer (when required): Get receipt note for inbound PON from vendor Support checking oundbound goods right qunlity/ right item Input data inbound/ outbound POSSM in Nav Make TOD internal transfer goods/ Follow oundboud POSM, fix asset as required from MKT team B. Distribution management Carry out and monitor the vehicles to ensure that the orders are delivered in accordance with centralized requirements for GT & MT Make daily/weekly/monthly DELIVERY reports: Unloading photos at DC Delivery report (POD) from Da Nang to the south Order report & Tracking transfer Customer service evaluation Order volume/transport capacity of shipping companies Vehicle safety HSE and daily Gemba walk reports",Logistics Officer ( Da Nang city ),Đà Nẵng,"Yêu Cầu Công Việc Bachelor in economy ( or supply chain relevant major) 1-2 years logistics experience not least in warehouse management Working time : 48h/week ( Monday - Saturday); administrative shift (8AM - 5PM) and 2nd shift (2PM - 10 PM ) alternating versions Microsoft skill sufficicency Honest, accurate in data processing and reports Working independently and under pressure;",Lương: Cạnh tranh,13-11-2023
Công Ty Cổ Phần VNG,"Mô tả Công việc Thiết kế, phát triển và biểu diễn các báo cáo doanh thu theo yêu cầu từ các phòng ban dựa trên nhiều các nguồn data và master data có sẵn hoặc tự thiết kế riêng theo yêu cầu. Thực hiện theo dõi, đối soát và phân tích dữ liệu để đảm bảo chất lượng báo cáo doanh thu. Đảm bảo việc vận hành, điều chỉnh và phát triển các tính năng mới theo đúng thời gian yêu cầu ban đầu.","Associate Software Engineer (Oracle, SQL)",Hồ Chí Minh,"Yêu Cầu Công Việc ﻿Bằng cử nhân về khoa học máy tính, hệ thống thông tin hay một ngành kỹ thuật liên quan Có ít nhất 1-2 năm kinh nghiệm làm việc với các hệ cơ sở dữ liệu Postgres/Oracle/Hive với vai trò Database Developer / Data Engineer Thành thạo ngôn ngữ lập trình: SQL và Python ﻿Yêu thích làm việc với số liệu một cách tỉ mỉ, cẩn thận",Lương: Cạnh tranh,09-12-2023
CHI NHÁNH CÔNG TY TNHH TRANSCOSMOS VIỆT NAM TẠI THÀNH PHỐ HỒ CHÍ MINH,"Mô tả Công việc This is a full-time on-site role as a Business Intelligence Analyst, located in Ho Chi Minh City, Vietnam. The Business Intelligence Analyst will be responsible for day-to-day tasks such as data modeling, dashboard creation, utilizing business intelligence tools, business analysis, and related tasks. Developing and managing Business Intelligence solutions for the organization. Work with cross-functional partners for the purpose of collecting data and executing the company’s mission. Translate business requirements into specifications that will be used to drive data store/ data warehouse/ data mart design and configuration. Developing visual reports, KPI scorecards, and dashboards using Power BI to review operational efficiencies and drive decisioning quality throughout business and other partner departments. Capable of implementing row-level security on data along with an understanding of application security layer models in Power BI. Should have an edge over making DAX queries in Power BI desktop. Expert in using advanced-level calculations on the data set. Transition developed BI systems to the Operations & Support team. Creating and maintaining documentation that includes the design, requirements, and user manuals for the organization. Identifying the development needs for the purpose of streamlining and improving the operations of the organization for efficiency and profitability. Ad-hoc Reporting Data Analysis duties or other responsibilities when required.",Business Intelligence Analyst,Hồ Chí Minh,"Yêu Cầu Công Việc At least 4 years of experience as a Business Intelligence Analyst or similar role, with a focus on Power BI. Proficiency in creating complex data models, reports, and dashboards using Power BI Desktop and Power BI Service. Strong understanding of data visualization best practices and the ability to transform complex data into visually compelling insights. Experience with DAX (Data Analysis Expressions) for creating calculated columns, measures, and calculated tables. Solid knowledge of SQL for querying and manipulating data from relational databases. Familiarity with data integration and ETL processes, including data cleansing and transformation. Excellent analytical and problem-solving skills with the ability to interpret data and provide actionable insights. Effective communication skills to interact with both technical and non-technical stakeholders. Demonstrated ability to work independently and collaboratively in a fast-paced environment. Good at English (both oral and written). Good teamwork spirit and logical thinking. Proactive, well self-organized and responsible in work. Any relevant certifications, such as Microsoft Certified: Data Analyst Associate, would be a plus.",Lương: 25 Tr - 30 Tr VND,06-12-2023
Ngân Hàng TMCP Việt Nam Thịnh Vượng - VPBANK,"Mô tả Công việc Vietnam Prosperity Commercial Joint Stock Bank (VPBank) is one of the leading banks in applying big data analysis and statistical modeling in decision making, business operations, and capital calculation. The Bank is currently looking for candidates for the position of Credit Risk Model Validation Intern/Contractor/Junior/Senior, working at Head Office (89 Lang Ha). Job Description Performing validation for models of the whole VPBank’s ecosystem: 1. Developing Model Validation Framework and relevant internal policies and guidance, model validation methodology documentations covering qualitative and quantitative approaches. Performing overall model validation as an independent model validator, for models including but not limited to: Credit risk models for customer scoring, debt collection, fraud detection, and compliance with international standards such as Basel II (for AIRB and FIRB) and IFRS9. Liquidity risk models owned by the Bank’s Risk Management Division serving the following purposes: business decisions, management, liquidity reporting and compliance with international standards. Market risks and Counterparty risk models of the Risk Management Division. Other risk models and business models of VPBank or of member companies of VPBank (FE Credit, OPES, …), following the Board of Management or the Chief Risk Officer’s inquiries. 2. Identifying reasons, factors impacting models (if any) and proposing proper recommendations to address the issues. 3. Performing Model Risk Management, periodically assessing and reporting model risk exposures, while simultaneously developing procedures, tools and IT infrastructure system essential for monitoring, supervision and assessment of impacts of model risk Research & Study Developing challenge models against current models. Researching state-of-the-art techniques in model development (Machine Learning, AI …) to apply in models in banks.",CV/CVC Quản Trị Và Kiểm Định Mô Hình - Phòng QTRR Tích Hợp - Hà Nội - TA107,Hà Nội,"Yêu Cầu Công Việc Job Requirement Qualifications Bachelor’s degree or higher. Strong background in mathematics, quantitative finance, banking. Knowledge in data science, data analysis is an advantage. Ability to research new model development methodologies. Bachelor or master’s degree in these fields in developed countries is an advantage. National or international prizes in natural science, model development or data mining is an advantage. Internationally recognized certificate of financial analysis, financial risk management, data analysis, data science (FRM, CFA, CPA …) is an advantage. Experience Prioritize candidates having experiences in banking and finance field, risk management, credit risk model development, credit portfolio analysis, data science. Competence Logical thinking. Self-study, good research skills. Ability to synthesize and analyze. Ability to communicate and work in English. Ability to work independently and work in team. High responsibility in work. Be careful and meticulous in work. Skills Proficiency in Microsoft Office: Presentation Making (Power Point), Professional Documentation (Word). Prioritize candidates have ability to use programming software such as VBA, SQL, SAS, Python, R, or other statistics tools. Good communication skills. WHAT WE OFFER: Attractive income, competitive salary and bonus according to ability (16-18 month package) Bonus on Holidays and New Year (according to banking policy from time to time) Get preferential loans according to the bank's policy from time to time Attractive leave mode according to job rank (12-18 paid leaves/year) Compulsory insurance according to labor law & VPBank care insurance for employees depending on rank and working time Participate in training courses depending on the Training Framework for each position Working time: Monday - Friday & Saturday morning (two Saturday mornings/month off) Dynamic, friendly working environment with many opportunities for training, learning and development; participate in many interesting cultural activities (sports event, talents, teambuilding activities...)",Lương: Cạnh tranh,03-12-2023
Ngân Hàng TMCP Việt Nam Thịnh Vượng - VPBANK,"Mô tả Công việc Our vision is to transform VPB into a data led organization by providing the data platform and data products to provide ability to consistently analyze, report and query information to make timely decisions using standardized Enterprise Data & Analytics applications capabilities; enable data and analytics driven culture at VPB through stable and flexible architecture that supports sourcing of structured, semi-structured and unstructured data & tools; meet future regulatory, strategic and operational data management requirements by enhancing the current data management capabilities not just at the enterprise level, but across our ecosystem. The position purpose is to drive the enterprise data governance, quality framework and policy group-wide across ecosystem subsidiaries and drive best practices on the responsible use of data, analytics and AI group-wide. Key accountabilities: Develop KPI and see through its completion and enhance operational efficiency of Integrated governance Work directly with the Head, Ecosystem center and Head Data Governance department to give direction for managing data governance across VPBank ecosystem Review & assess data governance status across VPBank ecosystem Propose optimization measures and enhancement to data governance and operating model across VPBank ecosystem Promulgate the enterprise data governance and quality framework and policy group-wide across ecosystem subsidiaries. Drive best practices on the responsible use of data, analytics and AI group-wide. Support Group CDO in developing ecosystem data strategy and serve as the coordinating partner Develop and train cross domain data professionals",Head of Intergrated Data Governance Department - Hà Nội - TA003,Hà Nội,"Yêu Cầu Công Việc Bachelor or higher degrees in math, information technology, business management, finance and banking 8-10 years of experiences in banking & finance/technology institution Experiences in data platforms (DWH, DIH, Data lake,…), sources systems Data governance & Data quality improvement Knowledge of finance and banking business, Core banking system, Data zones Data Governance & Data quality, Data profiling, Data mining Logical thinking Self-learning capability Working under pressure Making himself/ herself example at work and inspiring staff with attitudes and values of work Guide and provide vision for staff to develop skills at work and self-development Excellent written and verbal communication skills Excellent organizing & management skills Fluent in English WHAT WE OFFER: Attractive income, competitive salary and bonus according to ability (16-18 month package) Bonus on Holidays and New Year (according to banking policy from time to time) Get preferential loans according to the bank's policy from time to time Attractive leave mode according to job rank (12-18 paid leaves/year) Compulsory insurance according to labor law & VPBank care insurance for employees depending on rank and working time Participate in training courses depending on the Training Framework for each position Working time: Monday - Friday & Saturday morning (two Saturday mornings/month off) Dynamic, friendly working environment with many opportunities for training, learning and development; participate in many interesting cultural activities (sports event, talents, teambuilding activities...)",Lương: Cạnh tranh,10-12-2023
Techtronic Industries Vietnam (TTI),"Mô tả Công việc Solution design and solution architecting ▪ Conduct requirement study and suggest feasible technical solution alternatives ▪ Designing the technical solution alternatives ▪ Defining the architecture of the software solution and integration ▪ Develop solutions for continuous improvement projects Project management and execution ▪ Work with group IT Enterprise Application team to Design, Develop, Test and Implement system configuration or software development in compliance with Oracle standards (EBS and Database). ▪ Working with business users to develop the use cases, test data and test scenarios to validate the software solutions ▪ Build solutions that conform to ERP standards of data definition, data usage and data validation rules. ▪ Working with other IT members to develop the system procedure to map to ERP standard system flow ▪ Prepare project documentation with quality requirements ▪ Develop integration solutions that ensure the data integrity between the ERP & other systems",IT – Application Assisstant Manager (Oracle EBS),Hồ Chí Minh,"Yêu Cầu Công Việc II. Requirements: General Qualification ▪ Good communication skill and good teamwork spirit ▪ Good problem-solving skill and systematic mindset ▪ Solid working experience of enterprise applications including ERP / Supply Chain / systems integration ▪ Eager to learn and proactive thinking ▪ Willing to work under pressure and commit to assigned tasks. ▪ People live in Binh Duong Province is preferred Experience Qualifications: ▪ Degree in IT or related discipline required ▪ Over 5 years of IT experience in supporting ERP applications, especially experience in cross functional implementation. ▪ Minimum 3 years of Oracle ERP technical working experience. ▪ Strong hands on experience with Oracle functions, procedures, triggers, package and performance tuning ▪ Any other programming skills is advantage - Java, BI tools or any popular IT tools. ▪ Less working experience but having solid Oracle ERP experience would be considered as Senior Application Analyst III. Benefits: - Competitive income 13th month salary and bonus (if any). - 15 annual leaves. - Healthcare for individual - Mobile phone allowance. Working time & location: - Factories in District 9, HCM City - Mon to Fri., from 07h:30 – 16h:00",Lương: Cạnh tranh,11-12-2023
Coca-Cola,"Mô tả Công việc JOB SUMMARY Identify the needs/requirements for Human Resource Department through IT/digital innovation solution to prepare for Coca-Cola Vietnam 2020 Digital Roadmap. Implement successfully assigned Digital Transformation projects to Human Function organizations in order to meet Innovation Strategy of the company. Act as an effective change agent utilizing proper stakeholder analysis and change techniques to influence Human Resources Function team to implement business process changes and business transformation initiatives successfully DESCRIPTION 1. Digital Business Transformation Planning for HR Department •Develop and drive the HR department’s overall digital transformation strategy and roadmap •Review existing internal business processes and identify areas of improvement •Mobilise resource to support the implementation plan 2. Digital Operational Execution •Manage multi-Digital Human Resources Function related projects and initiatives across countries and functions successfully deployed as planned •Communicate across key stakeholders and monitor execution progress to ensure delivery against business transformation objectives •Collaborate, influence and partner with Function to make sure transformation agenda executed to create the value 3. System Integration •Oversee and monitor services used in application integrations •Design integration solutions and document the design in accordance with best practices •Work with vendors teams to architect, design, build, and implement application integrations •Support vendors on resolving system defects, acting as liaison, and developing solutions •Provide assistant to troubleshoot and resolve integration errors 4. Business Process Improvement •Perform root cause analysis, identify and define areas for improvement of business processes across all functions •Grasp the business needs and issues, continuously evaluate the current process to identify the gap •Propose and drive solution to minimize complexities, optimise and improve business needed for creating value 5. Change •Identify key stakeholders across function and form up change plan •Define business case for change and act as a change agent to influence Function Leadership to implement change agenda •Collaborate, partner, and communicate change plan implementation to all related functions/teams",[HCM] IT - Digital Solution Manager (SuccessFactors),Hồ Chí Minh,"Yêu Cầu Công Việc •Bachelor of IT System; Got knowledge of Digitalization Solution is a plus, MBA IS highly desired •5 years + experience in working with HR Function operations for leading and facilitating continuous improvement initiatives •2 years + experience of system integration implementation •2 years + project experience including experience in SuccessFactors systems implementation •HR related systems (HRMS, Payroll, T&A) strong knowledge •HR business process understand is required •System integration knowledge and implementation experience in Azure logicapps, dell Boomi etc. •Customer Service mindset; Operations discipline •Cross-function Business Process & Concepts Understanding •Project; Problem Solving; •Data Analytical and Exploitation; Change; Organizational Development •Excellent communication skills (both written and spoken) to demonstrate clear interpretation and presentation of results to various stakeholders ***Please note that by submitting an application to us, you consent to our processing of personal data about you that is provided by you and otherwise lawfully collected by us (which may include sensitive data) for our company's recruitment purpose. Where you provide us personal data of others, you further undertake that we are permitted to receive and process such data for the purpose for which you provided it. You may send your queries or request for support concerning our personal data processing activities to hrvn(at)coca-cola.com.vn. To better understand our personal data processing practices, please visit www.swirecocacola.com/en/Others/Privacy-Policies.html to the full Privacy Policy of Coca-Cola Beverages Viet Nam Limited.",Lương: Cạnh tranh,22-11-2023
