companyName,description,jobName,location,require,salary,timePost
Coca-Cola,"Mô tả Công việc 1) Job summary: − Be responsible for general ledger and property accounting, reconciliations and supporting internal and external financial reporting − Recording and processing a vast range of financial transactions and close liaison with departments and individuals across CCBVL 2) Key duties: − Prepares and analyzes financial statements (P&L, Balance Sheet) with proper explanation for variances − Analysis for both consolidated and property level financial statements (P&L and Balance Sheet) with proper explanation for variances; includes working closely with operations personnel to ensure accuracy of property level financial statements. − Support internal and external auditors and responsible for preparing / reviewing supporting schedules and documents − Key role in the month-end close process, including reviewing and preparing monthly journal entries and general ledger account reconciliations − Identifies and implement best practices to improve efficiency and/or effectiveness of processes, including ongoing development and improvement of controls ensuring compliance with Global Financial Standard. − Works closely with other departments/operations across the organization to provide financial insight and assistance − Other works as assigned.",GL Accounting Manager,Hồ Chí Minh,"Yêu Cầu Công Việc University/Bachelor’s Degree in Business Administration, Accounting − Good at the knowledge about SAP system − Postgraduate/Master’s Degree CPA / CMA / CA − 07+ Years of experience in manufacturing company with preferring MNC industry GL Accounting Manager − Business Acumen − Excellent in Excel advance − Strong leadership and communication skills with the ability to develop, manage and inspire others. − Excellent in analytic & problem-solving and decision skills − Fluently in speaking and writing English skill − Customer service oriented − Good knowledge of tax and legal standards − Good stress resistance Please note that by submitting an application to us, you consent to our processing of personal data about you that is provided by you and otherwise lawfully collected by us (which may include sensitive data) for our company's recruitment purpose. Where you provide us personal data of others, you further undertake that we are permitted to receive and process such data for the purpose for which you provided it. You may send your queries or request for support concerning our personal data processing activities to hrvn(at)coca-cola.com.vn. To better understand our personal data processing practices, please visit www.swirecocacola.com/en/Others/Privacy-Policies.html to the full Privacy Policy of Coca-Cola Beverages Viet Nam Limited.",Lương: Cạnh tranh,17-11-2023
Coca-Cola,"Mô tả Công việc Key Responsibility: The role is responsible in leading the overall financial planning process of the Company to ensure that the Company is able set its objectives and goals, as well as establish a glide-path for meeting those same objectives and goals. In addition, the role also leads the creation and establishment of aligned portfolio models and value chain analysis aimed at helping Management in their decision making. Prioritized Responsibilities 1. Financial Planning • Yearly Business Planning - Leading the overall Yearly Business Plan Process of the Company by supervising, reviewing and pre-aligning with the finance leaders in the country the business plan process and eventually consolidated business plan for discussion and approval by the Country GM and CFO • Quarterly Rolling Estimates - leading the overall Quarterly Rolling Estimates of the Company by supervising, reviewing and pre-aligning with business leaders • Monthly BP / RE Review - actual results vs Business Plan/Rolling Estimates reconciliations are done, variances are understood and explained. Risks and opportunities to the full year budget are highlighted and properly communicated. 2. Financial Analysis • Decision support - responsible for ensuring that a robust analysis is done by the team for projects/initiatives that would have an impact on the Company’s P&L, both in the short-term and the long-term • Sales & Operations Planning - responsible for reviewing, and ensuring that impact of updated S&OP forecasts are highlighted to the CFO and the rest of the Leadership team in order to ensure that plans are put in place to mitigate potential risks, and also understand where there are opportunities 3. CAPEX Management • Long-range planning for Capital Expenditures for the Company based on projected growth • Yearly Business Plan review and alignment of Capital expenditures with finance director and rest of leadership team in line with growth projections and current capacity • Review and alignment of capex projects for final approval/authorization to spend • Review of post mortem analysis done for CAPEX projects. Highlight the results of post mortem study to Management Skills Requirements: Communication complexities: • Effectively communicate with functional leads and other business leaders in the country and provide clear guidance and support on FP&A related matters. • Complex financial concepts to internal and external audiences must be articulated to non-financial business leaders in concise and understandable terms to influence and drive alignment and appropriate actions Data is used for decision-making, as well as internal and external reporting and communications. This also includes the preparation, interpretation, and alignment of financial data included in the business plans. • Communication with non-management / associates, including Controller’s Group, Corporate Tax, Corporate Governance and Compliance and others. Must represent bottling operations’ issues and results in terms understood by others, often requiring the explanation of the underlying business drivers which are new to the recipient. • Credible leader when resolving issues related to financial standards and processes; must apply business knowledge and communicate this effectively. Analysis: • BIG operates across multiple geographies and business environments and this role requires deep knowledge and expertise of bottling operations. • The role requires the ability to work on strategic issues and new approaches need to be developed continuously to ensure correct business decisions are made. • Participate in development and prioritization of business strategies and plans with cross functional teams Decision • Define the financial planning process to ensure that inputs from different organizations are taken into account prior to the review, alignment and eventual submission to BIG as necessary • Helping define long-term and short-term financial goals for the Company • Helping define savings goals for the Company to help meet profitability commitments",FP&A Director,Hồ Chí Minh,"Yêu Cầu Công Việc • University/Bachelor’s Degree – Required • Master’s degree - Preferred • CA / CPA / MBA preferred • At least 10 years financial planning and analysis relevant experience with a multi-national Company • At least 5 years’ experience in managing people and organizations • Successful working experience in Financial Planning & Analysis ***Please note that by submitting an application to us, you consent to our processing of personal data about you that is provided by you and otherwise lawfully collected by us (which may include sensitive data) for our company's recruitment purpose. Where you provide us personal data of others, you further undertake that we are permitted to receive and process such data for the purpose for which you provided it. You may send your queries or request for support concerning our personal data processing activities to hrvn(at)coca-cola.com.vn. To better understand our personal data processing practices, please visit www.swirecocacola.com/en/Others/Privacy-Policies.html to the full Privacy Policy of Coca-Cola Beverages Viet Nam Limited.",Lương: Cạnh tranh,01-12-2023
Coca-Cola Beverages Vietnam,"Mô tả Công việc 1)Key Responsibility: Manage region KA team to deliver customer services & build good relationship with customer to explore new opportunities. Acquire new key accounts in assigned areas Account Development Acquire new local KA Plan marketing activity calendar with customers to execute in outlet activities Manage distribution & availability Update information of customers Order generation Conduct daily market visits to monitor sales team activities and performance, assist in filed training and coaching of sales people, and observe execution of sales and merchandising standards, policies and procedures Monitor daily and analyze sales performance and trends by channel/ customer/ outlet, identify potential problems and follow up Drive volume target & volume growth Deliver world class customer services Instore execution & Asset Management Manage implementation of Channel plans as per defined PicOS Manage & align on contract & activation plan Manage & align company's assets compliance in the outlet execution plan People development Recruited & select sales staff Train & coach staff Maintain staff discipline 2)Skills Requirements: Experience in sales and providing solutions based on customer needs Strong communication and interpersonal skills with aptitude in building relationships Ability in problem-solving and negotiation The ability to handle multiple client accounts. Strong negotiation and leadership skills. Exceptional customer service skills.",Regional Key Account Manager - Off Premise,Hà Nội,"Yêu Cầu Công Việc 3) Qualifications and Experience: 5 years in sales experience in similar positions in FMCG Good Interpersonal, Leadership, Conflict Management Skills Analytical Ability, time management, planning, Organizing, Controlling and problem-solving skills Ability to work independently under high pressure Good English ***Please note that by submitting an application to us, you consent to our processing of personal data about you that is provided by you and otherwise lawfully collected by us (which may include sensitive data) for our company's recruitment purpose. Where you provide us personal data of others, you further undertake that we are permitted to receive and process such data for the purpose for which you provided it. You may send your queries or request for support concerning our personal data processing activities to hrvn(at)coca-cola.com.vn. To better understand our personal data processing practices, please visit www.swirecocacola.com/en/Others/Privacy-Policies.html to the full Privacy Policy of Coca-Cola Beverages Viet Nam Limited.",Lương: Cạnh tranh,10-12-2023
TECHCOMBANK,"Mô tả Công việc - Tiếp nhận yêu cầu tư vấn, hỗ trợ từ khách hàng, đánh giá, phân loại mức độ phức tạp để trực tiếp xử lý hoặc phối hợp với các bộ phận khác và Techcombank. - Đảm bảo các chỉ số hoạt động về chất lượng chăm sóc khách hàng tại tất cả các kênh tổng đài, mail, facebook, live chat... về thời gian xử lý, kỹ năng giao tiếp, sự hài lòng của khách hàng... - Xây dựng và cập nhật bảng câu hỏi, tài liệu hướng dẫn khách hàng về sản phẩm, dịch vụ của TCBS. - Thường xuyên cập nhật những thông tin mới nhất về sản phẩm, dịch vụ của TCBS để đảm bảo thông tin chính xác nhất về sản phẩm, dịch vụ. - Thực hiện các chương trình marketing và chăm sóc khách hàng, giới thiệu sản phẩm, khảo sát nhu cầu/ý kiến của khách hàng, bán sản phẩm, quảng bá uy tín và hình ảnh của TCBS và TCB trong quá trình giao hàng, liên hệ với khách hàng. - Triển khai các chương trình kinh doanh, bán chéo theo kế hoạch được giao - Đánh giá hiệu quả kinh doanh và xây dựng các chương trình kinh doanh/xúc tiến phù hợp với định hướng và chiến lược của TCBS - Triển khai và phối hợp thực hiện các chương trình kinh doanh để đạt được các mục tiêu đề ra. - Cập nhật, lưu trữ thông tin, dữ liệu thu thập được từ khách hàng và cung cấp cho các bộ phận liên quan, phục vụ cho việc phát triển sản phẩm, dịch vụ của TCBS. - Phối hợp với bộ phận quản lý hệ thống giám sát và đảm bảo hệ thống thông tin liên lạc với khách hàng đáp ứng công suất hoạt động cao nhất. - Thực hiện các công việc khác có liên quan theo yêu cầu của Trưởng nhóm/Giám đốc Dịch vụ Khách hàng Trực tuyến",Chuyên Viên Tư Vấn Trải Nghiệm Khách Hàng Trực Tuyến,Hồ Chí Minh,"Yêu Cầu Công Việc - Tốt nghiệp Đại học trở lên với các chuyên ngành đào tạo: kinh tế, tài chính, ngân hàng, ngoại thương... Ưu tiên các trường ĐH Top đầu Việt Nam - Tiếng anh tương đương Ielts 6.0 trở lên. - Hiểu biết cơ bản về CNTT (Python, Power BI, Data Analyst...), khả năng viết content, thiết kế đồ họa chuyển động, đồ họa thông tin, tạo dựng video. - Kiên nhẫn và khả năng giải quyết vấn đề. - Thái độ hướng tới khách hàng. - Kỹ năng giao tiếp vượt trội. - Yêu thích làm việc tại văn phòng, hỗ trợ chăm sóc khách hàng trực tuyến - Không yêu cầu kinh nghiệm (Ưu tiên đã làm việc ít nhất 3 năm trong các lĩnh vực liên quan như ngân hàng, chứng khoán, chăm sóc khách hàng trong các lĩnh vực vận hành/sản phẩm/quản lý chất lượng dịch vụ khách hàng) *** Quyền lợi của ứng viên - Mức lương khởi điểm: từ 14 triệu trở lên, không sales - Được ký hợp đồng lao động chính thức + hưởng các chế độ phúc lợi của Ngân hàng Techcombank như: Phụ cấp khác, ưu đãi gói mua BHNT, ưu đãi gói vay dành cho CBNV, lương Tháng 13, du lịch,.... - Làm việc trong tòa nhà hạng A - Cơ hội phát triển nghề nghiệp, lộ trình thăng tiến",Lương: Trên 14 Tr VND,14-11-2023
CÔNG TY TNHH GIMASYS,"Mô tả Công việc Tham gia dự án triển khai giải pháp phân tích dữ liệu trên Google Cloud cho khách hàng bao gồm các công việc: Khảo sát yêu cầu, phân tích đánh giá yêu cầu, thiết kế giải pháp, phát triển, triển khai và kiểm thử Thu thập, tích hợp, xử lý dữ liệu Trích xuất, xử lý, load dữ liệu từ nhiều nguồn khác nhau lên Google Cloud BigQuery Phát triển và vận hành các Data pipeline phát triển trên BigQuery hoặc các dịch vụ Google Cloud Data Analytics khác để đảm bảo tính nhất quán giữa các luồng dữ liệu Phân tích dữ liệu Khai phá dữ liệu xác định xu hướng, thất thường của dữ liệu Phát triển và thực thi các truy vấn liên quan (xử lý dữ liệu hàng ngày, biến đổi dữ liệu theo nhu cầu phân tích, thống kê và kiểm thử) Khảo sát yêu cầu, phân tích, thiết kế mô hình dữ liệu phân tích với LookML, phát triển các tính năng liên quan đến Block, báo cáo nhúng,... Khảo sát yêu cầu, phân tích, thiết kế phát triển các báo cáo, ứng dụng phân tích dữ liệu dựa trên các công cụ như Looker Studio, Looker, …",Data engineer,Hà Nội,"Yêu Cầu Công Việc Tốt nghiệp hệ chính quy một trong các chuyên ngành: CNTT, Toán Tin, Điện tử viễn thông Hoặc có chứng chỉ lập trình viên tương đương (Aptech, Quốc tế). Có khả năng đọc hiểu tài liệu tiếng Anh. Sử dụng thành thạo SQL , có thể sử dụng ngôn ngữ Python trong phân tích dữ liệu Có kinh nghiệm với các nền tảng Cloud data warehouse như Snowflake, BigQuery hoặc các dịch vụ, giải pháp tương đương Có kinh nghiệm phân tích và xử lý dữ liệu, các cấu trúc dữ liệu đa dạng và các phương pháp thu thập, biến đổi dữ liệu từ nhiều nguồn khác nhau Có khả năng sử dụng thành thạo các công cụ spreadsheet (Excel, Google sheet,...) Có kinh nghiệm làm việc với các dịch vụ Phân tích dữ liệu trên Google cloud, đặc biệt là các giải pháp như Looker, BigQuery hoặc các dịch vụ, giải pháp tương đương Có kỹ năng giao tiếp tốt, có khả năng khảo sát, thu thập, phân tích yêu cầu từ người dùng Có kiến thức cơ bản về các giải pháp thiết kế và phát triển mô hình dữ liệu Ưu tiên ứng viên Kiến thức, kinh nghiệm về các concepts & framework về và Machine Learning Ứng viên có chứng chỉ Google Cloud Professional Data Engineer hoặc các chứng chỉ về Data Analyst liên quan",Lương: Cạnh tranh,02-12-2023
CÔNG TY TNHH GIÁO DỤC WEGROW VIỆT NAM,"Mô tả Công việc MỘT NGÀY LÀM VIỆC CỦA BẠN “Make the product right”, phụ trách xây dựng product roadmap dựa trên chiến lược tăng trưởng và tốc độ phát triển của công ty. Hoạch định chiến lược đường dài, thiết lập product metrics để đánh giá và đo lường hiệu quả sản phẩm. Market research, khai thác hành vi và pain point của users để xác định tiềm năng phát triển của sản phẩm trên thị trường. Triển khai Product Backlog, quản lý development team (client/server) để giải quyết lỗi tồn đọng và xử lý user feedbacks. Hợp tác cùng đội ngũ Project Manager, Business Analyst, Data Analyst và Team Outsource (Developer, Tester, UX/UI Designer,..) để đảm bảo thực thi các ý tưởng, phương án, theo đúng chiến lược, lộ trình sản phẩm.",Chuyên viên Phát triển Sản phẩm (Product Owner),Hà Nội,"Yêu Cầu Công Việc WEGROW MONG RẰNG BẠN Định hướng phát triển trong lĩnh vực Product Management, tối thiểu 1.5-2 năm kinh nghiệm ở các vị trí Business Analyst, Product Operation, Product Designer,... Có hiểu biết, trải nghiệm làm việc trong môi trường áp dụng Scrum, Agile, Lean Startup, Design Thinking, CX là một lợi thế. Hiểu về quy trình A/B Testing, thông thạo data tools (SQL, Power BI, Data Studio) và các công cụ phân tích người dùng (Google Analytics, Salesforces, CRM,...) Khả năng của một Builder với tư duy End-User và Customer-Centric. Passionate, solution-driven mindset, high ownership và high standard với sản phẩm mình làm ra. Khao khát tạo ra các sản phẩm công nghệ tử tế, có giá trị cho hàng nghìn phụ huynh và trẻ em trên toàn quốc. QUYỀN LỢI & CƠ HỘI TẠI WEGROW Lương cứng 15.000.000 - 25.000.000 VNĐ/tháng + thưởng theo hiệu quả sản phẩm. Review tăng lương 03 tháng/lần, thu nhập tương xứng với kết quả và giá trị tạo ra. Làm việc trực tiếp với Founders, CEO & Leadership Team. Cơ hội được thăng tiến lên Product Manager sau 1 năm. Ownership với toàn bộ quá trình xây dựng sản phẩm thực tế. Đội ngũ khởi nghiệp trẻ, nhiệt huyết, tham vọng và nhân văn. Tất cả đồng lòng tạo ra giá trị thực tế cho trẻ em, gia đình và nhà trường. Tôn trọng sự đa dạng, LGBTQ+ friendly. Cùng nhiều chế độ phúc lợi hấp dẫn khác: Learning Friday, Team Building, Year-End Party, phòng ngủ trưa riêng, gửi xe miễn phí,... THỜI GIAN & ĐỊA ĐIỂM LÀM VIỆC Thời gian: 8h30 - 18h00 từ thứ 2 - sáng thứ 7 hàng tuần. Địa điểm: Văn phòng WeGrow - Số 29, ngõ 121 Thái Hà, Trung Liệt, Đống Đa, Hà Nội. QUY TRÌNH ỨNG TUYỂN Vòng 1: CV Application Vòng 2: HR Interview Vòng 3: Technical Test Vòng 4: CEO Interview",Lương: 15 Tr - 25 Tr VND,07-12-2023
CÔNG TY TNHH GIÁO DỤC WEGROW VIỆT NAM,"Mô tả Công việc MỘT NGÀY LÀM VIỆC CỦA BẠN Thực hiện nghiên cứu, phân tích thị trường, khách hàng, đối thủ cạnh tranh và các bài toán, vấn đề nghiệp vụ. Liên tục đưa ra ý tưởng mới, xác định rõ nhu cầu của khách hàng để đề xuất xây dựng tính năng/ sản phẩm. Vẽ user story, mô hình hóa user case, phụ trách thiết kế prototype và workflow. Phụ trách xử lý yêu cầu nghiệp vụ trong URD. Hiểu các sản phẩm và dịch vụ Cloud (Google Analytics, Salesforce, CRM v.v.) để theo dõi/báo cáo hiệu suất kinh doanh và các vấn đề bằng cách sử dụng số liệu phù hợp. Phối hợp chặt chẽ với Product Owner, Data Analyst, Developer, UX/UI Designer, Tester để đảm bảo thực thi các ý tưởng, phương án, theo đúng chiến lược, lộ trình sản phẩm.",Nhân viên Phân tích Kinh doanh (Business Analyst),Hà Nội,"Yêu Cầu Công Việc WEGROW MONG RẰNG BẠN Định hướng phát triển trong lĩnh vực Product Management, tối thiểu 1.5 năm kinh nghiệm ở các vị trí (Junior/Middle) Business Analyst. Có hiểu biết, trải nghiệm làm việc trong môi trường áp dụng Scrum, Agile, Lean Startup, Design Thinking, CX là một lợi thế. Thành thạo công cụ vẽ Figma. Có khả năng xây dựng UX/UI. Nhiệt huyết, tỉ mỉ, high ownership với sản phẩm mình làm ra. Khao khát tạo ra các sản phẩm công nghệ tử tế, có giá trị cho hàng nghìn phụ huynh và trẻ em trên toàn quốc. QUYỀN LỢI & CƠ HỘI TẠI WEGROW Thu nhập 12.000.000 - 17.000.000 VNĐ/tháng + thưởng theo hiệu quả sản phẩm. Review tăng lương 03 tháng/lần, thu nhập tương xứng với kết quả và giá trị tạo ra. Làm việc trực tiếp với Founder - CEO & Leadership Team. Cơ hội được thăng tiến lên Product Owner sau 6 tháng. Ownership với toàn bộ quá trình xây dựng sản phẩm thực tế. Đội ngũ khởi nghiệp trẻ, nhiệt huyết, tham vọng và nhân văn. Tất cả đồng lòng tạo ra giá trị thực tế cho trẻ em, gia đình và nhà trường. Tôn trọng sự đa dạng, LGBTQ+ friendly. Cùng nhiều chế độ phúc lợi khác: Learning Friday, Happy Hour, Team Building, Party, trà và cà phê miễn phí, (đặc biệt) phòng gym miễn phí, v.v… THỜI GIAN & ĐỊA ĐIỂM LÀM VIỆC Thời gian: 8h30 - 18h00 từ thứ 2 - sáng thứ 7 hàng tuần. Địa điểm: Văn phòng WeGrow - Số 29, ngõ 121 Thái Hà, Trung Liệt, Đống Đa, Hà Nội. QUY TRÌNH ỨNG TUYỂN Vòng 1: CV Application Vòng 2: HR Interview Vòng 3: Technical Test Vòng 4: CEO Interview",Lương: 12 Tr - 17 Tr VND,07-12-2023
Công Ty Cổ Phần VNG,"Mô tả Công việc ZaloPay is a Fintech product in Vietnam with young people and full of energy. Our aim is to optimize product across the entire user journey, identify and create new audiences. We are looking for a Senior Data Scientist to join our Data Science Team. You’ll be part of a team that is disrupting the industry with innovative attribution models and building the future analytics platform to be used by many teams (Tech, Promotion, ...) for User Behavior, Campaign performance and market insights. You’ll be working on very exciting projects using big data technologies with terabytes of data coming from different source. Responsibilities: Work with many teams (PO, Tech, BO) to understand dataflow, cashflow Identify problems and propose recommendations Focus on bringing statistical depth, analytical insights, and accurate interpretation of data Measure system performance and also deeper understand trends by providing insights and recommendations based on large amounts of data from various sources Design innovative attribution models to implement valuable metrics and better address system enhancement, user behavior Build and maintain visually appealing and engaging dashboards for stakeholders Work with Data Engineers to help define the data standards and requirements helping to ensure our systems are running correctly and efficiently. Involve in the development and evolvement of the data architecture Support internal training and proper documentation ensuring the successful onboarding of new team members","Senior Data Scientist II (ZaloPay, Data Platform)",Hồ Chí Minh,"Yêu Cầu Công Việc Qualifications: 5+ years relevant work experience with large amounts of data Education background in machine learning, statistics, math, data science, computer science or other closely related area Strong machine learning/statistics background with hands-on experience in academia and/or industry, sourcing, cleaning, manipulating and analyzing large volumes of data Experience with open-source machine learning libraries such as numpy, pandas, scikit-learn, distributed/parallel big data processing architecture (e.g., Hadoop, Spark, MLlib) and deep learning framework (e.g., TensorFlow, Pytorch) Understand the business domain (FinTech, AdTech knowledge is a plus) Be able to create plans, establish priorities, and effectively troubleshoot issues. Experience with recommendation systems is a plus Experience with data science models in finance domain or CRM (e.g., credit scoring, CLV, churn, etc) is a plus",Lương: Cạnh tranh,04-12-2023
