companyName,description,jobName,location,require,salary,timePost
CareerBuilder's client,"Mô tả Công việc Job Objective: Building a platform with strong architecture Be part of the data & and analytics center of excellence (CoE) working on a wide range of data infrastructure and data engineering projects across Key Responsibilities 1. Data Architecture: Architects, Designs, Builds, Develops, Maintains, and Implements new data systems where needed, the Architecture with best practices and data infrastructure reliable and scalable. Responsible for deploying secure and well-tested software that meets privacy and compliance requirements, and maintains and improves CI / CD pipeline. Proactively drive the effort of identifying opportunities to manage data and provide data solutions. Evaluate various data architectures in the market and utilize them to develop data solutions to meet business requirements. Drive the delivery of data products and services into systems and business processes in compliance with internal regulatory requirements. Oversee the review of internal and external business and product requirements for data operations and activity and suggest changes and upgrades to systems and storage to accommodate ongoing needs 2. Data Integration: Review and analyze existing data systems, and make recommendations on improvement, maintenance, or other factors to improve the system, automate manual processes, optimize data delivery, and re-design infrastructure for scale and performance and greater scalability Monitoring and quality assurance within the system (Server/ Services/ETL /Networking/Security). Design, build, and maintain optimized data pipelines and ETL solutions as business support tools in providing analysis and real-time analytics platforms for critical decision-making, support of data and analytics projects, integrating new sources of data into our central data warehouse to meet business requirements, and experience building and optimizing ‘big data’ architectures for read-and-write performance. Ensure data assets are organized and stored efficiently so that information is high quality, reliable, flexible, and efficient. Manage and enhance to ensure that DWH, Data mart and BI tools work stably through aligned business/ system/ and data processes. Ensure data is accessible to the required personnel to ensure the ease of understanding and access to the data needed to make informed business decisions. Experience with building reports and data visualizations, using data from the data warehouse or other sources and mapping are helpful (but not required) 3. Project Management: The role plays is highly collaborative and, as such, works closely with data analysts, data scientists, and other data consumers within the business. Establishes the documentation of reports, data infrastructure, privacy controls and develops, maintains technical specification documentation, and processes, and effectively manages data systems that have the relevant security. Work with team leads to resolve people problems and projects to ensure maximum productivity. Understand business and technical requirements and constraints to design effective software solutions. Strong stakeholder management and collaboration with them to understand user requirements Effective time management skills, including demonstrated ability to manage and prioritize multiple tasks and projects. Experience working in Agile teams to lead successful digital transformation projects, having mastered Agile principles, practices, and Scrum methodologies",Senior Data Engineer,Hồ Chí Minh,"Yêu Cầu Công Việc Bachelor’s degree (or higher) in Computer Science, Software Engineering or Information Technology, MIS, Economics, Finance, Statistics, Mathematics, or a related field (Financial Services, Banking, Insurance, Securities). At least 3 years experience (typically 5+ years) in Data Engineering and ETL and Analytics tools (R, Python, Pentaho, dbt…) and BI&A Visualization systems (Metabase, Power BI, OBIEE, SAS VA, IBM, Yellowfin, Tableau, Qlik …), and In-depth knowledge of BI technologies, methodologies, and their application like Metabase, PowerBI, Tableau, Looker etc Experience with building data pipelines from various business applications like Salesforce, Marketo, NetSuite, Workday, Odoo,… and databases (MsSQL, Oracle, IBM, SAP, MySQL, AWS Redshift). Experience designing and implementing large-scale distributed data pipelines and working with cloud infrastructure services like AWS/GCP/Azure (preferably AWS), (Big Query, Data Flow, Amazon EKS, EMR, Docker/ECS, and Redshift.) Experience with the LAN or VLAN, and digital organizing tools, like Active Directory Action Network, ActionKit, or Blue State Digital, is a plus (but not required). Experience with big data tools: Hadoop, Spark, Kafka, Spark & Kafka Streaming, Python, Scala, Talend, Azkaban, Luigi, Airflow etc Good at math and Advanced SQL knowledge and experience working with relational databases as well as working familiarity with a variety of databases is a big plus. Good report-writing skills Ability to communicate in English. Benefit: Full social insurance following Vietnamese Law 100% salary during probationary period Personal health and spouse insurance Annual leave, Annual heath-check Professional and Transparent working environment Buying company products at a reduced and with promotional offers",Lương: Cạnh tranh,07-12-2023
Công Ty Cổ Phần VNG,"Mô tả Công việc VNG Solutions is a subsidiary of VNG Corporation, a reputable Vietnamese provider of IT services and technology on a global scale. With its key markets in the Middle East, the US, and Europe, VNG Solutions's headquarters in Vietnam is dedicated to providing enterprise-level services and empowering customers and society to advance decisively into the digital future. VNG Solutions provides top-notch services while strictly adhering to international standards. We remain in the public eye as experts in \"the next big technologies”. VNG Solutions will provide you with a creative environment with an emphasis on B2B services, where you will have the opportunity to foster your abilities and learn about various technologies to advance your career. We are dedicated to the development and well-being of our staff members while creating a supportive work environment that allows them to reach their greatest potential. We are seeking a skilled and experienced Data Engineer to join our team. The ideal candidate will have a strong background in Azure Cloud services and Microsoft Dynamics 365. This role involves developing and maintaining scalable data pipelines, ensuring data quality, and collaborating with cross-functional teams to meet business needs. Responsibilities: Lead the design and implementation of end-to-end data solutions on the Microsoft Azure platform. Evaluate and recommend new technologies to enhance data processing capabilities. Ensure data security, privacy, and compliance with regulatory standards. Design, build, and maintain efficient, reusable, and reliable data pipelines. Should be an expert in coding and implementing data pipelines in cloud-based data infrastructure, analytical, and no-SQL databases. Leverage Azure Cloud services for data processing and storage. Integrate various data sources with Microsoft Dynamics 365. Should have experience with Data Ingestion/Data Movement, Data migration, ETL pipelines Ensure seamless flow of data between internal and external systems. Implement data quality checks and balances. Manage and optimize data storage in Azure. Mentor and guide junior data engineers in best practices and methodologies. Collaborate with stakeholders, other department to define data architecture and integration strategies. Provide technical support and training on data-related aspects. Prepare detailed documentation for data engineering processes and pipelines. Maintain records of data schemas and transformations. English proficiency in written and spoken *** Note: The position may require international travel for periods of 1 week to 3 months continuously, per year. Candidates will be required to accept this requirement as part of the positions.","Senior Azure Data Engineer, VNG Solutions",Hồ Chí Minh,"Yêu Cầu Công Việc Qualifications: Relevant experience in data factory and data bricks Bachelor degree (Advanced degree preferred) in Computer Science, Engineering, or a related field. 5 - 9 years of experience in data engineering, with a focus on Azure services. Key skills: MongoDB, ETL, Postgres, Databricks, Python, Hive, Pyspark, SQL Expertise in designing and optimizing data warehouses and data lakes on Azure. Proficient in big data technologies, such as Apache Spark and Hadoop. Familiarity with containerization and orchestration technologies (Docker, Kubernetes) Preferred to have experience with shell scripting in Bash, Unix, or Windows shell Demonstrated experience and expertise in conceptual thinking of how to apply information solutions to a business challenge Strong leadership and project management skills",Lương: Cạnh tranh,11-12-2023
DatvietVAC Group Holdings,"Mô tả Công việc II. MỤC TIÊU CÔNG VIỆC/ JOB OBJECTIVES: Data Science Department is looking for a Data Engineer Lead to: Lead DE Team to deliver Data Platform (DP) for VieON – OTT Platform Setup and maintain in-house data-warehouse, built on top of Apache Hadoop, Spark, Kafka Build scalable, durable, and extensible data models and pipeline Optimize ingestion and management of data from multiple sources Design, create, and maintain low-latency, near-real time data systems",Data Engineer Lead,Hồ Chí Minh,"Yêu Cầu Công Việc - Optimizing in-house big-data pipelines, architectures and data sets - Design, develop, automate data pipeline, data ETL, etc. on distributed data processing platform Spark - Prepare data inputs for machine learning processes: model training, testing and production deployment - End-to-end data processing, troubleshoot data-related problems and authorize maintenance or modifications. - Monitor and analyze information and data systems and evaluate their performance to discover ways of enhancing them (new technologies, upgrades etc.) - Ensure digital databases and archives are protected from security breaches and data losses. - Degree in Computer Science or other related fields - +4 years of experience as Lead Data Engineer - 2 - 4 years of using the programming languages including Go/Python, Java, Scala - Excellent understanding of data administration and management functions (collection, analysis, distribution etc.) - Familiarity with modern database and information system technologies. - Big data tools: Kafka, Hadoop, Hive, Spark, Elastic Search - Relational SQL and NoSQL databases: MySQL, MongoDB, Postgres, Cassandra - Data pipeline and workflow management tools: Airflow - Stream-processing systems: Spark-Streaming - Familiar with Linux development environments and multi-threaded programming - Have knowledge/Experience in crawl data is plus - Monitor server capacity and resource usage for server capacity planning is plus - Create customized alerts to more effectively track key server capacity metrics is plus - Good logical thinking; - Passionate about coding and programming, innovation, and solving challenging problems - An analytical mindset with problem-solving skills. - Excellent communication and collaboration skills. - Proficient in Microsoft Office - Good English communication skills - A team player, with brave, enthusiastic cheerful attitude",Lương: 50 Tr - 70 Tr VND,11-12-2023
Công ty Cổ phần Dịch vụ Di Động Trực tuyến (Ví MoMo),"Mô tả Công việc MoMo is the market leader in mobile payments in Vietnam. We strive to make life better for every Vietnamese with innovation in technology. As many parts of the business grow, we are looking for an experienced Data Engineer to join the team. At MoMo BigData AI department, we focus on Smart, Efficienct, Execellent execution and data quality which providing high quality marterial for: Business Performance, App Performance monitoring. ML products such as recommendation, personalization, risk scoring, fraud detection, promotion targeting and financial services. We are striving to build the new hydrid data platform on multiple cloud vendors helping us to better control the budget and technologies behind. What you will do With the AI-first company mission, design and build the self-serve data platform to serve people in MoMo and partner needs. They will be allocated resources based on their needs to: Ingesting multiple data sources, from batch to stream, from pull to push mechanism. Developing and deploying the resilient data pipeline in the data lake, data warehouse, and streaming data. Delivering the derived data downstream with high quality, such as BI solution (PowerBI, Google Data Studio,…), Marketing Platform, Promotion Platform, and Experiment Platform,… in multiple ways (API, Dataset, Streaming Data,…) Monitoring the data quality of data pipelines in the data platform. Monitoring and optimizing resource usage. Design and build the Data Management Systems enabling the Data Governance team and data consumers: Managing the data life cycle in the big data platform. Having MoMo data ecosystem self-exploration ability. Proving the single source of truths to multiple downstream with high quality. Managing the attribution infrastructure cost from various big projects, teams, and departments. Design and build the Data Loss Prevention (DLP) solution to protect our data and achieve data visibility in large organizations. Collaborate with Machine Learning Engineers, Data Scientists, Business Analysts, Data Analysts, Product Owners, and Product Operators to strive for greater functionality in our data systems.",Senior Data Engineer,Hồ Chí Minh,"Yêu Cầu Công Việc Love of data. You run “SELECT COUNT(SHEEP) FROM BACKYARD” during your sleep! Strong programming skills: You have 3+ years of experience as a data engineer or software engineer for data intensive applications. You have 3+ years of experience with a scripting language (Python / Java / Go / Scala) for data processing and analysis. Language: Java/Kotlin, Python, Scala, VueJs, BashScripts; Infrastructure: Google Cloud Platform, Amazon Web Service, Kubernetes, Docker; Data Warehouse: BigQuery, Oracle; Data Source: App Events, Oracle, MySQL, MSSQL, Kafka, Pubsub, REST API; Data Pipeline Orchestration: Airflow; BI: Datastudio, PowerBI; Problem-solving skills, Teamwork spirit; Experience with cloud platforms such as Google Cloud Platform or Amazon Web Service is a plus.",Lương: Cạnh tranh,07-12-2023
Công Ty CP Vàng Bạc Đá Quý Phú Nhuận - PNJ,"Mô tả Công việc 1. Xây dựng và vận hành kho dữ liệu: Làm việc với các team ERP, software, các đối tác và phòng ban chức năng để xác định luồng đi và ý nghĩa của dữ liệu Thiết kế các phương án thu thập dữ liệu, các tiêu chuẩn thu thập, đảm bảo việc thu thập và ghi nhận dữ liệu đúng và phù hợp cho việc khai thác/ứng dụng. Xây dựng, phát triển các nền tảng lưu trữ, xử lý, quản lý dữ liệu lớn (Big Data) trên hệ sinh thái Cloud Azure (MS Fabric) ,AWS,… Thiết kế, xây dựng, tối ưu hóa luồng dữ liệu, giải pháp ETL có khả năng mở rộng linh hoạt với độ tin cậy cao, phục vụ cho việc khai thác/ingest các loại dữ liệu vào Data lake, Data Warehouse. Làm việc với các team phân tích để thiết kế những bộ dữ liệu phù hợp cho hệ thống báo cáo/ dashboard. Cập nhật những thay đổi trong các bộ dữ liệu theo quá trình chuyển đổi của business và các nhu cầu khai thác Xây dựng các tài liệu liên quan đến kiến trúc và định nghĩa dữ liệu 2. Cải tiến, nâng cấp hiệu suất của kho dữ liệu: Xây dựng những kiến trúc dữ liệu phù hợp với nhu cầu từ các đội phân tích, khoa học dữ liệu, học máy và người dùng Làm việc với các team kỹ thuật công nghệ để tối ưu hóa chi phí hạ tầng, môi trường kho dữ liệu, tư vấn và xây dựng những giải pháp để dữ liệu có thể được lưu trữ nhiều hơn, đa dạng hơn, truy vấn nhanh hơn với chi phí tối ưu nhất. Kiểm soát chi phí và khả năng đáp ứng của kho dữ liệu, liên tục theo dõi, cảnh báo và xử lí nhanh nhất có thể khi có sự cố phát sinh để đảm bảo hệ thống báo cáo và các sản phẩm dữ liệu khác hoạt động trơn tru hiệu quả. 3. Minh bạch và an toàn dữ liệu: Quy hoạch & xây dựng cơ chế an toàn dữ liệu của Data Warehouse. Đảm bảo các kết nối được ổn định ,an toàn. Data được khai thác & sử dụng đúng đối tượng & phạm vi công việc. Theo dõi và cảnh báo nếu có bất kì vấn đề gì khiến dữ liệu có thể bị sai lệch, lấy cắp, dùng sai mục đích.",Senior Data Engineer,Hồ Chí Minh,"Yêu Cầu Công Việc Tốt nghiệp Đại học trở lên chuyên ngành: Công nghệ thông tin/ Kinh tế hoặc ngành khác liên quan Các học vấn khác cần cho ngành nghề: Phân tích kĩ thuật, phân tích chiến lược kinh doanh, cơ sở dữ liệu, phân tích thống kê toán. Tối thiểu 5 năm kinh nghiệm làm việc trong lĩnh vực Data Engineer Kỹ năng công việc: - Sử dụng thành thạo các ngôn ngữ phân tích dữ liệu SQL, NoSQL, Python,... - Sử dụng thành thạo các ETL Tools : SSIS, Talend,Airflow,… - Có kinh nghiệm làm việc môi trường cloud: Azure Synapse, AAS, Databrick, Azure Data Lake, Azure Data Factory - Có kinh nghiệm BI Tools (Power BI, SAP BI, Oracle BI) - Có kinh nghiệm làm việc với một trong các hệ sinh thái Hadoop, Spark, Nifi, Airflow, Kafka, Pentaho, Hive, Impala - Có kiến thức về Phân tích kĩ thuật, hạ tầng công nghệ thông tin, phần mềm ứng dụng, quản lý dự án. Yêu cầu khác : - Trung thực,ham học hỏi, chăm chỉ, không ngại khó, dám dấn thân, cầu tiến,.. - Tư duy logic; - Khả năng phân tích; - Khả năng giải quyết vấn đề Kỹ năng mềm: Có kỹ năng giao tiếp tốt ,làm việc nhóm Thông tin liên hệ: Email: Ms.Hoài Anh - anh.nth13@pnj.com.vn",Lương: Cạnh tranh,25-11-2023
Công Ty CP Vàng Bạc Đá Quý Phú Nhuận - PNJ,"Mô tả Công việc 1. Xây dựng và vận hành kho dữ liệu: Làm việc với các team ERP, software, các đối tác và phòng ban chức năng để xác định luồng đi và ý nghĩa của dữ liệu Thiết kế các phương án thu thập dữ liệu, các tiêu chuẩn thu thập, đảm bảo việc thu thập và ghi nhận dữ liệu đúng và phù hợp cho việc khai thác/ứng dụng. Xây dựng, phát triển các nền tảng lưu trữ, xử lý, quản lý dữ liệu lớn (Big Data) trên hệ sinh thái Cloud Azure (MS Fabric) ,AWS,… Thiết kế, xây dựng, tối ưu hóa luồng dữ liệu, giải pháp ETL có khả năng mở rộng linh hoạt với độ tin cậy cao, phục vụ cho việc khai thác/ingest các loại dữ liệu vào Data lake, Data Warehouse. Làm việc với các team phân tích để thiết kế những bộ dữ liệu phù hợp cho hệ thống báo cáo/ dashboard. Cập nhật những thay đổi trong các bộ dữ liệu theo quá trình chuyển đổi của business và các nhu cầu khai thác Xây dựng các tài liệu liên quan đến kiến trúc và định nghĩa dữ liệu 2. Cải tiến, nâng cấp hiệu suất của kho dữ liệu: Xây dựng những kiến trúc dữ liệu phù hợp với nhu cầu từ các đội phân tích, khoa học dữ liệu, học máy và người dùng Làm việc với các team kỹ thuật công nghệ để tối ưu hóa chi phí hạ tầng, môi trường kho dữ liệu, tư vấn và xây dựng những giải pháp để dữ liệu có thể được lưu trữ nhiều hơn, đa dạng hơn, truy vấn nhanh hơn với chi phí tối ưu nhất. Kiểm soát chi phí và khả năng đáp ứng của kho dữ liệu, liên tục theo dõi, cảnh báo và xử lí nhanh nhất có thể khi có sự cố phát sinh để đảm bảo hệ thống báo cáo và các sản phẩm dữ liệu khác hoạt động trơn tru hiệu quả. 3. Minh bạch và an toàn dữ liệu: Quy hoạch & xây dựng cơ chế an toàn dữ liệu của Data Warehouse. Đảm bảo các kết nối được ổn định ,an toàn. Data được khai thác & sử dụng đúng đối tượng & phạm vi công việc. Theo dõi và cảnh báo nếu có bất kì vấn đề gì khiến dữ liệu có thể bị sai lệch, lấy cắp, dùng sai mục đích.",Senior Data Engineer,Hồ Chí Minh,"Yêu Cầu Công Việc Tốt nghiệp Đại học trở lên chuyên ngành: Công nghệ thông tin/ Kinh tế hoặc ngành khác liên quan Các học vấn khác cần cho ngành nghề: Phân tích kĩ thuật, phân tích chiến lược kinh doanh, cơ sở dữ liệu, phân tích thống kê toán. Tối thiểu 5 năm kinh nghiệm làm việc trong lĩnh vực Data Engineer Kỹ năng công việc: - Sử dụng thành thạo các ngôn ngữ phân tích dữ liệu SQL, NoSQL, Python,... - Sử dụng thành thạo các ETL Tools : SSIS, Talend,Airflow,… - Có kinh nghiệm làm việc môi trường cloud: Azure Synapse, AAS, Databrick, Azure Data Lake, Azure Data Factory - Có kinh nghiệm BI Tools (Power BI, SAP BI, Oracle BI) - Có kinh nghiệm làm việc với một trong các hệ sinh thái Hadoop, Spark, Nifi, Airflow, Kafka, Pentaho, Hive, Impala - Có kiến thức về Phân tích kĩ thuật, hạ tầng công nghệ thông tin, phần mềm ứng dụng, quản lý dự án. Yêu cầu khác : - Trung thực,ham học hỏi, chăm chỉ, không ngại khó, dám dấn thân, cầu tiến,.. - Tư duy logic; - Khả năng phân tích; - Khả năng giải quyết vấn đề Kỹ năng mềm: Có kỹ năng giao tiếp tốt ,làm việc nhóm Thông tin liên hệ: Email: Ms.Hoài Anh - anh.nth13@pnj.com.vn",Lương: Cạnh tranh,08-12-2023
Công Ty Cổ Phần VNG,"Mô tả Công việc VNG Solutions is a subsidiary of VNG Corporation, a reputable Vietnamese provider of IT services and technology on a global scale. With its key markets in the Middle East, the US, and Europe, VNG Solutions's headquarters in Vietnam is dedicated to providing enterprise-level services and empowering customers and society to advance decisively into the digital future. VNG Solutions provides top-notch services while strictly adhering to international standards. We remain in the public eye as experts in \"the next big technologies”. VNG Solutions will provide you with a creative environment with an emphasis on B2B services, where you will have the opportunity to foster your abilities and learn about various technologies to advance your career. We are dedicated to the development and well-being of our staff members while creating a supportive work environment that allows them to reach their greatest potential. We are seeking a skilled and experienced Data Engineer to join our team. The ideal candidate will have a strong background in Azure Cloud services and Microsoft Dynamics 365. This role involves developing and maintaining scalable data pipelines, ensuring data quality, and collaborating with cross-functional teams to meet business needs. Responsibilities: Design, develop, and maintain data pipelines and ETL processes on Microsoft Azure. Collaborate with cross-functional teams to gather and understand data requirements. Implement data solutions that align with business objectives and comply with data governance standards. Optimize and troubleshoot existing data infrastructure for performance and scalability. Stay updated on industry best practices and emerging technologies in data engineering. Will create and support Azure Data Factory pipelines. Will integrate end to end data pipelines to take data from data source to target data repositories ensuring the quality and consistency of data. Will create and support Azure Data Factory pipelines. Will integrate end to end data pipelines to take data from data source to target data repositories ensuring the quality and consistency of data. English proficiency in speaking, communication *** Note: The position may require international travel for periods of 1 week to 3 months continuously, per year. Candidates will be required to accept this requirement as part of the positions.","Azure Data Engineer, VNG Solutions",Hồ Chí Minh,"Yêu Cầu Công Việc Qualifications: Bachelor's degree in Computer Science, Engineering, or a related field. 3+ years of experience in data engineering, with a focus on Azure services. Proficiency in SQL, Python, and other relevant programming languages. Experience with Azure Data Factory, Azure Databricks, and other Azure data services. Strong problem-solving and communication skills. Experience with Azure Synapse Experience in Cloud-based solutions. Solid understanding and experience working with GIT. Good understanding of Microsoft ETL tools (Azure Databricks, Azure Data Factory, Data Lake and SSIS). Experience working with structured and unstructured data. Ability to use ARM templates. Experience in working with JSON. Good understanding of Azure DevOps or Jira.",Lương: Cạnh tranh,11-12-2023
