companyName,description,jobName,location,require,salary,timePost
Công Ty Cổ Phần VNG,"Mô tả Công việc Research and implement appropriate ML/DL algorithms and tools Team up with software engineers to build end-to-end ML/DL applications and products Design and implement data pipelines to gather and preprocess language data for training and testing AI models. Monitor and analyze the performance of AI models in production, identify and troubleshoot any issues or bottlenecks, and propose solutions for optimization. Conduct research and stay up-to-date with the latest advancements in AI and computer vision Integrate and optimize with Nvidia frameworks such as Deepstream, Triton Inference Server, and etc.",Senior AI Engineer (B2B Product),Hồ Chí Minh,"Yêu Cầu Công Việc Passionate about data, ML/DL Experience with ML/DL frameworks and libraries such as Tensorflow, Pytorch, MXNet, Pandas, PySpark Proficient in Python, and object oriented programming Experience with backend development Experience with large-scale production databases Proven experience in developing and deploying AI models and systems in real-world applications. Familiarity with tools and technologies such as LangChain, OpenAI API, and Vector Database is highly desirable. Experience with cloud platforms (e.g., AWS, Azure, GCP) and deploying AI models at scale is a plus. BS/BA in Computer Science, Computer Engineer, Mathematics or related majors.",Lương: Cạnh tranh,26-11-2023
CÔNG TY TNHH THƯƠNG MẠI VÀ DỊCH VỤ OZOVN,"Mô tả Công việc Mục đích của công việc Phát triển website bán hàng của công ty Nhiệm vụ và trách nhiệm chính của công việc Tham gia phát triển ứng dụng, website bán hàng của công ty Hỗ trợ các phòng ban trong việc sử dụng công nghệ vào công việc Thực hiện các công việc liên quan khác theo yêu cầu của cấp quản lý",Kỹ Sư Phần Mềm,Hà Nội,"Yêu Cầu Công Việc Giới tính Không yêu cầu Độ tuổi Từ: 18 - 35 tuổi Bằng cấp Có bằng cấp, chứng chỉ liên quan đến ngành đào tạo công nghệ thông tin Kinh nghiệm, chuyên môn, kỹ năng Có kinh nghiệm làm việc với PHP từ 1 năm trở lên và liên quan tới wordpress, shopify Có kiến thức ứng dụng các CSS và Javascript framework: jQuery, Bootstrap / Flexbox Nắm vững cơ sở dữ liệu MySQL Có sản phẩm thực tế là lợi thế Thái độ/Tính cách Trách nhiệm, cẩn trọng. Tư duy logic Ham học hỏi Khả năng làm việc độc lập QUYỀN LỢI Thu nhập Up to 20M Lương hiệu quả và thưởng Ghi nhận đặc biệt (thưởng nóng) hàng quý dựa trên nỗ lực và kết quả công việc Các khoản thưởng chung, ngày Lễ, Tết. Review lương định kì 1 năm/lần. Phúc lợi Du lịch, teambuilding thiểu 1 năm/lần. Có 12 ngày nghỉ phép năm Môi trường làm việc cởi mở và năng động, khuyến khích trao đổi ý tưởng ở mọi cấp, cho phép bạn làm việc, sáng tạo theo cách riêng. Cơ hội học hỏi từ các chuyên gia hàng đầu, lãnh đạo và đồng nghiệp ưu tú Cơ hội được đào tạo, trao dồi kỹ năng định kì và nhu cầu thực tế. Đào tạo Được Công ty hỗ trợ quỹ đào tạo hằng năm, phục vụ phát triển năng lực trong công việc. Địa điểm làm việc Văn phòng Tầng 6, Số 479 Minh Khai, Hai Bà Trưng, Hà Nội Thời gian làm việc Từ thứ 2 tới thứ 6 (8h - 17h30), thứ 7 (8h - 12h) Nghỉ trưa 12h - 13h30",Lương: Lên đến 20 Tr VND,10-12-2023
"SCHAEFFLER VIETNAM CO., LTD","Mô tả Công việc • Work with digitalization team in building end-to-end platforms and solutions for manufacturing environment, and visualization of data driven solutions. • Participate in and drive design-thinking sessions to understand and define the functional requirements. • Work on developing engaging and user-centric web and mobile applications with a cross-functional team consisting of product/project managers, solutions architects, software engineers, DevOps, and other specialists. • Create and update documentations and manuals for users of our deployment-, monitoring-, and test infrastructure • Maintain scripts and development tools in our continuous integration/continuous delivery environment • First and second level IT support for operations IT applications based on defined SLA and escalation processes • Assist in the continuous automatization process of our software development and software solutions • Support in the improvement of our software- and system administration processes • Advice and operate technical solutions for development infrastructures • Find and test possible innovations and solutions for our teams • Support, maintenance and documentation of software functionalities and technical specifications.",Developer Operation Engineer (DevOps),Đồng Nai Hồ Chí Minh,"Yêu Cầu Công Việc • Bachelor or master’s degree in computer science, or related area • At least 3 years’ experience in designing software for enterprise solutions. • Bachelor in IT or any comparable course of studies • Good knowledge in operating systems, devops-environments and tools like Jenkins, Kubernetes, GitLab, Atlassian Tools, Sonarqube or Kibana • Practical knowledge in software development and experience in best practices of devops environments • Experience with Cloud infrastructures and microservice-architectures like Azure, AWS Cloud , S/4Hana • Practical knowledge in agile software development • High experience in container based solutions like Docker • Possess very good English communication and interpersonal skills.",Lương: Cạnh tranh,15-11-2023
Công Ty Cổ Phần VNG,"Mô tả Công việc ﻿We are looking for a Senior Software Engineer (Fullstack NodeJS) to help us build and maintain web applications and services. As a senior engineer at ZaloPay, you will work on a diverse range of projects, collaborate with cross-functional teams, and have the opportunity to take ownership of critical development tasks. Responsibilities: Collaborate with cross-functional teams to design, develop, and maintain web applications and services using Node.js and other relevant technologies. Write well-structured, tested and efficient code following industry best practices. Work on both frontend and backend development tasks, including database design, API development, and user interface implementation. Troubleshoot and debug issues to ensure the smooth operation of web applications. Stay up-to-date with the latest industry trends and technologies to propose improvements and innovations.","Senior Fullstack Engineer (NodeJS, ReactJS)",Hồ Chí Minh,"Yêu Cầu Công Việc Requirements: Bachelor's degree in Computer Science, related field, or equivalent practical experience. 3-5+ years of professional experience in Node.js development. Expertise in JavaScript and Node.js. Familiarity with TypeScript Familiarity with web development technologies such as HTML, CSS, and front-end frameworks (e.g., React). Familiarity with Next.js from development to deployment, deep understanding on web rendering mechanism like CSR, SSR, SSG,… Familiarity with bundling tool like Webpack, Rollup Knowledge of database systems (e.g., MongoDB, PostgreSQL, MySQL). Familiarity with RESTful APIs and microservices architecture. DevOps and CI/CD pipeline experience. Docker and containerization knowledge. In-depth knowledge of database systems and query optimization. Proven ability to lead and mentor junior developers. Exceptional problem-solving and architectural design skills. Strong problem-solving, research skills and a willingness to learn. Excellent communication and teamwork skills. It would be a plus if you: Security best practices in web development, especially in fintech industry. Have experience working with React Server component",Lương: Cạnh tranh,04-12-2023
Công Ty Cổ Phần VNG,"Mô tả Công việc Lead and manage the development for intelligent video analytics product, and other AI products Work with a business owner and AI engineering team to drive the development of AI product Research and implement appropriate ML/DL algorithms and tools focusing on real-time computer vision Team up with software engineers to build end-to-end ML/DL applications and products Design and implement data pipelines to gather and preprocess language data for training and testing AI models. Monitor and analyze the performance of AI models in production, identify and troubleshoot any issues or bottlenecks, and propose solutions for optimization. Conduct research and stay up-to-date with the latest advancements in AI and computer vision Integrate and optimize with Nvidia frameworks such as Deepstream, Triton Inference Server, and etc.",Lead AI Engineer,Hồ Chí Minh,"Yêu Cầu Công Việc Passionate about data, ML/DL and its applications Capability to lead AI enginering team Large scale AI backend architecture design Experience with ML/DL frameworks and libraries such as Tensorflow, Pytorch, MXNet, Pandas, PySpark Proficient in Python/Golang/C++, and object oriented programming Proven experience in developing and deploying AI models and systems in real-world applications. MS/BS/BA in Computer Science, Computer Engineer, Mathematics or related majors.",Lương: Cạnh tranh,02-12-2023
"Sonion Vietnam Co., Ltd.","Mô tả Công việc Range of Responsibilities and authorities 1. General position description Operations Automation Control System Engineer principal task is to design electrical and/or pneumatic system for equipment. Create technical documentations in form of diagrams for electrical circuits or pneumatic systems. Create PLC and HMI codes enable machines/tools to meet defined process requirements. Applying a general work standard and programing principles in terms of structure quality and esthetic established by Industrial Engineering department in Poland. Adjusting, debugging and troubleshooting hardware or software to ensure a successful validation within conditions defined by process description documentation. Support Industrial engineering in Poland in collecting information required regarding available equipment. Carry on with described duties ensuring good cooperation and collaboration between team members from other disciplines Specific activities: * Create, modify and upgrade technical documentation (electrical and pneumatic diagrams) * Create, modify, troubleshoot and update PLC and HMI codes * Perform electrical measurements * Create and review list of equipment to be ordered * Ensure a good cooperation with other engineers and departments * Cooperate with other facilities of Sonion * Participate in defining the potential problems and risks which may occur during equipment design or duplication * Review the existing machine design and see which parts may be already obsolete * Follow the plan schedule and inform supervisor about potential risks/design are overcomplicated * Monitor equipment assembly progress and related costs * Participate in assessment of the risk for new developments – technical, cost and timing * Availability to travel to other Sonion’s locations in NL, PH, PL (<10%) * Employee is responsible in proactively receive, search, learn and comply with prevailing law and company regulation which are communicated via internal information channels including broadcasting, email, SBS (Sonion Business System), notice board and electronic notice in every areas. This content includes but not limited to: ISO on Quality Management, Environment, Occupation Health & Safety, Code of conduct and Corporate Social Responsibility, Labor safety and Fire Prevention and Fighting, Work Rule and Employee Handbook and other internal regulations. Attending concerned training courses of QMS–ISO 9001, EMS-ISO 14001, OH&SMS-ISO45001 where required.",Operations Automation Control System Engineer,Hồ Chí Minh,"Yêu Cầu Công Việc -Bachelor's degree majored in Automation/Control Systems, Mechatronics, Software Engineering, Electrical, Electronics engineering or relevant technical major -2+ years of experience in same position -Experience in Control systems (automation, electrical, pneumatic equipment) -Experience in PLC/PAC and programming languages: LD, ST for Beckhoff, Omron, Mitsubishi; Motion: SCARA ROBOT, 6 Axes ROBOT, Beckhoff XTS -Technical drawings (electrical and pneumatics) -CAD electrical design software: SEE-Electrical expert, SolidWorks Electrical, EPLAN -Fundamental of electrical metrology -Vison system: Cognex insight /VIDI / Cognex Designer, Keyence. -Fluent in English",Lương: Cạnh tranh,07-12-2023
"SCHAEFFLER VIETNAM CO., LTD","Mô tả Công việc • Work with digitalization team in building end-to-end platforms and solutions for manufacturing environment, and visualization of data driven solutions. • Participate in and drive design-thinking sessions to understand and define the functional requirements. • Work on developing engaging and user-centric web and mobile applications with a cross-functional team consisting of product/project managers, solutions architects, software engineers, DevOps, and other specialists. • Designing automation test cases and executing tests on Desktop and Mobile; • Design and create automated tests to ensure the functionality of solutions components and applications • Facing directly to Customers to discuss/negotiate about Test Technical/Test Plan... • Handle Testing part of department, distribute testers between suitable projects in department • Review test technical & guide/train external testers to complete their jobs/reach to higher test levels • Consultant to projects for Test domain • Create and update documentations and testing knowledge, estimation • Review and analyze system specifications for validity and feasibility. • Make test strategy, test scenario if needed • Ensure projects’ quality in department • Suggest/propose how to level up members’ skills, improve productivity • Coaching other junior team members to help them reaching the maximum potential.",Software Quality Assurance (Tester),Đồng Nai Hồ Chí Minh,"Yêu Cầu Công Việc • Bachelor or master’s degree in computer science, or related area • At least 4 years’ experience with software testing, good testing techniques and testing methodologies;. • Bachelor in IT or any comparable course of studies • Practical knowledge in software development and experience in best practices of testing • Practical knowledge in agile software development • Good at creating and executing the manual test cases (UI/UX, Functional, Security, Responsive Web Application and Mobile Application…); • Experienced in Selenium, Appium, Robot Framework to create automation tests on mobile would be preferred; • Strong debugging and analysis skills; • Experienced in using testing tools like Jira, Test Rail…; • Experienced in working in Agile/Scrum; • Being able to communicate with clients in English. • Possess very good English communication and interpersonal skills.",Lương: Cạnh tranh,15-11-2023
Công Ty TNHH Groove Technology Vietnam,"Mô tả Công việc Groove Technology is a cutting-edge software provider specializing in Logistics and eCommerce, and custom software systems. We seek to attract and retain the smartest and most capable staff in and around Ho Chi Minh City to offer the highest level of service to our customers from Hong Kong, Australia, and Europe. We are a dynamic, process-oriented company with a keen focus on high-quality delivery and continuous improvement. We seek open-minded, creative, proactive professionals capable of thinking outside of the box and who are comfortable sharing their ideas. Your responsibilities will include: Work directly with foreign software engineers and product owners in AU. Using, modifying, and maintaining ETL/data-pipeline/parsing framework to work with multiple data sources. Reporting to the Project Manager and Tech Lead. Liaising with the key stakeholders of the project. Delivering fully implemented vertical feature sets based on the specification within estimates and without defects. Identify and mitigate risk in the project’s implementation. Participating in code reviews. Designing and optimizing tables and queries for MS SQL Server.",FULLSTACK .NET DEVELOPER,Hồ Chí Minh,"Yêu Cầu Công Việc To be successful in this role you must have: Ability to work independently with little supervision. 4+ years working as an Engineer delivering projects using the Microsoft stack with C# .NET Framework, .NET Core, or .NET Experience building and integrating with RESTful web services built using ASP .NET Web API or ASP .NET Core. Experience building Web applications using HTML, JavaScript, and CSS. Experience with source control systems such as SVN or GIT. Experience creating, maintaining, optimizing, and writing queries for the relational database: MS SQL Server,.. Experience with data parsing – knowledge of regular expression, HTML, DOM, and XPATH Experience with a message broker/message bus framework such as AWS SQS, RabbitMQ, nServiceBus or similar. Experience using various dependency injection frameworks such as Ninject, Autofac, Unity, Spring, etc. The following is considered highly advantageous: Experience with ETL, EDI, and data automation,… to handle, transform, and sync data between systems. Experience with AWS: API Gateway, SQS, S3, Lambda,… or similar. Experience with website crawling/parsing. Experience with data manipulation/wrangling. Experience with .NET Core. Experience with Golang Experience using an ORM library such as Entity Framework. Exposure to any kind of No-SQL database technologies. Experience integrating with 3rd party systems. Experience with single page web app development with Angular, ReactJs or similar Why you’ll love working here? Working environment: Hybrid working model (company office and home office) Work-life balance Work in an open-minded, friendly, positive, transparent environment. Compensations Full salary during the 2-month probation period Full contribution to social insurance after probation 13th-month bonus 11 public holidays, 14 days of annual leave, and an extra 2 annual leave added for every 3 years of service Payment for up to 6 unused annual leaves. 02 days of paid sick leave without doctor’s document requirement Other leave: Christmas, Paid Paternity Premium Healthcare: Premium private insurance and 24/7 Accident Insurance Premium Annual Health Check Up Other benefits: Birthday, Family care (Wedding, Babycare, etc.), Inpatient treatment Milestone Anniversaries Financial support for professional training certificates TechTalks, Soft skills workshops English training class Wellness activities (i.e. yoga, badminton) Company trip, Year-end-party, Regular beer night out Type of leaves",Lương: Cạnh tranh,11-12-2023
Công ty Cổ phần Dịch vụ Di Động Trực tuyến (Ví MoMo),"Mô tả Công việc MoMo is the market leader in mobile payments in Vietnam. We strive to make life better for every Vietnamese with innovation in technology. As many parts of the business grow, we are looking for an experienced Data Engineer to join the team. At MoMo BigData AI department, we focus on Smart, Efficienct, Execellent execution and data quality which providing high quality marterial for: Business Performance, App Performance monitoring. ML products such as recommendation, personalization, risk scoring, fraud detection, promotion targeting and financial services. We are striving to build the new hydrid data platform on multiple cloud vendors helping us to better control the budget and technologies behind. What you will do With the AI-first company mission, design and build the self-serve data platform to serve people in MoMo and partner needs. They will be allocated resources based on their needs to: Ingesting multiple data sources, from batch to stream, from pull to push mechanism. Developing and deploying the resilient data pipeline in the data lake, data warehouse, and streaming data. Delivering the derived data downstream with high quality, such as BI solution (PowerBI, Google Data Studio,…), Marketing Platform, Promotion Platform, and Experiment Platform,… in multiple ways (API, Dataset, Streaming Data,…) Monitoring the data quality of data pipelines in the data platform. Monitoring and optimizing resource usage. Design and build the Data Management Systems enabling the Data Governance team and data consumers: Managing the data life cycle in the big data platform. Having MoMo data ecosystem self-exploration ability. Proving the single source of truths to multiple downstream with high quality. Managing the attribution infrastructure cost from various big projects, teams, and departments. Design and build the Data Loss Prevention (DLP) solution to protect our data and achieve data visibility in large organizations. Collaborate with Machine Learning Engineers, Data Scientists, Business Analysts, Data Analysts, Product Owners, and Product Operators to strive for greater functionality in our data systems.",Senior Data Engineer,Hồ Chí Minh,"Yêu Cầu Công Việc Love of data. You run “SELECT COUNT(SHEEP) FROM BACKYARD” during your sleep! Strong programming skills: You have 3+ years of experience as a data engineer or software engineer for data intensive applications. You have 3+ years of experience with a scripting language (Python / Java / Go / Scala) for data processing and analysis. Language: Java/Kotlin, Python, Scala, VueJs, BashScripts; Infrastructure: Google Cloud Platform, Amazon Web Service, Kubernetes, Docker; Data Warehouse: BigQuery, Oracle; Data Source: App Events, Oracle, MySQL, MSSQL, Kafka, Pubsub, REST API; Data Pipeline Orchestration: Airflow; BI: Datastudio, PowerBI; Problem-solving skills, Teamwork spirit; Experience with cloud platforms such as Google Cloud Platform or Amazon Web Service is a plus.",Lương: Cạnh tranh,07-12-2023
Ngân Hàng TMCP Việt Nam Thịnh Vượng - VPBANK,"Mô tả Công việc 1. Major Activities: Designing and building toolchains and workflows that enable self-service capabilities for software development teams Designing and building CI/CD pipeline for application. Design, provision and operate cloud platform. Anticipate challenges and am able to influence the technical direction of the team to execute on that vision. Push boundaries to generate and implement breakthrough ideas that aim to create new feature/ more advance capability of the platform.",Cloud DevOps Engineer - Hà Nội,Hà Nội,"Yêu Cầu Công Việc 2. Relevant Knowledge/ Expertise/ Skills: 4+ years of experience as a DevOps Engineer or equivalent software-engineering role. 4+ years of experience in software engineering Proficiency in one or more coding languages, preferably Java or .NET Experience with CI/CD workflows and tools: Jenkins, Artifactory, Nexus, CircleCI, GitLabCI, Ansible, etc. Experience with development platforms: AWS, Azure, GCP. Experience with containerization platforms and technologies: Docker, Kubernetes, OpenShift Experience in network, server, and application-status monitoring. Strong automation scripting skills. Experience in configuration management, test-driven development and release management. Strong analytical and troubleshooting skills. Experience with agile development and strong understanding of DevOps principles. Ability to investigate and analyze information, and to draw conclusions. Flexibility, adaptability and desire to learn new technologies. Mentor and coach Officer/Senior DevOps engineers. 3. Educational Qualifications: Bachelor’s degree in Computer Science, Engineering, or relevant field. 4. Relevant Experience: Strong collaboration skills, with a demonstrated ability to work well as part of the team. Be able to catch up and manage works quickly and effectively Be able to work independently with high pressure, good in teamwork Careful, responsible, and secure in protecting information/data belong to Bank Good knowledge of risk management principles, methodology and practice Good in English",Lương: Cạnh tranh,04-12-2023
KDDI Vietnam Corporation,"Mô tả Công việc We are looking for a developer to support software projects, including development application on low-code platform, development Bot on RPA platforms and others. The developer's role will include the design, deployment and maintenance of software based on customer requirements.",kỹ sư phần mềm,Hà Nội,"Yêu Cầu Công Việc Must have Bachelor’s degree in Computer Science/ Information Technology or Electronics and Telecommunication or related field Knowledge and experience in software development Experience in any of the following programming languages/ software C/C++, Python, VB Script, Java, JavaScript, C#/.Net... Understanding of UI elements, APIs, Database interfaces etc. Presentation skills, structured problem-solving skills Good logical thinking and critical thinking English communication – intermediate level Proficient in using MS Excel, MS Word, and MS PowerPoint Proactive, self-controlling tasks, teamwork Nice to have Experience with RPA tools such as - Blue Prism, Automation Anywhere, UiPath, Work Fusion or OCR tools such as ABBYY, Document Understanding of UiPath, Microsoft … is an advantage Ability to work under pressure and to deadline",Lương: Cạnh tranh,10-12-2023
