companyName,description,jobName,location,require,salary,timePost
TRAN DUC GROUP - CÔNG TY CỔ PHẦN TRẦN ĐỨC,"Mô tả Công việc Participate in building Data Warehouse solutions,... Build the necessary infrastructure to extract, transform, and load data optimally from multiple data sources. Perform data preparation for data models (data cleaning, data aggregation). Design and develop data warehouse / data lake. Evaluate and develop new technologies / solutions to meet the company's business operations. Other tasks assigned by superiors.",DATA ENGINEER,Hồ Chí Minh,"Yêu Cầu Công Việc 1. Education: Bachelor's degree or higher in Information Technology, Telecommunications, Information Systems, or related fields. 2. Experience: At least 1 years of experience working in IT companies in the role of Data Engineer or a similar role. 3. Skills: Database tools: Microsoft Excel and SQL Data visualization Statistical programming languages: Python or R Data cleaning Statistical programming Probability and statistics Machine Learning (ML) Data Warehousing - Data Architecture - Coding/Programming - Apache Hadoop-Based Analytics Good understanding of data integration Ability to analyze, summarize, and write reports Proficient in office software 4. Abilities: Excellent communication and presentation skills Teamwork and independent work skills Organization and time management skills Ability to work under pressure Diligent, enthusiastic, friendly, and responsible in work Responsibility for ensuring information security: Comply with the company's information security regulations and regulations. Good English",Lương: Cạnh tranh,19-12-2023
Yes4All Trading Services Company Limited,"Mô tả Công việc Yes4All is one of the leading brands for home sporting goods & furniture in the e-commerce market. Founded in 2010, we have strived to be the world leader in e-commerce enablers in term of trading, product creating and e-commerce servicing. Based in California with an operation office in HCMC, we have more than 500 young and talented members with expert knowledge and experience in the e-commerce industry. We are on an ambitious journey to dominate not only US e-commerce market but also to enter new e-commerce markets of more than 15 countries in Europe, Asia and North America, not only Amazon channel but also Walmart, Wayfair among others. Besides, Home sporting goods, Furniture, Outdoor and Gardening are also great opportunities that we desire to occupy and create significant values. With our steady knowledge in E-commerce, Yes4All started to provide end-to-end ecommerce-enabler service in order to help Vietnamese and global manufacturers or struggling sellers bring their products to the US & International markets. Our mission: Connect the Worldwide Resources & create innovative platform to bring products and services from innovators and manufacturers to worldwide customers more efficiently. Our vision: To be the world leader of e-commerce enabler in term of trading, product creating, and e-commerce servicing. JOB DESCRIPTIONS Design, further develop, and implement ETL processes and BI systems in accordance with the defined architecture. Take responsibility for the accuracy of data. Manage and enhance the performance of the Data Warehouse and Data Marts. Create a tracking dashboard to ensure data quality within the relevant processes. Provide data to support analytics roles, including data scientists and analysts, from various sources such as databases, APIs, websites, etc. Handle large datasets from the market and streaming data. Write procedural and technical documentation, including data dictionaries and data governance. Research and implement new technologies (preferably open source) to enhance system performance.",Data Engineer,Hồ Chí Minh,"Yêu Cầu Công Việc SKILL AND EXPERIENCE 2 years of experience in similar roles. Experience with SQL Databases, particularly Oracle and PostgreSQL (PostgreSQL is a plus). Proficiency in Python, Airflow, Docker, MinIO, Crawler libraries, Data Dictionary Platforms, etc. Strong analytical skills, logical thinking, problem-solving abilities, and effective communication. Adaptability with various programming languages. Nice to have experience with OTP/Captcha. Familiarity with encryption algorithms and hash codes such as SHA256. Additional experience with Java, JavaScript, Spark, Kafka, RabbitMQ is a plus. Strong data analysis skills and the ability to derive meaningful insights from data. Capacity to work well under high-pressure conditions. Demonstrated teamwork, independence, a can-do attitude, and self-study skills. WHY YOU WILL LOVE JOINING US? FOR YOU TO JOIN Financial Well-being: A competitive salary with 13th month salary, annual performance bonus and a variety of allowances. Salary review: annually or on excellent performance. Activities: company trips, team-building, and other customized monthly bonding events. Annual leaves: 16 days off and 01 Birthday Leave per year. Healthcare: annual health check, insurance according to Labor Law and extra PTI Insurance package. Working Environment: dynamic, friendly environments with working time flexibility (Mon-Fri), and other perks include snacks, coffee, and healthy food provided daily suited for hardworking, fun, and team collaboration. FOR YOU TO GROW Ambition: We are now keeping on with our hyper growth to multicategory, multichannel, multimarket, and expanding into the world largest e-commerce enabler. Hence, there will continuously be opportunities to challenge yourself, learn new skills and knowledge. Challenges: Your voice can always be heard as we embrace the eagerness of learning and sharing. You can be your own boss and create your own value with the ability to take initiative and make decisions in all aspects of work. Chances: Be led and coached by experienced and inspirational leaders and participate in various training courses where you can enlarge your knowledge and experience in the E-commerce and Supply Chain industry. FOR YOU TO STAY People: Having a headquarter in the US and an operation office in Vietnam, our team is young and highly motivated. You will be working with and alongside members having experiences from International Corporations or high profile from Vietnam that share the same passion and dedication. Culture: Our working environment is humble, collaborative and 100% healthy. We promote Exchange & Speak out, you can receive transparent and supportive feedback so you can perform the best. Career path: Provide you a great career path, open to rotating for your better understanding of the company and contribute across many of our functions. And much more, join us and let yourself explore other fantastic things!",Lương: Cạnh tranh,14-01-2024
Công Ty CP Chứng Khoán VNDIRECT,"Mô tả Công việc MỤC TIÊU VỊ TRÍ: - Phát triển hệ thống Data warehouse theo định hướng phát triển của tổ chức - Phát triển các Data mart phục vụ cho nhu cầu khai thác dữ liệu - Xây dựng phát triển đội ngũ, gắn kết các thành viên để đạt mục tiêu chung của tập thể MÔ TẢ CÔNG VIỆC: - Tiếp nhận các yêu cầu phát triển, phân tích, đánh giá và đưa ra phương án thực hiện phù hợp - Hướng dẫn team Data Engineer thực hiện theo phương án đã thống nhất, review đảm bảo chất lượng công việc - Giám sát đảm bảo hệ thống phát triển theo đúng quy trình đã có - Giải quyết các vấn đề kỹ thuật phát sinh - Nghiên cứu các công nghệ hiện tại và đề xuất thay đổi khi cần thiết - Training đào tạo kỹ năng cho các thành viên khác",Senior Data Engineer,Hà Nội,"Yêu Cầu Công Việc - Có ít nhất 05 năm kinh nghiệm ở vị trí Data Engineer hoặc các vị trí tương đương. Ưu tiên ứng viên có kinh nghiệm làm việc trực tiếp với hệ thống Data warehouse - Am hiểu các hệ điều hành và các loại cơ sở dữ liệu khác nhau. Có kinh nghiệm làm việc với Hadoop Eco System là lợi thế - Nắm được cách thiết kế Data warehouse theo chuẩn Kimball - Thành thạo viết truy vấn và tối ưu câu lệnh SQL - Hiểu biết và nắm vững quy trình phát triển hệ thống - Sử dụng thành thạo các công cụ: Jira, Git, Xshell, SSMS, MySQL Workbench, DataGrip, .. - Có khả năng làm việc độc lập và làm việc nhóm - Có khả năng tư duy và giải quyết vấn đề - Có khả năng nghiên cứu và tự học hỏi - Yêu thích tìm hiểu công nghệ, cập nhật xu hướng công nghệ mới và có khả năng phân tích ứng dụng công nghệ trong các bài toán cụ thể CHẾ ĐỘ ĐÃI NGỘ: 1. Cộng đồng những người làm nghề chính trực và dấn thân phụng sự - Môi trường làm nghề tài chính chuyên nghiệp. - Làm việc với tinh thần làm chủ, sáng tạo và thách thức. 2. Thu nhập theo năng lực - Thu nhập xứng đáng theo năng lực và giá trị đóng góp. - Được xem xét và đánh giá điều chỉnh thu nhập hàng năm. - Trong 02 tháng thử việc hưởng 85% thu nhập, được truy lĩnh 15% sau khi ký hợp đồng chính thức (tương đương 100% trong thời gian thử việc). - Tham gia BHXH, BHYT, BHTN theo đúng quy định luật lao động. - Các bảo hiểm sức khỏe và bảo hiểm tai nạn 24/24. 3. Tổ chức học tập và văn hóa sôi nổi - Không gian làm việc mở với trang thiết bị hiện đại. - Các hoạt động văn hóa, thiện nguyện phong phú và sôi nổi.",Lương: Cạnh tranh,28-12-2023
Tổng công ty Cổ phần Bảo hiểm Bưu điện,"Mô tả Công việc - Phát triển hệ thống Data warehouse theo định hướng phát triển của tổ chức - Phát triển các Data mart phục vụ cho nhu cầu khai thác dữ liệu - Xây dựng phát triển đội ngũ, gắn kết các thành viên để đạt mục tiêu chung của tập thể - Tiếp nhận các yêu cầu phát triển, phân tích, đánh giá và đưa ra phương án thực hiện phù hợp - Hướng dẫn team Data Engineer thực hiện theo phương án đã thống nhất, review đảm bảo chất lượng công việc - Giám sát đảm bảo hệ thống phát triển theo đúng quy trình đã có - Giải quyết các vấn đề kỹ thuật phát sinh - Nghiên cứu các công nghệ hiện tại và đề xuất thay đổi khi cần thiết - Training đào tạo kỹ năng cho các thành viên khác",Senior Data Engineer,Hà Nội,"Yêu Cầu Công Việc - Có ít nhất 05 năm kinh nghiệm ở vị trí Data Engineer hoặc các vị trí tương đương. Ưu tiên ứng viên có kinh nghiệm làm việc trực tiếp với hệ thống Data warehouse - Am hiểu các hệ điều hành và các loại cơ sở dữ liệu khác nhau. Có kinh nghiệm làm việc với Hadoop Eco System là lợi thế - Nắm được cách thiết kế Data warehouse theo chuẩn Kimball - Thành thạo viết truy vấn và tối ưu câu lệnh SQL - Hiểu biết và nắm vững quy trình phát triển hệ thống - Sử dụng thành thạo các công cụ: Jira, Git, Xshell, SSMS, MySQL Workbench, DataGrip, .. - Có khả năng làm việc độc lập và làm việc nhóm - Có khả năng tư duy và giải quyết vấn đề - Có khả năng nghiên cứu và tự học hỏi - Yêu thích tìm hiểu công nghệ, cập nhật xu hướng công nghệ mới và có khả năng phân tích ứng dụng công nghệ trong các bài toán cụ thể CHẾ ĐỘ ĐÃI NGỘ: 1. Cộng đồng những người làm nghề chính trực và dấn thân phụng sự - Môi trường làm nghề tài chính chuyên nghiệp. - Làm việc với tinh thần làm chủ, sáng tạo và thách thức. 2. Thu nhập theo năng lực - Thu nhập xứng đáng theo năng lực và giá trị đóng góp. - Được xem xét và đánh giá điều chỉnh thu nhập hàng năm. - Trong 02 tháng thử việc hưởng 85% thu nhập, được truy lĩnh 15% sau khi ký hợp đồng chính thức (tương đương 100% trong thời gian thử việc). - Tham gia BHXH, BHYT, BHTN theo đúng quy định luật lao động. - Các bảo hiểm sức khỏe và bảo hiểm tai nạn 24/24. 3. Tổ chức học tập và văn hóa sôi nổi - Không gian làm việc mở với trang thiết bị hiện đại. - Các hoạt động văn hóa, thiện nguyện phong phú và sôi nổi.",Lương: Cạnh tranh,27-12-2023
MOVI Việt Nam,"Mô tả Công việc Job Objective: Building a platform with strong architecture Be part of the data & and analytics center of excellence (CoE) working on a wide range of data infrastructure and data engineering projects across Key Responsibilities 1. Data Architecture: Architects, Designs, Builds, Develops, Maintains, and Implements new data systems where needed, the Architecture with best practices and data infrastructure reliable and scalable. Responsible for deploying secure and well-tested software that meets privacy and compliance requirements, and maintains and improves CI / CD pipeline. Proactively drive the effort of identifying opportunities to manage data and provide data solutions. Evaluate various data architectures in the market and utilize them to develop data solutions to meet business requirements. Drive the delivery of data products and services into systems and business processes in compliance with internal regulatory requirements. Oversee the review of internal and external business and product requirements for data operations and activity and suggest changes and upgrades to systems and storage to accommodate ongoing needs 2. Data Integration: Review and analyze existing data systems, and make recommendations on improvement, maintenance, or other factors to improve the system, automate manual processes, optimize data delivery, and re-design infrastructure for scale and performance and greater scalability Monitoring and quality assurance within the system (Server/ Services/ETL /Networking/Security). Design, build, and maintain optimized data pipelines and ETL solutions as business support tools in providing analysis and real-time analytics platforms for critical decision-making, support of data and analytics projects, integrating new sources of data into our central data warehouse to meet business requirements, and experience building and optimizing ‘big data’ architectures for read-and-write performance. Ensure data assets are organized and stored efficiently so that information is high quality, reliable, flexible, and efficient. Manage and enhance to ensure that DWH, Data mart and BI tools work stably through aligned business/ system/ and data processes. Ensure data is accessible to the required personnel to ensure the ease of understanding and access to the data needed to make informed business decisions. Experience with building reports and data visualizations, using data from the data warehouse or other sources and mapping are helpful (but not required) 3. Project Management: The role plays is highly collaborative and, as such, works closely with data analysts, data scientists, and other data consumers within the business. Establishes the documentation of reports, data infrastructure, privacy controls and develops, maintains technical specification documentation, and processes, and effectively manages data systems that have the relevant security. Work with team leads to resolve people problems and projects to ensure maximum productivity. Understand business and technical requirements and constraints to design effective software solutions. Strong stakeholder management and collaboration with them to understand user requirements Effective time management skills, including demonstrated ability to manage and prioritize multiple tasks and projects. Experience working in Agile teams to lead successful digital transformation projects, having mastered Agile principles, practices, and Scrum methodologies 4. Talent Development: Support line manager training and mentor “Junior Data Engineer” Provide training and guidance on new systems and new skills and share knowledge that is being implemented into the team adding to the already Ability to work effectively in teams, in both a lead and support role. Take on research to improve data processing and any implemented frameworks used by our team Experience supporting and working with cross-functional teams in a dynamic environment. Ability to build processes supporting data transformation, data structures, metadata, dependency, and workload management. 5. Direct Manager (Key Relationships): Senior Manager/ Manager, BI&A And other tasks as assigned. Continuous learning and improvement mindset Ability to work long and extended hours as needed Ability to prioritize own time and workload Ability to read, understand, and write code Have teamwork skills, work independently, and self-study. Good number sense, listening, logical thinking, analytical thinking (with keen attention to detail), problem-solving abilities, and communication skills (both written and verbal).",Senior Data Engineer,Hồ Chí Minh,"Yêu Cầu Công Việc Bachelor’s degree (or higher) in Computer Science, Software Engineering or Information Technology, MIS, Economics, Finance, Statistics, Mathematics, or a related field (Financial Services, Banking, Insurance, Securities). At least 3 years experience (typically 5+ years) in Data Engineering and ETL and Analytics tools (R, Python, Pentaho, dbt…) and BI&A Visualization systems (Metabase, Power BI, OBIEE, SAS VA, IBM, Yellowfin, Tableau, Qlik …), and In-depth knowledge of BI technologies, methodologies, and their application like Metabase, PowerBI, Tableau, Looker etc Experience with building data pipelines from various business applications like Salesforce, Marketo, NetSuite, Workday, Odoo,… and databases (MsSQL, Oracle, IBM, SAP, MySQL, AWS Redshift). Experience designing and implementing large-scale distributed data pipelines and working with cloud infrastructure services like AWS/GCP/Azure (preferably AWS), (Big Query, Data Flow, Amazon EKS, EMR, Docker/ECS, and Redshift.) Experience with the LAN or VLAN, and digital organizing tools, like Active Directory Action Network, ActionKit, or Blue State Digital, is a plus (but not required). Experience with big data tools: Hadoop, Spark, Kafka, Spark & Kafka Streaming, Python, Scala, Talend, Azkaban, Luigi, Airflow etc Good at math and Advanced SQL knowledge and experience working with relational databases as well as working familiarity with a variety of databases is a big plus. Good report-writing skills Ability to communicate in English. Benefit: Full social insurance following Vietnamese Law 100% salary during probationary period Personal health and spouse insurance Annual leave, Annual heath-check Professional and Transparent working environment Buying company products at a reduced and with promotional offers",Lương: Cạnh tranh,04-01-2024
CareerViet's client,"Mô tả Công việc Job Objective: Building a platform with strong architecture Be part of the data & and analytics center of excellence (CoE) working on a wide range of data infrastructure and data engineering projects across Key Responsibilities 1. Data Architecture: Architects, Designs, Builds, Develops, Maintains, and Implements new data systems where needed, the Architecture with best practices and data infrastructure reliable and scalable. Responsible for deploying secure and well-tested software that meets privacy and compliance requirements, and maintains and improves CI / CD pipeline. Proactively drive the effort of identifying opportunities to manage data and provide data solutions. Evaluate various data architectures in the market and utilize them to develop data solutions to meet business requirements. Drive the delivery of data products and services into systems and business processes in compliance with internal regulatory requirements. Oversee the review of internal and external business and product requirements for data operations and activity and suggest changes and upgrades to systems and storage to accommodate ongoing needs 2. Data Integration: Review and analyze existing data systems, and make recommendations on improvement, maintenance, or other factors to improve the system, automate manual processes, optimize data delivery, and re-design infrastructure for scale and performance and greater scalability Monitoring and quality assurance within the system (Server/ Services/ETL /Networking/Security). Design, build, and maintain optimized data pipelines and ETL solutions as business support tools in providing analysis and real-time analytics platforms for critical decision-making, support of data and analytics projects, integrating new sources of data into our central data warehouse to meet business requirements, and experience building and optimizing ‘big data’ architectures for read-and-write performance. Ensure data assets are organized and stored efficiently so that information is high quality, reliable, flexible, and efficient. Manage and enhance to ensure that DWH, Data mart and BI tools work stably through aligned business/ system/ and data processes. Ensure data is accessible to the required personnel to ensure the ease of understanding and access to the data needed to make informed business decisions. Experience with building reports and data visualizations, using data from the data warehouse or other sources and mapping are helpful (but not required) 3. Project Management: The role plays is highly collaborative and, as such, works closely with data analysts, data scientists, and other data consumers within the business. Establishes the documentation of reports, data infrastructure, privacy controls and develops, maintains technical specification documentation, and processes, and effectively manages data systems that have the relevant security. Work with team leads to resolve people problems and projects to ensure maximum productivity. Understand business and technical requirements and constraints to design effective software solutions. Strong stakeholder management and collaboration with them to understand user requirements Effective time management skills, including demonstrated ability to manage and prioritize multiple tasks and projects. Experience working in Agile teams to lead successful digital transformation projects, having mastered Agile principles, practices, and Scrum methodologies",Senior Data Engineer,Hồ Chí Minh,"Yêu Cầu Công Việc Bachelor’s degree (or higher) in Computer Science, Software Engineering or Information Technology, MIS, Economics, Finance, Statistics, Mathematics, or a related field (Financial Services, Banking, Insurance, Securities). At least 3 years experience (typically 5+ years) in Data Engineering and ETL and Analytics tools (R, Python, Pentaho, dbt…) and BI&A Visualization systems (Metabase, Power BI, OBIEE, SAS VA, IBM, Yellowfin, Tableau, Qlik …), and In-depth knowledge of BI technologies, methodologies, and their application like Metabase, PowerBI, Tableau, Looker etc Experience with building data pipelines from various business applications like Salesforce, Marketo, NetSuite, Workday, Odoo,… and databases (MsSQL, Oracle, IBM, SAP, MySQL, AWS Redshift). Experience designing and implementing large-scale distributed data pipelines and working with cloud infrastructure services like AWS/GCP/Azure (preferably AWS), (Big Query, Data Flow, Amazon EKS, EMR, Docker/ECS, and Redshift.) Experience with the LAN or VLAN, and digital organizing tools, like Active Directory Action Network, ActionKit, or Blue State Digital, is a plus (but not required). Experience with big data tools: Hadoop, Spark, Kafka, Spark & Kafka Streaming, Python, Scala, Talend, Azkaban, Luigi, Airflow etc Good at math and Advanced SQL knowledge and experience working with relational databases as well as working familiarity with a variety of databases is a big plus. Good report-writing skills Ability to communicate in English. Benefit: Full social insurance following Vietnamese Law 100% salary during probationary period Personal health and spouse insurance Annual leave, Annual heath-check Professional and Transparent working environment Buying company products at a reduced and with promotional offers",Lương: Cạnh tranh,07-01-2024
