companyName,description,jobName,location,require,salary,timePost
Anh Văn Hội Việt Mỹ (VUS),"Mô tả Công việc • Gather, validate, clean and organize to produce a standard operating data set for analysis. • Perform revenue forecast for budget preparation and monthly/quarterly P&L re-forecast. • Prepare weekly and monthly operational and financial performance reports • Prepare dashboards for weekly and monthly operational and financial performance, tracking key operational and financial metrics by programs, by campuses (compared with target, forecast and historical data) and predictive analysis. • Work closely with Operation teams to have update on the insights of business trend, change in business rules (if any) • Work with data team to build reports, dashboards and forecasting models.",Senior Data Analyst (Finance Dept),Hồ Chí Minh,"Yêu Cầu Công Việc • Education: Bachelor’s Degree in Computer Science/ Economics/ Statistics/ Finance/ Accounting • Age: 23-30 • Experience: 3+ years of data analytics or other relevant experiences • Computer skills: Professional in SQL, Excel, PBI and R/Python/SPSS • Strong mathematical skills to collect, measure, organize and analyze data • Strong logical and technical skills for data modeling, data mining, and segmentation. • Solid problem-solving, detail-oriented and able to perform in a high-pressure environment • Solid knowledge of how to create and apply the most accurate algorithms to datasets in order to find solutions • Good at queries, writing reports, and making presentations • Team-working skills • Verbal and Written communication skills • Proven working experience in data analysis",Lương: Cạnh tranh,09-01-2024
TAKI GROUP,"Mô tả Công việc Develop APIs for websites, mobile apps, and integrate them with systems using Node.js and Python Database administration, data modeling according to the company's business requirements Execute tasks and collaborate within a team under project management supervision",BACK END DEVELOPER,Hà Nội,"Yêu Cầu Công Việc Experience in Back-end development with Node.js Experience with NoSQL databases like MongoDB, DynamoDB, etc Preferred candidates with experience in Git and Gitflow Creative, agile, diligent, detail-oriented, and able to handle high work pressure Preference will be given to candidates with prior experience working with NestJS Ability to work independently or as part of a team, taking initiative to solve work-related issues according to deadlines and guidelines","Lương: 9,9 Tr - 33 Tr VND",08-01-2024
Yes4All Trading Services Company Limited,"Mô tả Công việc Yes4All is one of the leading brands for home sporting goods & furniture in the e-commerce market. Founded in 2010, we have strived to be the world leader in e-commerce enablers in term of trading, product creating and e-commerce servicing. Based in California with an operation office in HCMC, we have more than 500 young and talented members with expert knowledge and experience in the e-commerce industry. We are on an ambitious journey to dominate not only US e-commerce market but also to enter new e-commerce markets of more than 15 countries in Europe, Asia and North America, not only Amazon channel but also Walmart, Wayfair among others. Besides, Home sporting goods, Furniture, Outdoor and Gardening are also great opportunities that we desire to occupy and create significant values. With our steady knowledge in E-commerce, Yes4All started to provide end-to-end ecommerce-enabler service in order to help Vietnamese and global manufacturers or struggling sellers bring their products to the US & International markets. Our mission: Connect the Worldwide Resources & create innovative platform to bring products and services from innovators and manufacturers to worldwide customers more efficiently. Our vision: To be the world leader of e-commerce enabler in term of trading, product creating, and e-commerce servicing. ROLES & RESPONSIBILITIES Build dashboards that provide accurate and actionable insights Automate daily/weekly sales performance review reports Collaborate with Data Engineer team to ensure data accuracy Conduct exploratory data analysis to go deep into the data to develop hypotheses and to answer complex business questions Other ad hoc duties as assigned by Manager.",Data Analyst,Hồ Chí Minh,"Yêu Cầu Công Việc SKILL AND EXPERIENCE 1+ years of experience in Data Analytics or Business Intelligence. Proficiency in SQL (PostgreSQL and MySQL are preferred) Proficiency in Power BI is a must. Hands-on experience programming with Python Independent leaner, self-motivated, and willing share knowledge with team members. Work proactively with key business partners to closely monitor risks and opportunities and identify improvement opportunities NICE TO HAVE Experience in e-commerce industry Good knowledge in data warehouse, ETL, Data Pipeline. WHY YOU WILL LOVE JOINING US? FOR YOU TO JOIN Financial Well-being: A competitive salary with 13th month salary, annual performance bonus and a variety of allowances. Salary review: annually or on excellent performance. Activities: company trips, team-building, and other customized monthly bonding events. Annual leaves: 16 days off and 01 Birthday Leave per year. Healthcare: annual health check, insurance according to Labor Law and extra Bao Viet Insurance package. Working Environment: dynamic, friendly environments with working time flexibility (Mon-Fri), and other perks include snacks, coffee, and healthy food provided daily suited for hardworking, fun, and team collaboration. FOR YOU TO GROW Ambition: We are now keeping on with our hyper growth to multicategory, multichannel, multimarket, and expanding into the world largest e-commerce enabler. Hence, there will continuously be opportunities to challenge yourself, learn new skills and knowledge. Challenges: Your voice can always be heard as we embrace the eagerness of learning and sharing. You can be your own boss and create your own value with the ability to take initiative and make decisions in all aspects of work. Chances: Be led and coached by experienced and inspirational leaders and participate in various training courses where you can enlarge your knowledge and experience in the E-commerce and Supply Chain industry. FOR YOU TO STAY People: Having a headquarter in the US and an operation office in Vietnam, our team is young and highly motivated. You will be working with and alongside members having experiences from International Corporations or high profile from Vietnam that share the same passion and dedication. Culture: Our working environment is humble, collaborative and 100% healthy. We promote Exchange & Speak out, you can receive transparent and supportive feedback so you can perform the best. Career path: Provide you a great career path, open to rotating for your better understanding of the company and contribute across many of our functions. And much more, join us and let yourself explore other fantastic things!",Lương: Cạnh tranh,09-01-2024
SYBSY Ltd.,"Mô tả Công việc 1. Tham gia xây dựng hệ thống báo cáo BI - Thu thập nguồn dữ liệu kế hoạch hàng tháng (trên Excel hoặc Google Sheet) của các phòng ban để có nguồn dữ liệu xây dựng báo cáo - Kiểm tra tính đúng đắn và chuẩn hóa dữ liệu trước khi đưa vào hệ thống - Trình bày các báo cáo kinh doanh, khách hàng, hàng hóa cho hệ thống BI bằng biểu đồ hoặc hình thức minh họa hợp lý - Hướng dẫn người dùng sử dụng các báo cáo của hệ thống 2. Thực hiện các báo cáo theo yêu cầu - Tiếp nhận và xử lý các yêu cầu về phân tích dữ liệu - Xây dựng báo cáo hoặc truy vấn dữ liệu theo yêu cầu - Đề xuất giải pháp nhằm nâng cao tính cạnh tranh, cải tiến hiệu quả kinh doanh cho Công ty 3. Đảm bảo hệ thống BI vận hành liên tục - Kiểm tra dữ liệu đúng, đủ và tin cậy - Tham gia kiểm tra và xử lý sự cố của hệ thống BI (nếu có)",Data Analyst,Hồ Chí Minh,"Yêu Cầu Công Việc - Tốt nghiệp Đại học trở lên các chuyên ngành CNTT, Phân tích dữ liệu hoặc Tài chính, Kế toán - Tối thiểu 2 năm kinh nghiệm trở lên vị trí tương đương, ưu tiên trong ngành Thời trang/ Bán lẻ/Thương mại điện tử - Biết sử dụng công cụ visualization để biểu diễn dữ liệu như Tableau, Power BI - Có kiến thức, kỹ năng phân tích, thống kê và tổng hợp dữ liệu - Biết sử dụng ngôn ngữ truy vấn CSDL - Hiểu biết về eCommerce hoặc bán lẻ là lợi thế",Lương: 13 Tr - 18 Tr VND,08-01-2024
CÔNG TY TNHH THƯƠNG MẠI NCA (VN),"Mô tả Công việc Tổng hợp báo cáo từ cửa hàng gửi về. Thống kê, phân tích, dự báo dữ liệu từ các báo cáo. Thực hiện báo cáo kết quả theo tuần, tháng. Hỗ trợ các công việc giấy tờ khác.",Data Analyst Intern,Hồ Chí Minh,"Yêu Cầu Công Việc Sinh viên năm cuối hoặc đã tốt nghiệp Cao đẳng/Đại học Chuyên ngành Công nghệ thông tin, Khoa học máy tính, Kỹ thuật phần mềm, Toán Tin hoặc các chuyên ngành tương đương. Có đam mê, mong muốn phát triển về Phân tích dữ liệu là môt lợi thế. Thành thạo Tin học Văn phòng (đặc biệt là Excel).",Lương: 3 Tr - 5 Tr VND,05-01-2024
Công ty Cổ phần Dịch vụ Di Động Trực tuyến (Ví MoMo),"Mô tả Công việc Building, developing, and maintaining automated dashboards to monitor performance metrics; Monitoring data quality to ensure data sources are reliable and relevant for the team’s purposes; Analyzing complex data to drive insightful findings and translating them into meaningful, actionable recommendations for our stakeholders; Designing and implementing solutions and best-practices, with automation and scalability in mind, to empower end-users to become self-reliant; Collaborating with internal team to consolidate requirements, understand business needs, and deliver projects in a timely manner; Ad-hoc Reporting & Data Analysis duties or other responsibilities as required; Types of projects include: customer segmentation; analyses to enhance user acquisition, engagement, conversion, retention; reporting standardization; gamification; A/B testing & experimentation analysis for product development and optimization.","Senior Data Analyst, OTA",Hồ Chí Minh,"Yêu Cầu Công Việc Minimum Qualifications University degree (BA, BSc, etc.) in a quantitative discipline such as Statistics, Computer Science, Mathematics, Information Management; University degree with quantitative/statistics coursework such as Business, Economics, Marketing, or relevant fields. Key Skills/Experience Required Critical: Excellent analytical skills and problem-solving aptitude; Ability to collect, organize, and analyze significant amounts of data with high attention to detail; Ability to visualize findings, create meaningful insights, and arrive at actionable recommendations; Strong spoken and written communication skills (in both English and Vietnamese) to collaborate with team members and to explain findings clearly to internal team as well as stakeholders; Experience writing complex queries in SQL or other SQL-based languages; Work proactively with key business partners to closely monitor risks and opportunities and identify improvement opportunities; Foster strong relationships with business units by establishing a culture of support and shared accountability within the team; Sense of ownership, a growth mindset, and the ability to recommend solutions which are scalable; Self-learner and quick to adopt new knowledge and technical skills; Effectively collaborate within a team as well as work independently. Desirable: Experience with BI/analytics/statistics tools and languages (Google BigQuery, Google Data Studio, R, Python, etc.); Solid technical/functional knowledge in statistics.",Lương: 22 Tr - 33 Tr VND,23-12-2023
Yes4All Trading Services Company Limited,"Mô tả Công việc Yes4All is one of the leading brands for home sporting goods & furniture in the e-commerce market. Founded in 2010, we have strived to be the world leader in e-commerce enablers in term of trading, product creating and e-commerce servicing. Based in California with an operation office in HCMC, we have more than 500 young and talented members with expert knowledge and experience in the e-commerce industry. We are on an ambitious journey to dominate not only US e-commerce market but also to enter new e-commerce markets of more than 15 countries in Europe, Asia and North America, not only Amazon channel but also Walmart, Wayfair among others. Besides, Home sporting goods, Furniture, Outdoor and Gardening are also great opportunities that we desire to occupy and create significant values. With our steady knowledge in E-commerce, Yes4All started to provide end-to-end ecommerce-enabler service in order to help Vietnamese and global manufacturers or struggling sellers bring their products to the US & International markets. Our mission: Connect the Worldwide Resources & create innovative platform to bring products and services from innovators and manufacturers to worldwide customers more efficiently. Our vision: To be the world leader of e-commerce enabler in term of trading, product creating, and e-commerce servicing. ROLES & RESPONSIBILITIES · Visualize data insights for both business and technical audiences. · Develop descriptive analytics to assist business users in making timely and accurate decisions in various projects. · Use business intelligence tools to process and analyze data. · Other ad hoc duties as assigned by Manager.",Senior Data Analyst,Hồ Chí Minh,"Yêu Cầu Công Việc SKILL AND EXPERIENCE · 2+ years of experience in Data Analytics or Business Intelligence. · Proficiency in SQL. · Experience in Power BI is a must. · Ability to program with Python · Knowledgeable of statistics such as regression, normal distribution, etc. · Very good data and analytical skills including the ability to define and decompose relevant metrics and evaluate the corresponding impacts in the context of business. · Independent leaner, self-motivated, and willing share knowledge with team members. · Work proactively with key business partners to closely monitor risks and opportunities and identify improvement opportunities NICE TO HAVE · Experience in e-commerce industry · Good knowledge in data warehouse, ETL, Data Pipeline. WHY YOU WILL LOVE JOINING US? FOR YOU TO JOIN Financial Well-being: A competitive salary with 13th month salary, annual performance bonus and a variety of allowances. Salary review: annually or on excellent performance. Activities: company trips, team-building, and other customized monthly bonding events. Annual leaves: 16 days off and 01 Birthday Leave per year. Healthcare: annual health check, insurance according to Labor Law and extra PTI Insurance package. Working Environment: dynamic, friendly environments with working time flexibility (Mon-Fri), and other perks include snacks, coffee, and healthy food provided daily suited for hardworking, fun, and team collaboration. FOR YOU TO GROW Ambition: We are now keeping on with our hyper growth to multicategory, multichannel, multimarket, and expanding into the world largest e-commerce enabler. Hence, there will continuously be opportunities to challenge yourself, learn new skills and knowledge. Challenges: Your voice can always be heard as we embrace the eagerness of learning and sharing. You can be your own boss and create your own value with the ability to take initiative and make decisions in all aspects of work. Chances: Be led and coached by experienced and inspirational leaders and participate in various training courses where you can enlarge your knowledge and experience in the E-commerce and Supply Chain industry. FOR YOU TO STAY People: Having a headquarter in the US and an operation office in Vietnam, our team is young and highly motivated. You will be working with and alongside members having experiences from International Corporations or high profile from Vietnam that share the same passion and dedication. Culture: Our working environment is humble, collaborative and 100% healthy. We promote Exchange & Speak out, you can receive transparent and supportive feedback so you can perform the best. Career path: Provide you a great career path, open to rotating for your better understanding of the company and contribute across many of our functions. And much more, join us and let yourself explore other fantastic things!",Lương: Cạnh tranh,09-01-2024
CÔNG TY CỔ PHẦN KINH DOANH F88,"Mô tả Công việc A. MÔ TẢ CÔNG VIỆC 1. Nhiệm vụ chính Tham gia xây dựng các tính năng và thông tin cho sản phẩm Customer360 của Trung tâm Tham gia vào dự án Data Lake của Trung tâm, giúp xác định yêu cầu nghiệp vụ để hỗ trợ xây dựng và kiểm thử dữ liệu trên Data Marts Thiết kế báo cáo Dashboard, báo cáo phân tích đa chiều và phân tích nâng cao cho các đơn vị F88 giúp các đơn vị đưa ra quyết định Thực hiện các phân tích ad-hoc, cung cấp dữ liệu theo yêu cầu đột xuất của đơn vị F88 Hỗ trợ tính toán KPI, Incentives cho các đơn vị F88 2. Thời gian làm việc: 08h30 - 17h30 (Thứ Hai - Thứ Sáu; nghỉ Thứ Bảy + Chủ nhật) 3. Địa điểm làm việc: Tòa nhà N01A - 275 Nguyễn Trãi, Thanh Xuân, Hà Nội B. ĐÃI NGỘ 1. Chế độ chính sách: Lương thưởng RẤT cạnh tranh trên thị trường Thưởng cuối năm + thưởng Lễ/Tết + thưởng sinh nhật + thưởng đột xuất khi hoàn thành tốt nhiệm vụ 12 ngày phép năm + nghỉ phép theo thâm niên BHXH + chế độ bảo hiểm đặc biệt dành cho nhân viên (F88 Care) 2. Môi trường làm việc: Được làm việc trong môi trường trẻ năng động, luôn coi Công nghệ thông tin là yếu tố trọng tâm để phát triển Áp dụng mô hình phát triển phần mềm theo Agile, Scrum Được tiếp cận với các Công nghệ hiện tại tiên tiến nhất trên thế giới hiện nay Môi trường làm việc cởi mở và năng động với các giá trị cốt lõi sâu sắc truyền cảm hứng làm việc đến nhân viên Khuyến khích trao đổi ý tưởng, đề cao sự sáng tạo trong công việc Cơ hội tham gia gắn kết với tập thể thông qua các hoạt động văn hóa sôi động: Teambuilding, Tất niên, 8/3, 20/10, Giáng sinh… 3. Cơ hội phát triển: F88 cam kết cho bạn nền tảng vững chắc để học hỏi và phát triển Tham gia đào tạo bài bản, chuyên nghiệp từ Học viện F88 Sẵn sàng trao quyền, cơ hội đột phá cho nhân viên",Senior Data Analyst,Hà Nội,"Yêu Cầu Công Việc Tốt nghiệp Đại học các chuyên ngành về Công nghệ thông tin, Dữ liệu… Có tối thiểu 02 năm kinh nghiệm làm việc tại vị trí tương đương Có tư duy về dữ liệu và đam mê về phân tích dữ liệu Có hiểu biết, kiến thức về xây dựng báo cáo Dashboard, phân tích dữ liệu đa chiều Có kiến thức cơ bản về công cụ truy vấn dữ liệu (SQL) và các hệ thống dữ liệu có cấu trúc như Oracle, MySQL, MSSQL, PostgreSQL... Có kinh nghiệm sử dụng một trong số các ngôn ngữ xử lý, tổng hợp và phân tích dữ liệu như Python, R hoặc Julia Có kỹ năng tốt với MS Office như Excel, Word, PowerPoint hoặc các sản phẩm của Google Office (Sheet, Slide...)",Lương: 22 Tr - 30 Tr VND,18-12-2023
LOTTE FINANCE VIETNAM,"Mô tả Công việc Performance Management - Review daily/monthly/quarterly financial and business reports of sales team, track performance and analyze variance to targets. - Forecast sales performance and assign monthly target for sales team. - Cooperate with Sales Heads to implement measures to boost up sales performane in order to achieve full-year targets. - Analyze the performance and profitability of Telesales database. Productivity Management - Monitor the productivity of the sales force, prepare analytical reports. - Supervise sales incentive and bonus calculation. - Review and refine incentive scheme and award programs in order to increase the productivity, run financial model to estimate the impact of policy change. - Formulate KPIs and other metrics to measure the productivity of the sales force. Keep track of sales' KPIs. Strategic Planning - Work with Sales Heads to build annual budget - Follow up with Sales Heads to plan marketing and promotional programs to push sales, control monthly sales expense Others - In charge of Sales Planning operational risk, supervise process to ensure policy compliance and minimize errors - Coordinate with other functions (Ops, IT, Finance...) to set up process and automate reports. - Other adhoc reports as required.",Sales Planning Officer,Hà Nội,"Yêu Cầu Công Việc - Bachelor's degree in Economics/Business Administrations/Finance - Analytical, modelling and numerical skills, Excel, Powerpoint, SQL/Coding is a plus - +1-2 years experience in financial reporting, analyst, data processing - Fluent in English",Lương: Cạnh tranh,21-12-2023
CÔNG TY TRÁCH NHIỆM HỮU HẠN THACO AUTO,"Mô tả Công việc Quản lý đăng ký và vận hành kỹ thuật các kênh trực tuyến, các giải pháp ứng dụng digital của Công ty; Quản lý kỹ thuật vận hành các kênh trực tuyến, các giải pháp ứng dụng digital tại Cty; Phân tích và đề xuất các giải pháp gia tăng hiệu quả hoạt động marketing trực tuyến (các kênh trực tuyến của Cty và quảng cáo trực tuyến với các đối tác). Kiểm soát chất lượng dịch vụ, hợp đồng, chính sách ban hành từ THACO AUTO với các Đối tác/nhà cung cấp giải pháp digital, quảng cáo trực tuyến cho Công ty. Thiết lập và quản lý các công cụ hỗ trợ kiểm soát hoạt động Marketing trực tuyến của các nhân sự bán hàng tuần thủ theo quy định được ban hành. Tham gia công tác lập và thực hiện chương trình marketing (truyền thông thương hiệu THACO AUTO tỉnh thành, tài trợ marketing, sự kiện) của Công ty. Biên soạn nội dung truyền thông thương hiệu THACO AUTO Tỉnh thành;",Chuyên viên Digital Marketing | Thaco Auto Đắk Lắk,Dak Lak,"Yêu Cầu Công Việc Tốt nghiệp Đại học trở lên chuyên ngành: Marketing, Kinh tế, QTKD Có kinh nghiệm trên 1 năm trong hoạt động marketing bán hàng, digital marketing; ưu tiên ứng viên có kinh nghiệm trong lĩnh vực ô tô. Am hiểu các phát triển và tối ưu các nền tảng digital như hệ thống CRM, thương mại điện tử, website/ứng dụng di động... ; Am hiểu các hoạt động marketing trực tuyến, quảng cáo trực tuyến và khả năng phân tích, đo lường, kiểm soát hiệu quả marketing trực tuyến thông qua các chỉ số, quy trình, biểu mẫu báo cáo… Thành thạo tin học văn phòng (ưu tiên ứng viên thành thạo excel và data analyst)",Lương: 8 Tr - 12 Tr VND,09-01-2024
