companyName,description,jobName,location,require,salary,timePost
Ngân Hàng TMCP Quân Đội,"Mô tả Công việc Thực hiện công việc tích hợp, phát triển dữ liệu, hỗ trợ vận hành hệ thống công nghệ dữ liệu trong mảng chức năng được giao đảm bảo đúng quy trình, quy định của MB nhằm thực hiện thành công mục tiêu chung của đơn vị. - Tự phát triển hoặc phối hợp cùng các nhà cung cấp phát triển/triển khai các giải pháp Công nghệ dữ liệu theo các công việc được phân công. - Duy trì hoạt động của các sản phẩm/dịch vụ được phân công. - Nghiên cứu, tìm kiếm, tham mưu các giải pháp/sáng kiến Công nghệ dữ liệu và đề xuất nhà cung cấp đáp ứng yêu cầu của công việc. - Phát triển, kiểm thử (Unit test), nghiệm thu và hỗ trợ mức 2 (Level 2) các sản phẩm và dịch vụ Công nghệ dữ liệu",Data Engineer - Khối Dữ liệu,Hà Nội,"Yêu Cầu Công Việc - Tốt nghiệp Cử nhân chuyên ngành Công nghệ thông tin, Điện tử viễn thông hoặc tương đương - Ưu tiên có một trong các chứng chỉ nghề quốc tế về lập trình phát triển dữ liệu về Oracle (Oracle Certified Associate (OCA), Oracle Certified Professional (OCP), Oracle Certified Master (OCM), Oracle Certified Expert (OCE) và Specialist cho Oracle Database 12c...), Netezza, BI Tableau, BI publisher, Cloud ( AWS Certified Solutions Architect, AWS Certified Developer – Associate, ...) - Toeic 450 hoặc chứng chỉ tương đương",Lương: Cạnh tranh,18-12-2023
Ngân Hàng TMCP Quân Đội,"Mô tả Công việc Thực hiện công việc tích hợp, phát triển dữ liệu, hỗ trợ vận hành hệ thống công nghệ dữ liệu trong mảng chức năng được giao đảm bảo đúng quy trình, quy định của MB nhằm thực hiện thành công mục tiêu chung của đơn vị. - Tự phát triển hoặc phối hợp cùng các nhà cung cấp phát triển/triển khai các giải pháp Công nghệ dữ liệu theo các công việc được phân công. - Duy trì hoạt động của các sản phẩm/dịch vụ được phân công. - Nghiên cứu, tìm kiếm, tham mưu các giải pháp/sáng kiến Công nghệ dữ liệu và đề xuất nhà cung cấp đáp ứng yêu cầu của công việc. - Phát triển, kiểm thử (Unit test), nghiệm thu và hỗ trợ mức 2 (Level 2) các sản phẩm và dịch vụ Công nghệ dữ liệu",Data Engineer - Khối Dữ liệu,Hà Nội,"Yêu Cầu Công Việc - Tốt nghiệp Cử nhân chuyên ngành Công nghệ thông tin, Điện tử viễn thông hoặc tương đương - Ưu tiên có một trong các chứng chỉ nghề quốc tế về lập trình phát triển dữ liệu về Oracle (Oracle Certified Associate (OCA), Oracle Certified Professional (OCP), Oracle Certified Master (OCM), Oracle Certified Expert (OCE) và Specialist cho Oracle Database 12c...), Netezza, BI Tableau, BI publisher, Cloud ( AWS Certified Solutions Architect, AWS Certified Developer – Associate, ...) - Toeic 450 hoặc chứng chỉ tương đương",Lương: Cạnh tranh,09-01-2024
Ngân hàng TMCP Thịnh vượng và Phát triển,"Mô tả Công việc - Vận hành luồng dữ liệu: + Thực hiện đồng bộ dữ liệu từ các nguồn theo tài liệu đặc tả kỹ thuật, tài liệu phân tích kỹ thuật; o Thực hiện xử lý, tổng hợp dữ liệu ở mức độ nâng cao; + Vận hành các job ETL dữ liệu; + Thiết lập các vùng lưu trữ dữ liệu theo yêu cầu đặc tả của đơn vị nghiệp vụ; + Đóng gói, triển khai dữ liệu cho môi trường UAT, Production; - Thực hiện các nhiệm vụ khác theo phân công của cấp quản lý.",Kỹ sư Dữ Liệu (Data Engineer),Hà Nội,Yêu Cầu Công Việc - Tốt nghiệp đại học trở lên các chuyên ngành phù hợp như CNTT/Điện tử viễn thông hoặc các chuyên ngành có liên quan đến CNTT; - Ưu tiên có kinh nghiệm làm việc trong lĩnh vực tài chính - ngân hàng; - Thành thạo ngôn ngữ SQL và các ngôn ngữ truy vấn dữ liệu khác; Có khả năng sử dụng ít nhất một công cụ: Confluent MinIO Kafka Iceberg Dremio; - Hiểu biết và có khả năng sử dụng công cụ trực quan hóa dữ liệu hoặc ngôn ngữ phân tích dữ liệu; - Kỹ năng Tiếng Anh đọc hiểu dữ liệu.,Lương: Cạnh tranh,11-01-2024
DatvietVAC Group Holdings,"Mô tả Công việc MỤC TIÊU CÔNG VIỆC/ JOB OBJECTIVES: Data Science Department is looking for a Data Scientist Lead to: Lead DS Team to deliver Data Platform (DP) for VieON – OTT Platform Design innovative attribution models to implement valuable metrics and better address system enhancement, user behavior Build and maintain visually appealing and engaging dashboards for stakeholders Work with Data Engineers to help define the data standards and requirements helping to ensure our systems are running correctly and efficiently. Involve in the development and evolvement of the data architecture Produce segmented views of our users for our business, and product stakeholders to drive product iterations and improvements Identify problems and propose recommendations. Focus on bringing statistical depth, analytical insights, and accurate interpretation of data. Collecting, cleaning, and preparing data at large scale for modeling. Providing insights and recommendations based on large amounts of data from various sources. Designing, conducting A/B tests, and analyzing the results for experiment insights;",Data Scientist Lead,Hồ Chí Minh,"Yêu Cầu Công Việc Degree in Computer Science or other related fields At least 2 years of experience as Lead Data Engineer/Scientist, preferably in the OTT, e-commerce, or digital industry. 2-4 years of using programming languages including Go/Python/Java/Scala Understanding of data administration and management functions (collection, analysis, distribution, etc.) Familiarity with modern database and information system technologies. Have practical experience in applying Machine Learning in personalization, deal recommendation, or user behavior analysis. Strong data visualization and storytelling skills. Experience in creating dashboards using Tableau and other visualization tools. Big Data tools: Kafka, Hadoop, Hive, Spark, Elastic Search Relational SQL and NoSQL databases: MySQL, MongoDB, Postgres, Cassandra Data pipeline and workflow management tools: Airflow Stream-processing systems: Spark-Streaming Familiar with Linux development environments and multi-threaded programming Having knowledge/Experience in crawl data is a plus Motitor server capacity and resource usage for server capacity planning is a plus Creating customized alerts to more effectively track key server capacity metrics is plus Good logical thinking Passionate about coding and programming, innovation, and solving challenging problems An analytical mindset with problem-solving skills. A team player, with brave, enthusiastic cheerful attitude",Lương: Cạnh tranh,21-12-2023
TRAN DUC GROUP - CÔNG TY CỔ PHẦN TRẦN ĐỨC,"Mô tả Công việc Data management Assess the effectiveness and accuracy of data tables in our distributed system. Provide quality assurance on the quality and accuracy of data tables. Help develop reports and analysis. Supporting Business Analysts by preparing complex/customized data tables. Work with other members (Data Engineer, Business Analyst) to implement, integrate and optimize our existing systems.",DATA ANALYST,Hồ Chí Minh,"Yêu Cầu Công Việc 1. Education Have Bachelor degree in Information Systems, Information Management or Information Technology. 2. Work experience At least 1 years of work experience in data processing, data analysis, or related fields. 3. Knowledge/ Professional skills/ Abilities Database tools: Microsoft Excel and SQL Statistical programming languages: Python or R Data visualization; Data cleaning Statistical programming Probability and Statistics Machine Learning Proficient in database design and organization Skills in using data analysis tools and basic coding to process (predictive models ) Strong analytical skills, ability to collect, organize, analyze, and communicate large amounts of information in a detailed and accurate manner Good English",Lương: Cạnh tranh,19-12-2023
Công Ty Cổ Phần VNG,"Mô tả Công việc Thiết kế, phát triển và biểu diễn các báo cáo doanh thu theo yêu cầu từ các phòng ban dựa trên nhiều các nguồn data và master data có sẵn hoặc tự thiết kế riêng theo yêu cầu. Thực hiện theo dõi, đối soát và phân tích dữ liệu để đảm bảo chất lượng báo cáo doanh thu. Đảm bảo việc vận hành, điều chỉnh và phát triển các tính năng mới theo đúng thời gian yêu cầu ban đầu.","Associate Software Engineer (Oracle, SQL)",Hồ Chí Minh,"Yêu Cầu Công Việc ﻿Bằng cử nhân về khoa học máy tính, hệ thống thông tin hay một ngành kỹ thuật liên quan Có ít nhất 1-2 năm kinh nghiệm làm việc với các hệ cơ sở dữ liệu Postgres/Oracle/Hive với vai trò Database Developer / Data Engineer Thành thạo ngôn ngữ lập trình: SQL và Python ﻿Yêu thích làm việc với số liệu một cách tỉ mỉ, cẩn thận",Lương: Cạnh tranh,08-01-2024
