companyName,description,jobName,location,require,salary,timePost
Công Ty Cổ Phần VNG,"Mô tả Công việc VNG Solutions is a subsidiary of VNG Corporation, a reputable Vietnamese provider of IT services and technology on a global scale. With its key markets in the Middle East, the US, and Europe, VNG Solutions's headquarters in Vietnam is dedicated to providing enterprise-level services and empowering customers and society to advance decisively into the digital future. VNG Solutions provides top-notch services while strictly adhering to international standards. We remain in the public eye as experts in \"the next big technologies”. VNG Solutions will provide you with a creative environment with an emphasis on B2B services, where you will have the opportunity to foster your abilities and learn about various technologies to advance your career. We are dedicated to the development and well-being of our staff members while creating a supportive work environment that allows them to reach their greatest potential. We are seeking a skilled and experienced Data Engineer to join our team. The ideal candidate will have a strong background in Azure Cloud services and Microsoft Dynamics 365. This role involves developing and maintaining scalable data pipelines, ensuring data quality, and collaborating with cross-functional teams to meet business needs. Responsibilities: Lead the design and implementation of end-to-end data solutions on the Microsoft Azure platform. Evaluate and recommend new technologies to enhance data processing capabilities. Ensure data security, privacy, and compliance with regulatory standards. Design, build, and maintain efficient, reusable, and reliable data pipelines. Should be an expert in coding and implementing data pipelines in cloud-based data infrastructure, analytical, and no-SQL databases. Leverage Azure Cloud services for data processing and storage. Integrate various data sources with Microsoft Dynamics 365. Should have experience with Data Ingestion/Data Movement, Data migration, ETL pipelines Ensure seamless flow of data between internal and external systems. Implement data quality checks and balances. Manage and optimize data storage in Azure. Mentor and guide junior data engineers in best practices and methodologies. Collaborate with stakeholders, other department to define data architecture and integration strategies. Provide technical support and training on data-related aspects. Prepare detailed documentation for data engineering processes and pipelines. Maintain records of data schemas and transformations. English proficiency in written and spoken *** Note: The position may require international travel for periods of 1 week to 3 months continuously, per year. Candidates will be required to accept this requirement as part of the positions.","Senior Azure Data Engineer, VNG Solutions",Hồ Chí Minh,"Yêu Cầu Công Việc Qualifications: Relevant experience in data factory and data bricks Bachelor degree (Advanced degree preferred) in Computer Science, Engineering, or a related field. 5 - 9 years of experience in data engineering, with a focus on Azure services. Key skills: MongoDB, ETL, Postgres, Databricks, Python, Hive, Pyspark, SQL Expertise in designing and optimizing data warehouses and data lakes on Azure. Proficient in big data technologies, such as Apache Spark and Hadoop. Familiarity with containerization and orchestration technologies (Docker, Kubernetes) Preferred to have experience with shell scripting in Bash, Unix, or Windows shell Demonstrated experience and expertise in conceptual thinking of how to apply information solutions to a business challenge Strong leadership and project management skills",Lương: Cạnh tranh,04-01-2024
DatvietVAC Group Holdings,"Mô tả Công việc II. MỤC TIÊU CÔNG VIỆC/ JOB OBJECTIVES: Data Science Department is looking for a Data Engineer Lead to: Lead DE Team to deliver Data Platform (DP) for VieON – OTT Platform Setup and maintain in-house data-warehouse, built on top of Apache Hadoop, Spark, Kafka Build scalable, durable, and extensible data models and pipeline Optimize ingestion and management of data from multiple sources Design, create, and maintain low-latency, near-real time data systems",Data Engineer Lead,Hồ Chí Minh,"Yêu Cầu Công Việc - Optimizing in-house big-data pipelines, architectures and data sets - Design, develop, automate data pipeline, data ETL, etc. on distributed data processing platform Spark - Prepare data inputs for machine learning processes: model training, testing and production deployment - End-to-end data processing, troubleshoot data-related problems and authorize maintenance or modifications. - Monitor and analyze information and data systems and evaluate their performance to discover ways of enhancing them (new technologies, upgrades etc.) - Ensure digital databases and archives are protected from security breaches and data losses. - Degree in Computer Science or other related fields - +4 years of experience as Lead Data Engineer - 2 - 4 years of using the programming languages including Go/Python, Java, Scala - Excellent understanding of data administration and management functions (collection, analysis, distribution etc.) - Familiarity with modern database and information system technologies. - Big data tools: Kafka, Hadoop, Hive, Spark, Elastic Search - Relational SQL and NoSQL databases: MySQL, MongoDB, Postgres, Cassandra - Data pipeline and workflow management tools: Airflow - Stream-processing systems: Spark-Streaming - Familiar with Linux development environments and multi-threaded programming - Have knowledge/Experience in crawl data is plus - Monitor server capacity and resource usage for server capacity planning is plus - Create customized alerts to more effectively track key server capacity metrics is plus - Good logical thinking; - Passionate about coding and programming, innovation, and solving challenging problems - An analytical mindset with problem-solving skills. - Excellent communication and collaboration skills. - Proficient in Microsoft Office - Good English communication skills - A team player, with brave, enthusiastic cheerful attitude",Lương: 50 Tr - 70 Tr VND,21-12-2023
Công ty Cổ phần Dịch vụ Di Động Trực tuyến (Ví MoMo),"Mô tả Công việc MoMo is the market leader in mobile payments in Vietnam. We strive to make life better for every Vietnamese with innovation in technology. As many parts of the business grow, we are looking for an experienced Data Engineer to join the team. At MoMo BigData AI department, we focus on Smart, Efficienct, Execellent execution and data quality which providing high quality marterial for: Business Performance, App Performance monitoring. ML products such as recommendation, personalization, risk scoring, fraud detection, promotion targeting and financial services. We are striving to build the new hydrid data platform on multiple cloud vendors helping us to better control the budget and technologies behind. What you will do With the AI-first company mission, design and build the self-serve data platform to serve people in MoMo and partner needs. They will be allocated resources based on their needs to: Ingesting multiple data sources, from batch to stream, from pull to push mechanism. Developing and deploying the resilient data pipeline in the data lake, data warehouse, and streaming data. Delivering the derived data downstream with high quality, such as BI solution (PowerBI, Google Data Studio,…), Marketing Platform, Promotion Platform, and Experiment Platform,… in multiple ways (API, Dataset, Streaming Data,…) Monitoring the data quality of data pipelines in the data platform. Monitoring and optimizing resource usage. Design and build the Data Management Systems enabling the Data Governance team and data consumers: Managing the data life cycle in the big data platform. Having MoMo data ecosystem self-exploration ability. Proving the single source of truths to multiple downstream with high quality. Managing the attribution infrastructure cost from various big projects, teams, and departments. Design and build the Data Loss Prevention (DLP) solution to protect our data and achieve data visibility in large organizations. Collaborate with Machine Learning Engineers, Data Scientists, Business Analysts, Data Analysts, Product Owners, and Product Operators to strive for greater functionality in our data systems.",Senior Data Engineer,Hồ Chí Minh,"Yêu Cầu Công Việc Love of data. You run “SELECT COUNT(SHEEP) FROM BACKYARD” during your sleep! Strong programming skills: You have 3+ years of experience as a data engineer or software engineer for data intensive applications. You have 3+ years of experience with a scripting language (Python / Java / Go / Scala) for data processing and analysis. Language: Java/Kotlin, Python, Scala, VueJs, BashScripts; Infrastructure: Google Cloud Platform, Amazon Web Service, Kubernetes, Docker; Data Warehouse: BigQuery, Oracle; Data Source: App Events, Oracle, MySQL, MSSQL, Kafka, Pubsub, REST API; Data Pipeline Orchestration: Airflow; BI: Datastudio, PowerBI; Problem-solving skills, Teamwork spirit; Experience with cloud platforms such as Google Cloud Platform or Amazon Web Service is a plus.",Lương: Cạnh tranh,31-12-2023
Công Ty CP Vàng Bạc Đá Quý Phú Nhuận - PNJ,"Mô tả Công việc 1. Xây dựng và vận hành kho dữ liệu: Làm việc với các team ERP, software, các đối tác và phòng ban chức năng để xác định luồng đi và ý nghĩa của dữ liệu Thiết kế các phương án thu thập dữ liệu, các tiêu chuẩn thu thập, đảm bảo việc thu thập và ghi nhận dữ liệu đúng và phù hợp cho việc khai thác/ứng dụng. Xây dựng, phát triển các nền tảng lưu trữ, xử lý, quản lý dữ liệu lớn (Big Data) trên hệ sinh thái Cloud Azure (MS Fabric) ,AWS,… Thiết kế, xây dựng, tối ưu hóa luồng dữ liệu, giải pháp ETL có khả năng mở rộng linh hoạt với độ tin cậy cao, phục vụ cho việc khai thác/ingest các loại dữ liệu vào Data lake, Data Warehouse. Làm việc với các team phân tích để thiết kế những bộ dữ liệu phù hợp cho hệ thống báo cáo/ dashboard. Cập nhật những thay đổi trong các bộ dữ liệu theo quá trình chuyển đổi của business và các nhu cầu khai thác Xây dựng các tài liệu liên quan đến kiến trúc và định nghĩa dữ liệu 2. Cải tiến, nâng cấp hiệu suất của kho dữ liệu: Xây dựng những kiến trúc dữ liệu phù hợp với nhu cầu từ các đội phân tích, khoa học dữ liệu, học máy và người dùng Làm việc với các team kỹ thuật công nghệ để tối ưu hóa chi phí hạ tầng, môi trường kho dữ liệu, tư vấn và xây dựng những giải pháp để dữ liệu có thể được lưu trữ nhiều hơn, đa dạng hơn, truy vấn nhanh hơn với chi phí tối ưu nhất. Kiểm soát chi phí và khả năng đáp ứng của kho dữ liệu, liên tục theo dõi, cảnh báo và xử lí nhanh nhất có thể khi có sự cố phát sinh để đảm bảo hệ thống báo cáo và các sản phẩm dữ liệu khác hoạt động trơn tru hiệu quả. 3. Minh bạch và an toàn dữ liệu: Quy hoạch & xây dựng cơ chế an toàn dữ liệu của Data Warehouse. Đảm bảo các kết nối được ổn định ,an toàn. Data được khai thác & sử dụng đúng đối tượng & phạm vi công việc. Theo dõi và cảnh báo nếu có bất kì vấn đề gì khiến dữ liệu có thể bị sai lệch, lấy cắp, dùng sai mục đích.",Senior Data Engineer,Hồ Chí Minh,"Yêu Cầu Công Việc Tốt nghiệp Đại học trở lên chuyên ngành: Công nghệ thông tin/ Kinh tế hoặc ngành khác liên quan Các học vấn khác cần cho ngành nghề: Phân tích kĩ thuật, phân tích chiến lược kinh doanh, cơ sở dữ liệu, phân tích thống kê toán. Tối thiểu 5 năm kinh nghiệm làm việc trong lĩnh vực Data Engineer Kỹ năng công việc: - Sử dụng thành thạo các ngôn ngữ phân tích dữ liệu SQL, NoSQL, Python,... - Sử dụng thành thạo các ETL Tools : SSIS, Talend,Airflow,… - Có kinh nghiệm làm việc môi trường cloud: Azure Synapse, AAS, Databrick, Azure Data Lake, Azure Data Factory - Có kinh nghiệm BI Tools (Power BI, SAP BI, Oracle BI) - Có kinh nghiệm làm việc với một trong các hệ sinh thái Hadoop, Spark, Nifi, Airflow, Kafka, Pentaho, Hive, Impala - Có kiến thức về Phân tích kĩ thuật, hạ tầng công nghệ thông tin, phần mềm ứng dụng, quản lý dự án. Yêu cầu khác : - Trung thực,ham học hỏi, chăm chỉ, không ngại khó, dám dấn thân, cầu tiến,.. - Tư duy logic; - Khả năng phân tích; - Khả năng giải quyết vấn đề Kỹ năng mềm: Có kỹ năng giao tiếp tốt ,làm việc nhóm Thông tin liên hệ: Email: Ms.Hoài Anh - anh.nth13@pnj.com.vn",Lương: Cạnh tranh,07-01-2024
Ngân Hàng TMCP Việt Nam Thịnh Vượng - VPBANK,"Mô tả Công việc Participate in data project to implement data and analytics platform for the bank Identify most optimal solution and design data pipelines Setup and configure required services on AWS Cloud to serve building data pipeline Understands the key features of the enterprise data analytics platform, its ambitions and challenges to propose best fit solution. Identify and resolve issues of the data pipelines, ensuring smooth data flow and accurate results. Develop Data API Collaborate with Ops team to manage all environment builds, including design, capacity planning, cluster setup, performance tuning and ongoing monitoring. The principal function of a developer is to make specific tasks, based on the business's specifications: Develop data pipeline serving data processing for different analytics layers Make the deploy package to implement into other environment (test, pilot, production) and check list to deployment. Writing detailed technical specification documentation Writing the document for the operation of the program by operators Manage analysis of existing data structures and identifies areas for efficiency improvements Updating, repairing, modifying and developing existing development Providing the knowledge to make the best solution of the business development Investigate and troubleshoot for issues, incidents and problems of application as level 3 support Study the technical updates and make the change or do upgrading release in Development area Follow the EDA processes (development, operation) and Bank processes",Data Engineer - Hanoi - TA139,Hà Nội,"Yêu Cầu Công Việc A bachelor's degree in computer science, information systems, or equivalent work experience, is required 3-5 years working as Cloud Data Engineer Proven skill of developing and tuning code in Spark for data processing in Data Lake, Data Warehouse, Data Engines etc. Proven skill of developing and deploying Dbt for data transformation Strong track record of implementing AWS services in a variety of distributed computing environments. Knowledge of the primary AWS services such as EKS, EC2, Redshift, S3 etc… Hands on experiences with BI tools such as Power BI or similar Be familiar with modern software development practices. (CI/CD, TDD etc.) An understanding of bank business domain is preferred. 3+ year experience in design data model and developing data pipeline Strong relational database knowledge with SQL Server, Oracle or similar Experience withdata analysis and modeling skills on analytics platform such as Databricks or similar is desired. Experience building Test and Monitoring pipeline is a plus Understanding analytical models is a plus Excellent verbal and written communication skills Teamwork, careful, attention to detail, logical thinking Innovation and experimentation driven mindset Problem solving thinking ability",Lương: Cạnh tranh,09-01-2024
Công Ty Cổ Phần VNG,"Mô tả Công việc VNG Solutions is a subsidiary of VNG Corporation, a reputable Vietnamese provider of IT services and technology on a global scale. With its key markets in the Middle East, the US, and Europe, VNG Solutions's headquarters in Vietnam is dedicated to providing enterprise-level services and empowering customers and society to advance decisively into the digital future. VNG Solutions provides top-notch services while strictly adhering to international standards. We remain in the public eye as experts in \"the next big technologies”. VNG Solutions will provide you with a creative environment with an emphasis on B2B services, where you will have the opportunity to foster your abilities and learn about various technologies to advance your career. We are dedicated to the development and well-being of our staff members while creating a supportive work environment that allows them to reach their greatest potential. We are seeking a skilled and experienced Data Engineer to join our team. The ideal candidate will have a strong background in Azure Cloud services and Microsoft Dynamics 365. This role involves developing and maintaining scalable data pipelines, ensuring data quality, and collaborating with cross-functional teams to meet business needs. Responsibilities: Design, develop, and maintain data pipelines and ETL processes on Microsoft Azure. Collaborate with cross-functional teams to gather and understand data requirements. Implement data solutions that align with business objectives and comply with data governance standards. Optimize and troubleshoot existing data infrastructure for performance and scalability. Stay updated on industry best practices and emerging technologies in data engineering. Will create and support Azure Data Factory pipelines. Will integrate end to end data pipelines to take data from data source to target data repositories ensuring the quality and consistency of data. Will create and support Azure Data Factory pipelines. Will integrate end to end data pipelines to take data from data source to target data repositories ensuring the quality and consistency of data. English proficiency in speaking, communication *** Note: The position may require international travel for periods of 1 week to 3 months continuously, per year. Candidates will be required to accept this requirement as part of the positions.","Azure Data Engineer, VNG Solutions",Hồ Chí Minh,"Yêu Cầu Công Việc Qualifications: Bachelor's degree in Computer Science, Engineering, or a related field. 3+ years of experience in data engineering, with a focus on Azure services. Proficiency in SQL, Python, and other relevant programming languages. Experience with Azure Data Factory, Azure Databricks, and other Azure data services. Strong problem-solving and communication skills. Experience with Azure Synapse Experience in Cloud-based solutions. Solid understanding and experience working with GIT. Good understanding of Microsoft ETL tools (Azure Databricks, Azure Data Factory, Data Lake and SSIS). Experience working with structured and unstructured data. Ability to use ARM templates. Experience in working with JSON. Good understanding of Azure DevOps or Jira.",Lương: Cạnh tranh,04-01-2024
Công ty TNHH MTV Sen Vàng Việt Nam,"Mô tả Công việc • Tìm hiểu, Phân tích, tư vấn dựa vào kinh nghiệm thực tế của bản thân về những trường dữ liệu cần thiết để triển khai hệ thống ERP của công ty bao gồm tất cả các phân hệ Nhân Sự, Mua hàng, Kế Toán, Quản Lý Sản Xuất. Quản lý kho, Giá thành… • Xác định và thu thập dữ liệu từ nhiều nguồn khác nhau, bao gồm cả cơ sở dữ liệu nội bộ, API, và dữ liệu bên ngoài. • Chuẩn hóa và xử lý dữ liệu để đảm bảo tính nhất quán, độ chính xác và độ đầy đủ. • Xây dựng và triển khai các quy trình ETL để di chuyển và biến đổi dữ liệu từ nguồn đến cơ sở dữ liệu đích. Đảm bảo tính nhất quán và hiệu suất của quy trình ETL • Tối ưu hóa hiệu suất của hệ thống xử lý dữ liệu để đảm bảo thời gian phản hồi nhanh chóng. • Hỗ trợ các nhóm phân tích dữ liệu và xây dựng các báo cáo và trực quan hóa dữ liệu. • Nghiên cứu và áp dụng công nghệ mới để cải thiện quy trình xử lý dữ liệu trong hệ thống ERP. • Tham gia vào các dự án nghiên cứu và phát triển của công ty • Chịu trách nhiệm báo cáo công việc theo tuần tháng năm với cấp quản lý",Data Engineering,Hồ Chí Minh,"Yêu Cầu Công Việc • Bằng cử nhân hoặc cao hơn trong lĩnh vực Khoa học Dữ liệu, Công nghệ thông tin, hoặc các chuyên ngành tương đương. • Có kinh nghiệm làm việc trong lĩnh vực Data Engineering/Analysits để triển khai các dự án ERP của công ty sản xuất • Hiểu biết vững về các công cụ và ngôn ngữ lập trình liên quan đến xử lý dữ liệu như SQL, Python, và các công cụ ETL như Apache NiFi hoặc Apache Airflow. • Kỹ năng làm việc với cơ sở dữ liệu như SQL, MySQL, PostgreSQL, MongoDB • Kiến thức về các nguyên tắc và kỹ thuật của việc xử lý và lưu trữ dữ liệu lớn (Big Data). • Khả năng giải quyết vấn đề và làm việc hiệu quả trong môi trường đòi hỏi tính chủ động. • Làm việc bằng cái tâm với lòng đam mê, trách nhiệm, và tận tâm đối với công việc mà bạn đang thực hiện Quyền lợi được hưởng: • Mức lương: Thỏa thuận • Chính sách, chế độ lao động: BHXH, BHYT, BHTN, ... • Lương tháng 13 • Nghỉ mát 1 lần/năm • Chế độ phúc lợi: lễ tết, cưới...",Lương: Cạnh tranh,08-01-2024
Ngân Hàng TMCP Việt Nam Thịnh Vượng - VPBANK,"Mô tả Công việc 1. Phân tích yêu cầu, tổ chức thiết kế dữ liệu từ các nguồn khác nhau về các phân vùng dữ liệu tương ứng theo kiến trúc dữ liệu toàn hàng. 2. Xây dựng luồng xử lý dữ liệu dựa trên kiến trúc dữ liệu toàn hàng để đảm bảo các yêu cầu khai thác dữ liệu cho báo cáo, phân tích, trao đổi dữ liệu, cũng như các mô hình AI/ ML. 3. Phân tích xử lý lỗi trong quá trình vận hành. Thực hiện các phương thức phân tích logic và kỹ thuật để cải thiện chất lượng xử lý dữ liệu cũng như hiệu năng hệ thống. 4. Tư vấn cho các đơn vị liên quan (Data Architecture, BI, Data Scientist …) để xây dựng các bộ dữ liệu có thể phục vụ cho khai phá dữ liệu, chạy mô hình cũng như xây dựng các báo cáo phân tích. 5. Chủ động nghiên cứu các công nghệ mới phục vụ cho việc tối ưu, giải quyết các khó khăn trong công việc.",Data Engineer - Hà Nội - TA083,Hà Nội,"Yêu Cầu Công Việc Đại học hoặc cao hơn liên quan đến 1 trong các ngành công nghệ thông tin, điện tử viễn thông, hoặc toán tin ứng dụng... Có 4 năm trở lên có kinh nghiệm ở vai trò Kỹ sư Dữ liệu hoặc vai trò tương đương. Có kinh nghiệm thiết kế mô hình dữ liệu theo các mô hình chuẩn hóa đa dạng (ưu tiên biết banking data model) chi tiết tầng dữ liệu với các hệ quản trị cơ sở dữ liệu khác nhau (SQL Server, Oracle, DB2, Postgre, Redshift v.v…) Có kinh nghiệm cũng như kiến thức nghiệp vụ nhất định về nghiệp vụ và hệ thống trong ngân hàng. Có kinh nghiệm tổng hợp dữ liệu cho các hệ thống dữ liệu: Data Warehouse/ Data LakeHouse/ Data Product bằng các công cụ và dịch vụ on-premise và on cloud (Datastage, ODI, Glue, EMR, Kafka, DBT v.v…). Có kiến thức sâu và kinh nghiệm thực tế với các ngôn ngữ lập trình (SQL, Python, Spark..). Ưu tiên biết thêm về các ngôn ngữ lập trình ứng dụng như Javascript, Java, .Net v.v.. Có kinh nghiệm triển khai thực tế với các hệ thống IBM DWH, AWS, Databricks là 1 điểm cộng. Có chứng chỉ về Data engineer là 1 điểm cộng (IBM Certified Data Engineer, AWS Database Speciality, AWS Data & Analytic Speciality). Truy vấn, tổ chức, phân tích dữ liệu Phân tích yêu cầu nghiệp vụ Kiểm thử dữ liệu và phần mềm Quyền lợi: - Thu nhập hấp dẫn, lương thưởng cạnh tranh theo năng lực (16-18 tháng lương/năm) - Thưởng các Ngày lễ, Tết cạnh tranh - Được vay ưu đãi với lãi suất hấp dẫn theo quy định của ngân hàng - Chế độ ngày phép 14-16 ngày phép/năm theo cấp bậc - Bảo hiểm sức khỏe VPBank care cho CBNV theo cấp bậc - Được tham gia các khóa đào tạo tùy thuộc vào Khung đào tạo cho từng vị trí - Môi trường làm việc năng động, thân thiện, có nhiều cơ hội học đào tạo, học hỏi và phát triển; được tham gia nhiều hoạt động văn hóa thú vị (cuộc thi về thể thao, tài năng, hoạt động teambuiding...) - Thời gian làm việc: Từ thứ 2 – thứ 6 & 02 - 03 sáng thứ 7",Lương: Cạnh tranh,02-01-2024
