companyName,description,jobName,location,require,salary,timePost
Công Ty TNHH Trang Thiết Bị Nha Khoa,"Mô tả Công việc Develop optimization strategies that increase the company's search engine results rankings Execute tests, collect and analyze data and results, identify trends and insights in order to achieve maximum ROI Manage the expenses of SEO campaigns, staying on budget, estimating monthly costs and reconciling differences Work with editorial and marketing teams to drive SEO in content creation and content marketing Research SEO keywords to use throughout the company's website and marketing materials Set measurable goals that demonstrate improvement in marketing efforts Monitor daily performance metrics to understand SEO strategy performance Efficiently communicate with other marketing professionals to align goals Collaborate with others within the marketing department to manage SEO strategy Write compelling and high-quality website content, including blog posts and page descriptions Update content and website links for maximum optimization and search engine rankings",Digital Marketing Executive - SEO expert,Hồ Chí Minh,"Yêu Cầu Công Việc Qualifications and requirements Two to three years of experience in successfully developing and executing SEO campaigns Understand Website structure, meta tagging, source code and how to optimize Experience with SEO and SEM industry programs and tools. Experience with Google’s Keyword Tool. Knowledge of keyword research and data mining tools A functional understanding of HTML, CSS, EEAT Regularly keep updated with Google policies and systematic changes Have experience in appeal for penalty cases by Google, Facebook Able to complete competitive analysis of other companies within the industry Familiarity with WordPress or other content management systems The ability to work with back-end SEO elements such as .htaccess, robots.txt, metadata, site speed optimization, and related skills Proven success in link building and referral strategies Experience in building inbound organic search traffic and improving SERPs A background in creating reports showing web analytics data and site evaluations with Google Analytics Having SEO experience in Healthcare, Pharma, Dental Clinic is a plus A solid grasp of how blogging, content, image, web structure, backlinks, social media, and related strategies go hand-in-hand with SEO Knowing and having experience about other Digital Marketing Tool is a big plus: Facebook, Youtube, Tiktok, Display Network, Affiliate Marketing.",Lương: 14 Tr - 18 Tr VND,29-12-2023
Công Ty Cổ Phần VNG,"Mô tả Công việc Serve as the lead business development point to negotiate and convince partners (Global Key Accounts) to cooperate and integrate with ZaloPay Serve as the lead point of contact for all merchants (MC) account matters. Identify and plan for the growth among existing merchants. Liaise with cross-functional internal teams to improve MC performances via campaigns & initiatives. Monitor and manage campaigns/ initiatives planned to achieve best performance needed. Collaborate with Merchant Marketing team, Data analyst, RnD, Plan & Strategy, Product team to achieve KPIs while keeping our Merchant satisfied and engaged with ZaloPay",Business Development Executive (ZaloPay - Global Partnership),Hồ Chí Minh,"Yêu Cầu Công Việc At least 1-3 years of experiences with Business Development/ Account Managenent roles, preferred in enterprise software or consumer technology Demonstrate critical thinking skills, ability to influence key stakeholders Proven ability to juggle multiple account management projects at a time, while maintaining sharp attention to detail. Excellent listening, negotiation and presentation skills in English Self-starter, growth and ownership mindset",Lương: Cạnh tranh,16-12-2023
Coca-Cola,"Mô tả Công việc Develop & Build Strategy of Manufacturing leading to Excellence. Lead and manage the overall operations of the manufacturing plant across the country. The role is also accountable for lean manufacturing, QSE, productivity and GMP to manage optimization. Ensuring an optimal maintenance management of equipment and facilities Nationwide based on standards, policies, and procedures to ensure the availability and correct operation of plants and equipment as well as promoting a safety work environment. Manage the implementation of all major and strategic Project of Supply Chain in support to the company business plan and Corporate strategies. Key Responsibility: Prioritized Responsibilities: Lead according to Business Plan and functional guidelines the general strategy for manufacturing along with Supply Chain COEs (QSE, Maintenance, SC Excellence, Supply Planning) and Logistics towards best assets and resource utilization, providing product availability to commercial. Responsible for continuous improvement & maintenance practices & drive implementation and evolution. Ensure that plants operate with social responsibility, safety and regulatory standards by developing local initiatives. Responsible for optimizing manufacturing cost per case for the country, driving productivity targets and production plan compliance Drive capability building, automation/ digitalization of manufacturing processes, multiskilling, Innovation in line with emerging trends & share best practice of the countries to the Network Drive manpower productivity & journey towards plant 100 concept Responsible for managing SPR capital expenditure in manufacturing for continuous improvement & compliance. Ensure all facilities operate in compliance with TCCC requirements on local country specific laws. Develop & Build strategy for manufacturing Analysis: Creative thinking to identify the right supply chain strategic pathways, priorities, and approaches to ensure success. Continuously evolving and creating new processes and methodologies to manage or improving and adopting where possible. Analytical thinking – summarizing the information available from current state, metrics or known best practice. Identifying the options and resources, costs and timelines required to execute. Provide direction on best option and removing barriers to enable execution. Supporting planning managers, engineering teams and Supply Chain Heads to create supply strategies that meet business objectives. Problem-solving – identify root causes in supply chain issues (supply issues, supplier failures, process failures, capability delta, Business Continuity Plan issues, etc.) recognize trends and collaborates with teams to generate sustainable solutions. Relationship management – building and maintaining effective relationships, identifying, and settling issues as they occur with procurement partners, other functions, geography team, etc. Financial review of negotiation analysis, and material and operating budgets. Project Management- apply a systematic project management approach to ensure the execution of specific activities to achieve a specific desired goal or result. Change management-apply a systematic approach to the implementation of new approaches or development of new behaviors to ensure sustained improvement of specific initiatives. Virtual teams' management-Apply specific approaches to engage and manage an extended team. Cultural intelligence-Ensure awareness of cultural differences to fully engage with team members from different nationalities.",National Manufacturing Excellence Director,Hồ Chí Minh,"Yêu Cầu Công Việc Minimum of 10 years progressive experience in a combination of demand planning, production planning/scheduling, logistics, inventory control, purchasing, customer service, commercialization, import/export, and manufacturing management activities. 5+ years Leadership Team experience 3+ years in Manufacturing desirable ***Please note that by submitting an application to us, you consent to our processing of personal data about you that is provided by you and otherwise lawfully collected by us (which may include sensitive data) for our company's recruitment purpose. Where you provide us personal data of others, you further undertake that we are permitted to receive and process such data for the purpose for which you provided it. You may send your queries or request for support concerning our personal data processing activities to hrvn(at)coca-cola.com.vn. To better understand our personal data processing practices, please visit www.swirecocacola.com/en/Others/Privacy-Policies.html to the full Privacy Policy of Coca-Cola Beverages Viet Nam Limited.",Lương: Cạnh tranh,09-01-2024
LG - VINA Cosmetics,"Mô tả Công việc - Implement and monitor of manufacturing cost in respect of expenses, materials procurement and utilization - Generate and follow up production and other inventory analysis reports - Responsible for reporting plant business performance, compare with budget (annual estimates), report and investigate variances Working at Factory in Nhon Trach industrial zone, Dong Nai province For HCMC cases, we have the mini bus for transferring",COST ANALYST,Đồng Nai,"Yêu Cầu Công Việc - Bachelor's or Master's degree in Finance, Accounting or related field - Have 3-5 years experiences in manufacturing cost, data analysis, data processing - Be excellence in Excel and good in MS Office - Be good English in verbal and writing - Experience with the accounting systems (especially SAP) - Be careful, responsible, confidential oriented, hardworking, team-work",Lương: Cạnh tranh,11-01-2024
Công Ty Cổ Phần VNG,"Mô tả Công việc Thiết kế, phát triển và biểu diễn các báo cáo doanh thu theo yêu cầu từ các phòng ban dựa trên nhiều các nguồn data và master data có sẵn hoặc tự thiết kế riêng theo yêu cầu. Thực hiện theo dõi, đối soát và phân tích dữ liệu để đảm bảo chất lượng báo cáo doanh thu. Đảm bảo việc vận hành, điều chỉnh và phát triển các tính năng mới theo đúng thời gian yêu cầu ban đầu.","Associate Software Engineer (Oracle, SQL)",Hồ Chí Minh,"Yêu Cầu Công Việc ﻿Bằng cử nhân về khoa học máy tính, hệ thống thông tin hay một ngành kỹ thuật liên quan Có ít nhất 1-2 năm kinh nghiệm làm việc với các hệ cơ sở dữ liệu Postgres/Oracle/Hive với vai trò Database Developer / Data Engineer Thành thạo ngôn ngữ lập trình: SQL và Python ﻿Yêu thích làm việc với số liệu một cách tỉ mỉ, cẩn thận",Lương: Cạnh tranh,08-01-2024
CÔNG TY TNHH PER-FECTIV VIỆT NAM,"Mô tả Công việc A. OVERVIEW OF THE ROLE: A Planning Manager provides an ideal environment for strategic & creative show development. He/ She liaises closely with Project Leader & clients to ensure that the creative & efficient delivery of event show well meets clients' expectation. B. ROLE AND RESPONSIBILITIES: 1. Planning (20%): - Working closely with client/Project Leader to deeply understand & identify client's briefs. - Preparing, presenting & selling strategies, communication plans, creative concepts & execution plans to clients. - Being capable to add values to the daily job to control the strategic direction, communication plan, creative concept & execution plan. - Evaluating ideas in the internal review sessions. 2. Show Development: - Guiding the team to develop storyline of performances, video clips, visuals following the show contents. - Direct/instruct the art direction for creative & film designers to ensure the quality & consistency of art & project concept. - Instruct & supervise the external show producers/specialists to develop event concept & bring it to the real show on stage. - Reviewing all final results & suggest improvements if required. 3. People Management: - Leading, inspiring & driving the team to generate outstanding & efficient concept, engagement activities, etc. - Developing the team by coaching & training team member to improve skills. - Building the teamwork spirit; making evaluations of performance of the staff. - Contributing in internal working process improvement. 4. Studying: - Research and study new trends or innovative case studies in Advertising & Communications that have been done locally or globally.",Plannning Manager (Mới),Hồ Chí Minh,"Yêu Cầu Công Việc C. QUALIFICATION & EXPERIENCES: - Bachelor’s degree. - At least 3-year experience in the same position in Event & Activation industry. - Experience across various marketing disciplines, e.g. events, activation, sales promotion, digital is an advantage. - Solid working experience in one of leading below the line agencies. D. SKILLS: 1. Soft skills: - Good time management & organizational skills. - A positive & strong leader. - Possess excellent presentation skills. - Excellent troubleshooting & solution-finding skills in terms of staff & projects. - Aesthetic, adaptable, tenacious, systematic, innovative & insightful. - Analysis, Problem Assessment: Strong Computer and Analytical Acumen and able to data mine and secure relevant information, identifying key issues and relationships from a knowledge base, relating and comparing data from different sources; Critical thinking that utilizes logic to link through ideas into strong and in-depth strategies 2. Competency skills: - Having solid knowledge of branding, marketing & technical trends. - Good written skill, particularly in relation to proposals & presentation. - Good English in verbal & written communication. - Creativity: Thinking out of the box - Having own style, clear attitude & point of view. - Business acumen - Having experience in good managing integrated Marketing campaign. - Having result-driven mindset with attention to detail. - Being passionate & driven in everything you do & filtering that approach through the teams & the organization as a whole. - Ability to manage client’s expectation & deliverables",Lương: Cạnh tranh,12-01-2024
Công Ty Cổ Phần VNG,"Mô tả Công việc Develop and implement business plans to meet monthly, quarterly, and annual targets. Negotiate and convince partners (Retail Key Accounts) to cooperate and integrate with ZaloPay. Conduct market research and analysis on customers, competitors, and the market in order to propose suitable recommendations aligned with the organization's overall objectives. Proactively build and manage relationships with Merchants and their key personnel to become a trusted partner for our clients. Manage the business side for development, enhancements or change requests with the Merchants and supporting the internal teams Identifying and developing opportunities with existing Merchants Collaborate with Merchant Marketing team, Data analyst, Plan & Strategy, Product team to achieve KPIs while keeping our Merchant satisfied and engaged with ZaloPay.","Senior Business Development Executive, ZaloPay (Hunting/Retail)",Hồ Chí Minh,"Yêu Cầu Công Việc At least 4 years experiences with Hunter roles, candidates who have background of Retail, POS, eCommerce, or Banking will be a plus Actively manage tasks, including: KPI Planning, Marketing Planning and Following up with execution ... Demonstrable ability to communicate, present and influence key stakeholders at all levels of an organization. Proven ability to juggle multiple account management projects at a time, while maintaining sharp attention to detail. Excellent listening, negotiation and presentation, ability to work under pressure, excellent communication skills, teamwork, leadership, high adaptability, self-motivation, and able to inspire others.",Lương: Cạnh tranh,09-01-2024
Techtronic Industries Vietnam (TTI),"Mô tả Công việc Solution design and solution architecting ▪ Conduct requirement study and suggest feasible technical solution alternatives ▪ Designing the technical solution alternatives ▪ Defining the architecture of the software solution and integration ▪ Develop solutions for continuous improvement projects Project management and execution ▪ Work with group IT Enterprise Application team to Design, Develop, Test and Implement system configuration or software development in compliance with Oracle standards (EBS and Database). ▪ Working with business users to develop the use cases, test data and test scenarios to validate the software solutions ▪ Build solutions that conform to ERP standards of data definition, data usage and data validation rules. ▪ Working with other IT members to develop the system procedure to map to ERP standard system flow ▪ Prepare project documentation with quality requirements ▪ Develop integration solutions that ensure the data integrity between the ERP & other systems",IT – Application Assisstant Manager (Oracle EBS),Hồ Chí Minh,"Yêu Cầu Công Việc II. Requirements: General Qualification ▪ Good communication skill and good teamwork spirit ▪ Good problem-solving skill and systematic mindset ▪ Solid working experience of enterprise applications including ERP / Supply Chain / systems integration ▪ Eager to learn and proactive thinking ▪ Willing to work under pressure and commit to assigned tasks. ▪ People live in Binh Duong Province is preferred Experience Qualifications: ▪ Degree in IT or related discipline required ▪ Over 5 years of IT experience in supporting ERP applications, especially experience in cross functional implementation. ▪ Minimum 3 years of Oracle ERP technical working experience. ▪ Strong hands on experience with Oracle functions, procedures, triggers, package and performance tuning ▪ Any other programming skills is advantage - Java, BI tools or any popular IT tools. ▪ Less working experience but having solid Oracle ERP experience would be considered as Senior Application Analyst III. Benefits: - Competitive income 13th month salary and bonus (if any). - 15 annual leaves. - Healthcare for individual - Mobile phone allowance. Working time & location: - Factories in District 9, HCM City - Mon to Fri., from 07h:30 – 16h:00",Lương: Cạnh tranh,28-12-2023
Coca-Cola Beverages Vietnam,"Mô tả Công việc (This position is 8-month temporary) • To deal with 1 or more major customers (Hyper/ supermarket or Cash & Carry or convenience stores...), ensure a profitable volume growth by delivering account specific business solution • Develop Monthly promotional programs based on Company's long term & short-term objectives, work with Region Commercial • Managers to ensure all aligned. Work with customers to ensure the programs aligned by customers and can deliver business results. Discuss and allocate fair resources among channels/regions • Customized merchandising different per channel. Build PicOS per channel. Work with brand team/ marketing team to initiate new way of merchandising. Negotiate with customers to have best merchandising execution • Working closely with channel development to develop full year plan for account development • Customer business analysis/development/management. Half year business review with key customers/ Annual business review with small customers. Work with customers on specific Joint business plans. Analyze/ review customers' volume/ margin • Deliver Key Account off premise sales volume. Work closely with Region KA teams to monitor weekly/monthly volume. • Work with customers to agree on monthly shipment plans. Manage AR • Control Key Account off premise DME • On the job training/ coaching for Merchandisers",Chuyên viên Kinh doanh - Account Executive (HCM),Hồ Chí Minh,"Yêu Cầu Công Việc – Bachelor’s degree required – 2 years of Sales/Account Executive and or Marketing experience in FMCG companies – Problem Solving, fact finding – Strategic thinking, Initiative – Selling Communication (written verbal) – English (fluent for written verbal) – Leadership influencing others – Highly focused on delivering commitments, and measuring performance of others – Rewards and celebrates success – High level of trainability – Interpersonal skills – Customer business analysis/management, Program execution management, Direct sales, Route Settlement – Merchandising Cold drink, Pricing Packaging strategy ***Please note that by submitting an application to us, you consent to our processing of personal data about you that is provided by you and otherwise lawfully collected by us (which may include sensitive data) for our company's recruitment purpose. Where you provide us personal data of others, you further undertake that we are permitted to receive and process such data for the purpose for which you provided it. You may send your queries or request for support concerning our personal data processing activities to hrvn(at)coca-cola.com.vn. To better understand our personal data processing practices, please visit www.swirecocacola.com/en/Others/Privacy-Policies.html to the full Privacy Policy of Coca-Cola Beverages Viet Nam Limited.",Lương: Cạnh tranh,08-01-2024
Coca-Cola Beverages Vietnam,"Mô tả Công việc 1) Job Summary: - Monitor the sales KPIs results - Build & monitor the incentive schemes for sales, supporting functions - Build & monitor the market visit days 2) Responsibility: - Incentive schemes to sales force & other supporting functions: · Build schemes by working with sales force & other functions · Form the alignment with all related funtions to put the schemes in place · Tracking/ checking the results · Send to HR in time · Communicate & analyse the result with Sales Regions & other functions to find chances of development · Dashboard of incentive results reporting to related functions - Monitor the Sales KPIs result (GREEN/ GOLD...). Analyze and communicate these KPIs with Sales Region & Other Functions to find chances of improvement - Organize and monitor MIT day/ ME challenge day programs. Contact & work closely with Regional MEM to track program participation, track & report program results. - Work with HR for studying turn-over rate - Co-operate with other functions to full fill the common goals of department & company - In the complex environment, there are many different ideas and opinions about the same topic. This job has to work out solutions together with all related functions. This position needs to consider ideas and opinions that are new or different from own ones. - Analyze, understand the real issues that sales are facing. - Communicate & analyse the result with Sales Regions & other functions to find chances of development - Creating an incentive program. - Contribute to renew incentive process to suit the changing business environment",Chuyên viên hiệu quả lực lượng bán hàng - SFE Executive (HCM),Hồ Chí Minh,"Yêu Cầu Công Việc - Bachelor's degree from a reputable university - 2-4 years of experience in related roles (commercial, sales) - Have capability to work and co-operate with the cross functions - Self-controlled, especially in the high pressure environment - Open-minded, willing to consider ideas and opinions that are new or different to own ones - Good at english speaking, writing and reading - Good at microsoft office (word, excel, power point) ***Please note that by submitting an application to us, you consent to our processing of personal data about you that is provided by you and otherwise lawfully collected by us (which may include sensitive data) for our company's recruitment purpose. Where you provide us personal data of others, you further undertake that we are permitted to receive and process such data for the purpose for which you provided it. You may send your queries or request for support concerning our personal data processing activities to hrvn(at)coca-cola.com.vn. To better understand our personal data processing practices, please visit www.swirecocacola.com/en/Others/Privacy-Policies.html to the full Privacy Policy of Coca-Cola Beverages Viet Nam Limited.",Lương: Cạnh tranh,08-01-2024
